id,username,text,likes,retweets,replies,total_interactions,post_date_iso,text_length,word_count,sentiment_label,link
258,GiertychRoman,"A co byłoby gdybyśmy to my sfałszowali wybory? Wyobraźcie sobie odwrotną sytuację. Rządzi PiS. Dwa badania exit wykazują zwycięstwo Nawrockiego, ale po przeliczeniu okazuje się, że wygrał minimalnie Trzaskowski. Następnie ukazują się informacje, że ludzie zorganizowani przeze mnie utworzyli kilka fikcyjnych komitetów, uzyskali nieuczciwą przewagę i opanowali większość obwodowych komisji wyborczych. Następnie zaczynają wychodzić na jaw informacje, że w komisjach opanowanych przez nas ordynarnie fałszują głosy. Starzy sędziowie SN zajmujący się sprawą utajniają wyniki przeliczeń. PKW przerażona skalą nieprawidłowości oświadcza, że wyniki jest niejasny, bo fałszerstwa mogły mieć wpływ na wynik. Wyobrażacie sobie co by się działo? Powiem wam. Wszyscy przewodniczący obwodowych komisji wyborczych gdzie ujawniono fałszerstwa siedzieliby w areszcie, dokumenty z SN zabezpieczałaby już prokuratura, zostałaby wszczęta procedura ponownego przeliczenia głosów w ramach oględzin przewidzianych przez kodeks postępowania karnego i kodeks wyborczy (art. 79 par. 4). PiS codziennie organizowałby konferencje prasowe zarzucając nam oszustwa i domagając się aresztowania sprawców. Dlaczego my dajemy się zakrzyczeć??? Przecież jest jasne, że PiS fałszował wybory. Kilka dni temu PDT zaapelował do prokuratury o wyjaśnienie sprawy i powołanie zespołu. Kiedy powstanie ten zespół? Jakie są kroki? Kiedy poznamy utajnione komisje. Obudźcie się! Oni bezczelnie oszukiwali w wyborach, a my dajemy się zastraszyć groźbami, że jak będziemy ich oszustwa badać, to nas zamkną na dożywocie za próbę zamachu stanu. Bezczelność tych gróźb nie robi na nikim wrażenia? Media wyzywają tych, którzy chcą przeliczać głosy jakbyśmy antydemokratyczną rewolucję robili, bo nie chcemy się zgodzić na to, aby demokracja oznaczała liczenie naszych głosów przez proputinowskie partyjki. Czy ABW dokonała jakichkolwiek działań wobec liderów tych partyjek? Co się z nami dzieje, że taka jakaś bezwolność nas opadła i dajemy się zakrzyczeć? Jeżeli chcemy żyć w wolnym kraju to musimy o tę wolność walczyć. Ona nigdy nie była za darmo. I na koniec do mediów. Nikt nie ma obowiązku mnie lubić, ale akceptowanie faktu, że PiS atakuje mnie ukradzionymi ze służb taśmami skrupi się na Was, a nie na mnie. Na mnie gdyby PiS coś miał, to by użyli 5lat temu, 4 lata temu, 3 lata temu, 2 lata temu lub rok temu. A skoro akceptujecie (na szczęście nie wszyscy) takie metody zastraszania i upokarzania i roztrząsacie sobie moje prywatne rozmowy to wiedzcie, że kiedyś może ktoś roztrząsać tak wasze. I zobaczycie jaka to przyjemność.",46,790,756,1592,20-06-25,2590,376,,https://nitter.net/GiertychRoman/status/1935995597187625298#m
259,an_te_k,"Czy wiecie, że w 2020 przy większej różnicy w exit pollu Ipsos stwierdził, że nie jest w stanie wskazać zwycięzcy? W tym roku nie mieli z tym problemu, bo wyszedł im Trzaskowski, i teraz wszyscy za to płacimy, oglądając meltdown wyborców RT.",4,68,9,81,20-06-25,241,42,,https://nitter.net/an_te_k/status/1936010776575115476#m
260,NigdyWiecejPiS,Sąd Najwyższy przeliczył głosy na razie w dwóch komisjach i w obu stwierdził nieprawidłowości mogące mieć wpływ na wynik wyborów. Zostało jeszcze 29 813 komisji do przeliczenia. Prezydentem zostanie Rafał Trzaskowski. 🇵🇱✌️,4,156,185,345,18-06-25,222,32,,https://nitter.net/NigdyWiecejPiS/status/1935346299684917377#m
261,poprostumic,JAKIM K... CUDEM PREZYDENT ŁODZI ZARABIA PÓŁ MILIONA ROCZNIE Dlaczego nikt o tym nie mówi?? Przecież Trzaskowski zarabia 2 razy mniej. Zrobiła sobie z miasta kompletny folwark.,2,7,10,19,20-06-25,176,27,,https://nitter.net/poprostumic/status/1935973841789923546#m
262,RepublikaTV,"Rzecznik Praw Obywatelskich przyznaje, że nie było prawnych podstaw do zmiany Prokuratora Krajowego #włączprawdę #TVRepublika tvrepublika.pl/Polska/RPO-pr…",3,69,6,78,20-06-25,155,16,,https://nitter.net/RepublikaTV/status/1936048891688022262#m
263,karol_karolix,TAK❗️❗️❗️ Wybory Prezydenckie nie były uczciwe❗️❗️❗️ Przez całą kampanię niemiecka szczujnia atakowała pro polskiego kandydata fejkami😡😡 Gdyby nie to… @NawrockiKn miałby 70% @trzaskowski_ 30%,1,23,2,26,20-06-25,191,24,,https://nitter.net/karol_karolix/status/1936056242440421572#m
264,RPasnicki,"-Licz te głosy uważnie. Na kogo? -Nawrocki. -Prawa kupka. -Na kogo? -Trzaskowski. -Pokaż. Nieważny! -Ale... -Dawaj następy. -Trzaskowski. Nieważny? -Ten niech będzie ważny. Lewa kupka... -Co wy robicie?! Tak nie wolno! -Przecież nikt się nie dowie, nie? -A zasady? -Nie ma takich!",1,110,23,134,19-06-25,280,42,,https://nitter.net/RPasnicki/status/1935750179380248806#m
265,paweljablonski_,"😀Coś pięknego! @GiertychRoman jak Safjan. Przed wyborami – kiedy sami uwierzyli w swoje kłamliwe sondaże i byli pewni, że Trzaskowski wygra: „NIE MA TECHNICZNEJ MOŻLIWOŚCI SFAŁSZOWANIA WYBORÓW” 🙃🤸",267,2012,204,2483,19-06-25,196,28,,https://nitter.net/paweljablonski_/status/1935708057834496489#m
266,Hanna64556159,"Przyjaciółka Dudy, Manowska wbrew wszystkiemu, została Prezesem SN. Pisiory wyli, że to PDT chciał domykać system, gdyby Prezydentem został R. Trzaskowski..hipokryci 😡",3,109,3,115,19-06-25,167,22,,https://nitter.net/Hanna64556159/status/1935793143720386860#m
267,GiertychRoman,"A co byłoby gdybyśmy to my sfałszowali wybory? Wyobraźcie sobie odwrotną sytuację. Rządzi PiS. Dwa badania exit wykazują zwycięstwo Nawrockiego, ale po przeliczeniu okazuje się, że wygrał minimalnie Trzaskowski. Następnie ukazują się informacje, że ludzie zorganizowani przeze mnie utworzyli kilka fikcyjnych komitetów, uzyskali nieuczciwą przewagę i opanowali większość obwodowych komisji wyborczych. Następnie zaczynają wychodzić na jaw informacje, że w komisjach opanowanych przez nas ordynarnie fałszują głosy. Starzy sędziowie SN zajmujący się sprawą utajniają wyniki przeliczeń. PKW przerażona skalą nieprawidłowości oświadcza, że wyniki jest niejasny, bo fałszerstwa mogły mieć wpływ na wynik. Wyobrażacie sobie co by się działo? Powiem wam. Wszyscy przewodniczący obwodowych komisji wyborczych gdzie ujawniono fałszerstwa siedzieliby w areszcie, dokumenty z SN zabezpieczałaby już prokuratura, zostałaby wszczęta procedura ponownego przeliczenia głosów w ramach oględzin przewidzianych przez kodeks postępowania karnego i kodeks wyborczy (art. 79 par. 4). PiS codziennie organizowałby konferencje prasowe zarzucając nam oszustwa i domagając się aresztowania sprawców. Dlaczego my dajemy się zakrzyczeć??? Przecież jest jasne, że PiS fałszował wybory. Kilka dni temu PDT zaapelował do prokuratury o wyjaśnienie sprawy i powołanie zespołu. Kiedy powstanie ten zespół? Jakie są kroki? Kiedy poznamy utajnione komisje. Obudźcie się! Oni bezczelnie oszukiwali w wyborach, a my dajemy się zastraszyć groźbami, że jak będziemy ich oszustwa badać, to nas zamkną na dożywocie za próbę zamachu stanu. Bezczelność tych gróźb nie robi na nikim wrażenia? Media wyzywają tych, którzy chcą przeliczać głosy jakbyśmy antydemokratyczną rewolucję robili, bo nie chcemy się zgodzić na to, aby demokracja oznaczała liczenie naszych głosów przez proputinowskie partyjki. Czy ABW dokonała jakichkolwiek działań wobec liderów tych partyjek? Co się z nami dzieje, że taka jakaś bezwolność nas opadła i dajemy się zakrzyczeć? Jeżeli chcemy żyć w wolnym kraju to musimy o tę wolność walczyć. Ona nigdy nie była za darmo. I na koniec do mediów. Nikt nie ma obowiązku mnie lubić, ale akceptowanie faktu, że PiS atakuje mnie ukradzionymi ze służb taśmami skrupi się na Was, a nie na mnie. Na mnie gdyby PiS coś miał, to by użyli 5lat temu, 4 lata temu, 3 lata temu, 2 lata temu lub rok temu. A skoro akceptujecie (na szczęście nie wszyscy) takie metody zastraszania i upokarzania i roztrząsacie sobie moje prywatne rozmowy to wiedzcie, że kiedyś może ktoś roztrząsać tak wasze. I zobaczycie jaka to przyjemność.",46,790,757,1593,20-06-25,2590,376,,https://nitter.net/GiertychRoman/status/1935995597187625298#m
268,czardam,"Czy ktoś mi może wyjaśnić, o czym mówi Premier @donaldtusk? Przecież polski porządek prawny nie przewiduje opcji „wycofania weta”. Prezydent NIE MOŻE wycofać weta. Wchodzimy na coraz to nowe poziomy lekceważenia prawa przez Premiera 🤡",1,56,21,78,20-06-25,234,35,,https://nitter.net/czardam/status/1936043048699363567#m
269,an_te_k,"Czy wiecie, że w 2020 przy większej różnicy w exit pollu Ipsos stwierdził, że nie jest w stanie wskazać zwycięzcy? W tym roku nie mieli z tym problemu, bo wyszedł im Trzaskowski, i teraz wszyscy za to płacimy, oglądając meltdown wyborców RT.",4,68,9,81,20-06-25,241,42,,https://nitter.net/an_te_k/status/1936010776575115476#m
270,WolnaRadio,"Tego miało nie być! Pamiętacie?! @donaldtusk Obiecywał że tego nie będzie? Pamiętacie?! Rafał @trzaskowski_ w kampanii wyborczej obiecywał, że tego nie będzie. I co?!",0,123,12,135,20-06-25,166,24,,https://nitter.net/WolnaRadio/status/1935986256607166521#m
271,annabrylka,"#UE #Mercosur wyjaśnię: - wytyczne negocjacyjne są z 1999 roku, Polska nie była wtedy w UE; - negocjacje z krajami Mercosur zakończono 6 grudnia 2024 roku, podpisaniem umowy przez @vonderleyen, która teraz będzie ratyfikowana przez UE; - cały czas czekamy kiedy oficjalnie Komisja Europejska złoży wniosek do Rady o ratyfikację (może to być jeszcze w trakcie polskiej prezydencji); - ratyfikacja odbędzie się w trybie mieszanym, a część handlowa będzie głosowana kwalifikowaną większością; - nie da się zablokować ""niektórych elementów"" umowy!!! Ratyfikacja będzie dotyczyć wynegocjowanego tekstu, który już nie podlega żadnym zmianom; - Komisja Europejska w imieniu państw członkowskich prowadzi politykę handlową (wyłączna kompetencja UE); - nikt z Polski wcześniej umowy z Mercosurem ""nie podpisywał"". Prace nad sfinalizowaniem przyspieszyły rok temu po wyborach do PE i rozpoczęciu drugiej kadencji jako szefowej KE @vonderleyen, która w tej sprawie reprezentuje interes jednego państwa - Niemiec; - teraz jest szansa na zablokowanie umowy i zbudowanie mniejszości blokującej 4 państwa reprezentujące 35% populacji UE; - do pracy @donaldtusk!",1,93,3,97,20-06-25,1146,163,,https://nitter.net/annabrylka/status/1936041264593481751#m
272,RidzioRafal,No ale przecież tak jest wedle badań nawrocki dostał mniej głosów niż powinien to samo trzaskowski ale nie przypisanych głosów więcej ma nawerocki więc powinien mieć jeszcze większą przewagę. Niech liczą i w końcu wieśniakom lewakom ukrócą mordy.,0,0,0,0,20-06-25,246,38,,https://nitter.net/RidzioRafal/status/1936060998735020287#m
273,sbalcerac,"Z życia elit postępu! 38-letni Soros Junior poślubił 47-letnią Hunę Abedin. Abedin to była asystentka Hillary Clinton. Jej pierwszym mężem był Anthony Weiner, skazany przestępca seksualny. Czy @sikorskiradek i @trzaskowski_ wysłali już życzenia młodej parze?",1,31,9,41,20-06-25,258,35,,https://nitter.net/sbalcerac/status/1936038236037824755#m
274,szef_dywizji,"Moim zdaniem to jest najlepsza wypowiedź nowego rzecznika rządu rudego ""Rafał Trzaskowski boi się konfrontacji, jest tchórzem, nie przyszedł na debatę dzisiaj"" Hahahahahahahaha",3,133,9,145,20-06-25,176,23,,https://nitter.net/szef_dywizji/status/1936031764088037619#m
275,KrzysztofS2,Histeryczna reakcja oszusta .@donaldtusk na dochodzenie oszustw wyborczych .@Platforma_org nie uchroni ich przed karą. Oszustwa w kampanii wyborczej ekipy .@trzaskowski_ Ii oszustwa ludzi tuska podczas wyborów okradly wybranego przez Polaków prezydenta .@NawrockiKn o co najmniej 10% głosów. Wkrótce odpowie karnie @donaldtusk i @Platforma_org za oszustwa i fałszerstw wyborcze!,0,0,0,0,20-06-25,378,48,,https://nitter.net/KrzysztofS2/status/1936060971887308834#m
276,MarekMa25175489,"Jak się okazuje mąż naszej Mongołki nie poleci w kosmos. Jak mi przykro tym bardziej, że to obywatel Indonezji.",0,8,3,11,20-06-25,111,19,,https://nitter.net/MarekMa25175489/status/1936046531636818093#m
277,BodniakHalina,Na czele z premierem i góra rzadu,0,0,0,0,20-06-25,33,7,,https://nitter.net/BodniakHalina/status/1936060954464129276#m
278,HubnerrMax,"Donald Tusk już jest oficjalnie szurem Giertycha. Kłamie bez przerwy. Wymyśla niestworzone historie o 800 komisjach. Trzyma w ręku Konstytucję, której nie rozumie. Apeluje do Prezydenta o WYCOFANIE weta. Niesamowity strach, desperacja i histeria upadającej władzy.",2,68,11,81,20-06-25,264,36,,https://nitter.net/HubnerrMax/status/1936044075725316218#m
279,RadekKar,"Po decyzji Sądu Najwyższego w Obwodowej Komisji Wyborczej nr 25 w Grudziądzu ponownie przeliczono głosy. Ustalono, że członkowie komisji źle zaraportowali wyniki. Z dokumentów dostarczonych przez komisję wynikało, że Karol Nawrocki zdobył 504 głosy, a Rafał Trzaskowski – 324. Ponowne przeliczenie wykazało, że wyniki zamieniono. W rzeczywistości to Rafał Trzaskowski uzyskał lepszy rezultat.",23,497,227,747,19-06-25,392,53,,https://nitter.net/RadekKar/status/1935755557282955715#m
280,CDzwoni,Nowy rzecznik rządu. Obejrzyjcie koniecznie. Tego jeszcze nie było.,20,227,121,368,20-06-25,67,9,,https://nitter.net/CDzwoni/status/1936022052298702874#m
281,karol_karolix,TAK❗️❗️❗️ Wybory Prezydenckie nie były uczciwe❗️❗️❗️ Przez całą kampanię niemiecka szczujnia atakowała pro polskiego kandydata fejkami😡😡 Gdyby nie to… @NawrockiKn miałby 70% @trzaskowski_ 30%,1,23,2,26,20-06-25,191,24,,https://nitter.net/karol_karolix/status/1936056242440421572#m
282,KarinaKrawczyk2,"Jedź, wielbłądzie.",0,0,0,0,20-06-25,18,2,,https://nitter.net/KarinaKrawczyk2/status/1936060759781359972#m
283,WolnaRadio,"Tego miało nie być! Pamiętacie?! @donaldtusk Obiecywał że tego nie będzie? Pamiętacie?! Rafał @trzaskowski_ w kampanii wyborczej obiecywał, że tego nie będzie. I co?!",0,123,12,135,20-06-25,166,24,,https://nitter.net/WolnaRadio/status/1935986256607166521#m
284,Michal_Kowanski,Mioduski i płacenie dobrych pensji jakościowym zawodnikom? To tak jak Trzaskowski i zwycięstwo w wyborach prezydenckich.,0,0,0,0,20-06-25,120,16,,https://nitter.net/Michal_Kowanski/status/1936060668140028262#m
285,EnterSandMan95,Kurwa piwniczaku jebany. Wypierdalaj do Wwa jak ci coś nie odpowiada i noś Rafalali kawę codziennie z samego rana.,0,0,0,0,20-06-25,114,19,,https://nitter.net/EnterSandMan95/status/1936060533549285870#m
286,szczygor79,szczygor79 @szczygor79 3m Replying to @trzaskowski_ @adamSzlapka,0,0,0,0,20-06-25,64,7,,https://nitter.net/szczygor79/status/1936060459586929138#m
287,WolnaRadio,"Tego miało nie być! Pamiętacie?! @donaldtusk Obiecywał że tego nie będzie? Pamiętacie?! Rafał @trzaskowski_ w kampanii wyborczej obiecywał, że tego nie będzie. I co?!",0,124,12,136,20-06-25,166,24,,https://nitter.net/WolnaRadio/status/1935986256607166521#m
288,karol_karolix,TAK❗️❗️❗️ Wybory Prezydenckie nie były uczciwe❗️❗️❗️ Przez całą kampanię niemiecka szczujnia atakowała pro polskiego kandydata fejkami😡😡 Gdyby nie to… @NawrockiKn miałby 70% @trzaskowski_ 30%,1,24,2,27,20-06-25,191,24,,https://nitter.net/karol_karolix/status/1936056242440421572#m
289,GiertychRoman,"A co byłoby gdybyśmy to my sfałszowali wybory? Wyobraźcie sobie odwrotną sytuację. Rządzi PiS. Dwa badania exit wykazują zwycięstwo Nawrockiego, ale po przeliczeniu okazuje się, że wygrał minimalnie Trzaskowski. Następnie ukazują się informacje, że ludzie zorganizowani przeze mnie utworzyli kilka fikcyjnych komitetów, uzyskali nieuczciwą przewagę i opanowali większość obwodowych komisji wyborczych. Następnie zaczynają wychodzić na jaw informacje, że w komisjach opanowanych przez nas ordynarnie fałszują głosy. Starzy sędziowie SN zajmujący się sprawą utajniają wyniki przeliczeń. PKW przerażona skalą nieprawidłowości oświadcza, że wyniki jest niejasny, bo fałszerstwa mogły mieć wpływ na wynik. Wyobrażacie sobie co by się działo? Powiem wam. Wszyscy przewodniczący obwodowych komisji wyborczych gdzie ujawniono fałszerstwa siedzieliby w areszcie, dokumenty z SN zabezpieczałaby już prokuratura, zostałaby wszczęta procedura ponownego przeliczenia głosów w ramach oględzin przewidzianych przez kodeks postępowania karnego i kodeks wyborczy (art. 79 par. 4). PiS codziennie organizowałby konferencje prasowe zarzucając nam oszustwa i domagając się aresztowania sprawców. Dlaczego my dajemy się zakrzyczeć??? Przecież jest jasne, że PiS fałszował wybory. Kilka dni temu PDT zaapelował do prokuratury o wyjaśnienie sprawy i powołanie zespołu. Kiedy powstanie ten zespół? Jakie są kroki? Kiedy poznamy utajnione komisje. Obudźcie się! Oni bezczelnie oszukiwali w wyborach, a my dajemy się zastraszyć groźbami, że jak będziemy ich oszustwa badać, to nas zamkną na dożywocie za próbę zamachu stanu. Bezczelność tych gróźb nie robi na nikim wrażenia? Media wyzywają tych, którzy chcą przeliczać głosy jakbyśmy antydemokratyczną rewolucję robili, bo nie chcemy się zgodzić na to, aby demokracja oznaczała liczenie naszych głosów przez proputinowskie partyjki. Czy ABW dokonała jakichkolwiek działań wobec liderów tych partyjek? Co się z nami dzieje, że taka jakaś bezwolność nas opadła i dajemy się zakrzyczeć? Jeżeli chcemy żyć w wolnym kraju to musimy o tę wolność walczyć. Ona nigdy nie była za darmo. I na koniec do mediów. Nikt nie ma obowiązku mnie lubić, ale akceptowanie faktu, że PiS atakuje mnie ukradzionymi ze służb taśmami skrupi się na Was, a nie na mnie. Na mnie gdyby PiS coś miał, to by użyli 5lat temu, 4 lata temu, 3 lata temu, 2 lata temu lub rok temu. A skoro akceptujecie (na szczęście nie wszyscy) takie metody zastraszania i upokarzania i roztrząsacie sobie moje prywatne rozmowy to wiedzcie, że kiedyś może ktoś roztrząsać tak wasze. I zobaczycie jaka to przyjemność.",46,791,757,1594,20-06-25,2590,376,,https://nitter.net/GiertychRoman/status/1935995597187625298#m
290,AleksZawisza,"""Sędziowie ponownie przeliczyli głosy z dwóch bielskich komisji. Nieoficjalnie: teraz w obu wygrał Trzaskowski."" Ile jest takich komisji?! #PrzeliczmyGłosy #OddajcieGłosyRafała #Siódemka bielskobiala.wyborcza.pl/bie…",14,865,110,989,18-06-25,216,22,,https://nitter.net/AleksZawisza/status/1935336090610679944#m
291,Piotr_1978_,Jeżeli @Platforma_org unieważni wybory prezydenckie będziemy na ulicy!!! Mamy dość!!! Zgadzasz się? Udostępnij!!! #RT #wybory2025 #WyboryPrezydenckie2025 #Nawrocki2025 #nawrocki,11,437,45,493,20-06-25,177,18,,https://nitter.net/Piotr_1978_/status/1935983691622498612#m
292,poprostumic,JAKIM K... CUDEM PREZYDENT ŁODZI ZARABIA PÓŁ MILIONA ROCZNIE Dlaczego nikt o tym nie mówi?? Przecież Trzaskowski zarabia 2 razy mniej. Zrobiła sobie z miasta kompletny folwark.,2,7,10,19,20-06-25,176,27,,https://nitter.net/poprostumic/status/1935973841789923546#m
293,RepublikaTV,"Rzecznik Praw Obywatelskich przyznaje, że nie było prawnych podstaw do zmiany Prokuratora Krajowego #włączprawdę #TVRepublika tvrepublika.pl/Polska/RPO-pr…",3,69,6,78,20-06-25,155,16,,https://nitter.net/RepublikaTV/status/1936048891688022262#m
294,RPasnicki,"-Licz te głosy uważnie. Na kogo? -Nawrocki. -Prawa kupka. -Na kogo? -Trzaskowski. -Pokaż. Nieważny! -Ale... -Dawaj następy. -Trzaskowski. Nieważny? -Ten niech będzie ważny. Lewa kupka... -Co wy robicie?! Tak nie wolno! -Przecież nikt się nie dowie, nie? -A zasady? -Nie ma takich!",1,110,23,134,19-06-25,280,42,,https://nitter.net/RPasnicki/status/1935750179380248806#m
295,paweljablonski_,"😀Coś pięknego! @GiertychRoman jak Safjan. Przed wyborami – kiedy sami uwierzyli w swoje kłamliwe sondaże i byli pewni, że Trzaskowski wygra: „NIE MA TECHNICZNEJ MOŻLIWOŚCI SFAŁSZOWANIA WYBORÓW” 🙃🤸",267,2012,204,2483,19-06-25,196,28,,https://nitter.net/paweljablonski_/status/1935708057834496489#m
296,Hanna64556159,"Przyjaciółka Dudy, Manowska wbrew wszystkiemu, została Prezesem SN. Pisiory wyli, że to PDT chciał domykać system, gdyby Prezydentem został R. Trzaskowski..hipokryci 😡",3,109,3,115,19-06-25,167,22,,https://nitter.net/Hanna64556159/status/1935793143720386860#m
297,czardam,"Czy ktoś mi może wyjaśnić, o czym mówi Premier @donaldtusk? Przecież polski porządek prawny nie przewiduje opcji „wycofania weta”. Prezydent NIE MOŻE wycofać weta. Wchodzimy na coraz to nowe poziomy lekceważenia prawa przez Premiera 🤡",1,56,22,79,20-06-25,234,35,,https://nitter.net/czardam/status/1936043048699363567#m
298,an_te_k,"Czy wiecie, że w 2020 przy większej różnicy w exit pollu Ipsos stwierdził, że nie jest w stanie wskazać zwycięzcy? W tym roku nie mieli z tym problemu, bo wyszedł im Trzaskowski, i teraz wszyscy za to płacimy, oglądając meltdown wyborców RT.",4,68,9,81,20-06-25,241,42,,https://nitter.net/an_te_k/status/1936010776575115476#m
299,annabrylka,"#UE #Mercosur wyjaśnię: - wytyczne negocjacyjne są z 1999 roku, Polska nie była wtedy w UE; - negocjacje z krajami Mercosur zakończono 6 grudnia 2024 roku, podpisaniem umowy przez @vonderleyen, która teraz będzie ratyfikowana przez UE; - cały czas czekamy kiedy oficjalnie Komisja Europejska złoży wniosek do Rady o ratyfikację (może to być jeszcze w trakcie polskiej prezydencji); - ratyfikacja odbędzie się w trybie mieszanym, a część handlowa będzie głosowana kwalifikowaną większością; - nie da się zablokować ""niektórych elementów"" umowy!!! Ratyfikacja będzie dotyczyć wynegocjowanego tekstu, który już nie podlega żadnym zmianom; - Komisja Europejska w imieniu państw członkowskich prowadzi politykę handlową (wyłączna kompetencja UE); - nikt z Polski wcześniej umowy z Mercosurem ""nie podpisywał"". Prace nad sfinalizowaniem przyspieszyły rok temu po wyborach do PE i rozpoczęciu drugiej kadencji jako szefowej KE @vonderleyen, która w tej sprawie reprezentuje interes jednego państwa - Niemiec; - teraz jest szansa na zablokowanie umowy i zbudowanie mniejszości blokującej 4 państwa reprezentujące 35% populacji UE; - do pracy @donaldtusk!",1,93,3,97,20-06-25,1146,163,,https://nitter.net/annabrylka/status/1936041264593481751#m
300,karol_karolix,TAK❗️❗️❗️ Wybory Prezydenckie nie były uczciwe❗️❗️❗️ Przez całą kampanię niemiecka szczujnia atakowała pro polskiego kandydata fejkami😡😡 Gdyby nie to… @NawrockiKn miałby 70% @trzaskowski_ 30%,1,24,2,27,20-06-25,191,24,,https://nitter.net/karol_karolix/status/1936056242440421572#m
301,GiertychRoman,"A co byłoby gdybyśmy to my sfałszowali wybory? Wyobraźcie sobie odwrotną sytuację. Rządzi PiS. Dwa badania exit wykazują zwycięstwo Nawrockiego, ale po przeliczeniu okazuje się, że wygrał minimalnie Trzaskowski. Następnie ukazują się informacje, że ludzie zorganizowani przeze mnie utworzyli kilka fikcyjnych komitetów, uzyskali nieuczciwą przewagę i opanowali większość obwodowych komisji wyborczych. Następnie zaczynają wychodzić na jaw informacje, że w komisjach opanowanych przez nas ordynarnie fałszują głosy. Starzy sędziowie SN zajmujący się sprawą utajniają wyniki przeliczeń. PKW przerażona skalą nieprawidłowości oświadcza, że wyniki jest niejasny, bo fałszerstwa mogły mieć wpływ na wynik. Wyobrażacie sobie co by się działo? Powiem wam. Wszyscy przewodniczący obwodowych komisji wyborczych gdzie ujawniono fałszerstwa siedzieliby w areszcie, dokumenty z SN zabezpieczałaby już prokuratura, zostałaby wszczęta procedura ponownego przeliczenia głosów w ramach oględzin przewidzianych przez kodeks postępowania karnego i kodeks wyborczy (art. 79 par. 4). PiS codziennie organizowałby konferencje prasowe zarzucając nam oszustwa i domagając się aresztowania sprawców. Dlaczego my dajemy się zakrzyczeć??? Przecież jest jasne, że PiS fałszował wybory. Kilka dni temu PDT zaapelował do prokuratury o wyjaśnienie sprawy i powołanie zespołu. Kiedy powstanie ten zespół? Jakie są kroki? Kiedy poznamy utajnione komisje. Obudźcie się! Oni bezczelnie oszukiwali w wyborach, a my dajemy się zastraszyć groźbami, że jak będziemy ich oszustwa badać, to nas zamkną na dożywocie za próbę zamachu stanu. Bezczelność tych gróźb nie robi na nikim wrażenia? Media wyzywają tych, którzy chcą przeliczać głosy jakbyśmy antydemokratyczną rewolucję robili, bo nie chcemy się zgodzić na to, aby demokracja oznaczała liczenie naszych głosów przez proputinowskie partyjki. Czy ABW dokonała jakichkolwiek działań wobec liderów tych partyjek? Co się z nami dzieje, że taka jakaś bezwolność nas opadła i dajemy się zakrzyczeć? Jeżeli chcemy żyć w wolnym kraju to musimy o tę wolność walczyć. Ona nigdy nie była za darmo. I na koniec do mediów. Nikt nie ma obowiązku mnie lubić, ale akceptowanie faktu, że PiS atakuje mnie ukradzionymi ze służb taśmami skrupi się na Was, a nie na mnie. Na mnie gdyby PiS coś miał, to by użyli 5lat temu, 4 lata temu, 3 lata temu, 2 lata temu lub rok temu. A skoro akceptujecie (na szczęście nie wszyscy) takie metody zastraszania i upokarzania i roztrząsacie sobie moje prywatne rozmowy to wiedzcie, że kiedyś może ktoś roztrząsać tak wasze. I zobaczycie jaka to przyjemność.",46,792,757,1595,20-06-25,2590,376,,https://nitter.net/GiertychRoman/status/1935995597187625298#m
