id,username,text,likes,retweets,replies,total_interactions,post_date_iso,text_length,word_count,sentiment_label,link
1,KarinaKrawczyk2,"Jedź, wielbłądzie.",0,0,0,0,20-06-25,18,2,,https://nitter.net/KarinaKrawczyk2/status/1936060759781359972#m
2,WolnaRadio,"Tego miało nie być! Pamiętacie?! @donaldtusk Obiecywał że tego nie będzie? Pamiętacie?! Rafał @trzaskowski_ w kampanii wyborczej obiecywał, że tego nie będzie. I co?!",0,122,12,134,20-06-25,166,24,,https://nitter.net/WolnaRadio/status/1935986256607166521#m
3,Michal_Kowanski,Mioduski i płacenie dobrych pensji jakościowym zawodnikom? To tak jak Trzaskowski i zwycięstwo w wyborach prezydenckich.,0,0,0,0,20-06-25,120,16,,https://nitter.net/Michal_Kowanski/status/1936060668140028262#m
4,karol_karolix,TAK❗️❗️❗️ Wybory Prezydenckie nie były uczciwe❗️❗️❗️ Przez całą kampanię niemiecka szczujnia atakowała pro polskiego kandydata fejkami😡😡 Gdyby nie to… @NawrockiKn miałby 70% @trzaskowski_ 30%,1,19,2,22,20-06-25,191,24,,https://nitter.net/karol_karolix/status/1936056242440421572#m
5,EnterSandMan95,Kurwa piwniczaku jebany. Wypierdalaj do Wwa jak ci coś nie odpowiada i noś Rafalali kawę codziennie z samego rana.,0,0,0,0,20-06-25,114,19,,https://nitter.net/EnterSandMan95/status/1936060533549285870#m
6,szef_dywizji,"Moim zdaniem to jest najlepsza wypowiedź nowego rzecznika rządu rudego ""Rafał Trzaskowski boi się konfrontacji, jest tchórzem, nie przyszedł na debatę dzisiaj"" Hahahahahahahaha",3,131,9,143,20-06-25,176,23,,https://nitter.net/szef_dywizji/status/1936031764088037619#m
7,szczygor79,szczygor79 @szczygor79 1m Replying to @trzaskowski_ @adamSzlapka,0,0,0,0,20-06-25,64,7,,https://nitter.net/szczygor79/status/1936060459586929138#m
8,paweljablonski_,"😀Coś pięknego! @GiertychRoman jak Safjan. Przed wyborami – kiedy sami uwierzyli w swoje kłamliwe sondaże i byli pewni, że Trzaskowski wygra: „NIE MA TECHNICZNEJ MOŻLIWOŚCI SFAŁSZOWANIA WYBORÓW” 🙃🤸",267,2010,204,2481,19-06-25,196,28,,https://nitter.net/paweljablonski_/status/1935708057834496489#m
9,GiertychRoman,"A co byłoby gdybyśmy to my sfałszowali wybory? Wyobraźcie sobie odwrotną sytuację. Rządzi PiS. Dwa badania exit wykazują zwycięstwo Nawrockiego, ale po przeliczeniu okazuje się, że wygrał minimalnie Trzaskowski. Następnie ukazują się informacje, że ludzie zorganizowani przeze mnie utworzyli kilka fikcyjnych komitetów, uzyskali nieuczciwą przewagę i opanowali większość obwodowych komisji wyborczych. Następnie zaczynają wychodzić na jaw informacje, że w komisjach opanowanych przez nas ordynarnie fałszują głosy. Starzy sędziowie SN zajmujący się sprawą utajniają wyniki przeliczeń. PKW przerażona skalą nieprawidłowości oświadcza, że wyniki jest niejasny, bo fałszerstwa mogły mieć wpływ na wynik. Wyobrażacie sobie co by się działo? Powiem wam. Wszyscy przewodniczący obwodowych komisji wyborczych gdzie ujawniono fałszerstwa siedzieliby w areszcie, dokumenty z SN zabezpieczałaby już prokuratura, zostałaby wszczęta procedura ponownego przeliczenia głosów w ramach oględzin przewidzianych przez kodeks postępowania karnego i kodeks wyborczy (art. 79 par. 4). PiS codziennie organizowałby konferencje prasowe zarzucając nam oszustwa i domagając się aresztowania sprawców. Dlaczego my dajemy się zakrzyczeć??? Przecież jest jasne, że PiS fałszował wybory. Kilka dni temu PDT zaapelował do prokuratury o wyjaśnienie sprawy i powołanie zespołu. Kiedy powstanie ten zespół? Jakie są kroki? Kiedy poznamy utajnione komisje. Obudźcie się! Oni bezczelnie oszukiwali w wyborach, a my dajemy się zastraszyć groźbami, że jak będziemy ich oszustwa badać, to nas zamkną na dożywocie za próbę zamachu stanu. Bezczelność tych gróźb nie robi na nikim wrażenia? Media wyzywają tych, którzy chcą przeliczać głosy jakbyśmy antydemokratyczną rewolucję robili, bo nie chcemy się zgodzić na to, aby demokracja oznaczała liczenie naszych głosów przez proputinowskie partyjki. Czy ABW dokonała jakichkolwiek działań wobec liderów tych partyjek? Co się z nami dzieje, że taka jakaś bezwolność nas opadła i dajemy się zakrzyczeć? Jeżeli chcemy żyć w wolnym kraju to musimy o tę wolność walczyć. Ona nigdy nie była za darmo. I na koniec do mediów. Nikt nie ma obowiązku mnie lubić, ale akceptowanie faktu, że PiS atakuje mnie ukradzionymi ze służb taśmami skrupi się na Was, a nie na mnie. Na mnie gdyby PiS coś miał, to by użyli 5lat temu, 4 lata temu, 3 lata temu, 2 lata temu lub rok temu. A skoro akceptujecie (na szczęście nie wszyscy) takie metody zastraszania i upokarzania i roztrząsacie sobie moje prywatne rozmowy to wiedzcie, że kiedyś może ktoś roztrząsać tak wasze. I zobaczycie jaka to przyjemność.",45,787,753,1585,20-06-25,2590,376,,https://nitter.net/GiertychRoman/status/1935995597187625298#m
10,an_te_k,"Czy wiecie, że w 2020 przy większej różnicy w exit pollu Ipsos stwierdził, że nie jest w stanie wskazać zwycięzcy? W tym roku nie mieli z tym problemu, bo wyszedł im Trzaskowski, i teraz wszyscy za to płacimy, oglądając meltdown wyborców RT.",4,67,9,80,20-06-25,241,42,,https://nitter.net/an_te_k/status/1936010776575115476#m
11,NigdyWiecejPiS,Sąd Najwyższy przeliczył głosy na razie w dwóch komisjach i w obu stwierdził nieprawidłowości mogące mieć wpływ na wynik wyborów. Zostało jeszcze 29 813 komisji do przeliczenia. Prezydentem zostanie Rafał Trzaskowski. 🇵🇱✌️,4,156,185,345,18-06-25,222,32,,https://nitter.net/NigdyWiecejPiS/status/1935346299684917377#m
12,agntwo1,Wszyscy jesteście fikcyjni i zakłamani w tej platformie.,0,0,0,0,20-06-25,56,8,,https://nitter.net/agntwo1/status/1936060121437913577#m
13,robertkozieja1,Ile procent miał Trzaskowski?,0,0,0,0,20-06-25,29,4,,https://nitter.net/robertkozieja1/status/1936060052504515067#m
14,skalpel24,"Właśnie, że się podoba się. ""W 2020 r. najwięcej głosów w pierwszej turze wyborów prezydenckich w woj. śląskim otrzymał Andrzej Duda - 41,22 proc. Drugi wynik osiągnął Rafał Trzaskowski - 31,28 proc. Frekwencja wyniosła 64,32%""",0,0,0,0,20-06-25,227,35,,https://nitter.net/skalpel24/status/1936060040558866846#m
15,AdamKAS7,"""KE zrobiła błąd, odmrażając pieniądze dla Polski po wyborze Donalda Tuska. Trzeba było czekać na reformy"" - stwierdza w rozmowie z Deutsche Welle niemiecki europoseł Moritz Körner. 😂😂😂😂😂Wyłażą kłamstwa rudzielca. !!!!",0,2,0,2,20-06-25,218,31,,https://nitter.net/AdamKAS7/status/1936046456885874816#m
16,ArkadiuszMyrcha,"Po przeliczeniu głosów w jednej z obwodowych komisji, zwyciężył jednak Trzaskowski. Sytuację potwierdził właściwy miejscowo sąd. wiadomosci.wp.pl/ponownie-pr…",17,287,495,799,19-06-25,158,17,,https://nitter.net/ArkadiuszMyrcha/status/1935803863497617741#m
17,GiertychRoman,"A co byłoby gdybyśmy to my sfałszowali wybory? Wyobraźcie sobie odwrotną sytuację. Rządzi PiS. Dwa badania exit wykazują zwycięstwo Nawrockiego, ale po przeliczeniu okazuje się, że wygrał minimalnie Trzaskowski. Następnie ukazują się informacje, że ludzie zorganizowani przeze mnie utworzyli kilka fikcyjnych komitetów, uzyskali nieuczciwą przewagę i opanowali większość obwodowych komisji wyborczych. Następnie zaczynają wychodzić na jaw informacje, że w komisjach opanowanych przez nas ordynarnie fałszują głosy. Starzy sędziowie SN zajmujący się sprawą utajniają wyniki przeliczeń. PKW przerażona skalą nieprawidłowości oświadcza, że wyniki jest niejasny, bo fałszerstwa mogły mieć wpływ na wynik. Wyobrażacie sobie co by się działo? Powiem wam. Wszyscy przewodniczący obwodowych komisji wyborczych gdzie ujawniono fałszerstwa siedzieliby w areszcie, dokumenty z SN zabezpieczałaby już prokuratura, zostałaby wszczęta procedura ponownego przeliczenia głosów w ramach oględzin przewidzianych przez kodeks postępowania karnego i kodeks wyborczy (art. 79 par. 4). PiS codziennie organizowałby konferencje prasowe zarzucając nam oszustwa i domagając się aresztowania sprawców. Dlaczego my dajemy się zakrzyczeć??? Przecież jest jasne, że PiS fałszował wybory. Kilka dni temu PDT zaapelował do prokuratury o wyjaśnienie sprawy i powołanie zespołu. Kiedy powstanie ten zespół? Jakie są kroki? Kiedy poznamy utajnione komisje. Obudźcie się! Oni bezczelnie oszukiwali w wyborach, a my dajemy się zastraszyć groźbami, że jak będziemy ich oszustwa badać, to nas zamkną na dożywocie za próbę zamachu stanu. Bezczelność tych gróźb nie robi na nikim wrażenia? Media wyzywają tych, którzy chcą przeliczać głosy jakbyśmy antydemokratyczną rewolucję robili, bo nie chcemy się zgodzić na to, aby demokracja oznaczała liczenie naszych głosów przez proputinowskie partyjki. Czy ABW dokonała jakichkolwiek działań wobec liderów tych partyjek? Co się z nami dzieje, że taka jakaś bezwolność nas opadła i dajemy się zakrzyczeć? Jeżeli chcemy żyć w wolnym kraju to musimy o tę wolność walczyć. Ona nigdy nie była za darmo. I na koniec do mediów. Nikt nie ma obowiązku mnie lubić, ale akceptowanie faktu, że PiS atakuje mnie ukradzionymi ze służb taśmami skrupi się na Was, a nie na mnie. Na mnie gdyby PiS coś miał, to by użyli 5lat temu, 4 lata temu, 3 lata temu, 2 lata temu lub rok temu. A skoro akceptujecie (na szczęście nie wszyscy) takie metody zastraszania i upokarzania i roztrząsacie sobie moje prywatne rozmowy to wiedzcie, że kiedyś może ktoś roztrząsać tak wasze. I zobaczycie jaka to przyjemność.",45,787,753,1585,20-06-25,2590,376,,https://nitter.net/GiertychRoman/status/1935995597187625298#m
18,karol_karolix,TAK❗️❗️❗️ Wybory Prezydenckie nie były uczciwe❗️❗️❗️ Przez całą kampanię niemiecka szczujnia atakowała pro polskiego kandydata fejkami😡😡 Gdyby nie to… @NawrockiKn miałby 70% @trzaskowski_ 30%,1,20,2,23,20-06-25,191,24,,https://nitter.net/karol_karolix/status/1936056242440421572#m
19,MichalOleksyn,"Jedna myśl nie daje mi spokoju. Może Trzaskowski wygrał z Dudą w 2020 wtedy też wynik był na styku. Grzeczni i liczący na uczciwość drugiej strony pomimo wygranej, przegrywają. Czas zmienić sposób myślenia. Zbyt dużo Polska i Polacy mają do stracenia.",6,449,131,586,19-06-25,251,41,,https://nitter.net/MichalOleksyn/status/1935715680109596746#m
20,Zaradkiewicz_K,"Organy państwa działają wyłączenie na podstawie konkretnych (!) przepisów, czyli „mogą tylko to co im wolno”. Byłbym wdzięczny za wskazanie przepisu, który pozwala: ♦️ Prezydentowi „wycofać” veto, ♦️ Premierowi „wycofać” kontrasygnatę ♦️ Izbie Pracy i Ubezpieczeń, Społecznych SN orzekać o wyborach, ♦️ Marszałkowi Sejmu „weryfikować” orzeczenia SN, ♦️ komukolwiek zarządzać „ponowne liczenie głosów”?",3,211,2,216,20-06-25,401,53,,https://nitter.net/Zaradkiewicz_K/status/1936043608622211398#m
21,johnsmiths74,"Tego co się dzieje w Polsce nie można oderwać od sytuacji geopolitycznej. Gratulacje dla Nawrockiego od przywódców USA, Chin i państw UE i te nasze miejscowe skurwysyny siedziały cicho. Ale po zaangażowaniu USA w konflikt na Bliskim Wsch. zwietrzyli szansę na skręcenie wyborów.",0,37,7,44,20-06-25,278,43,,https://nitter.net/johnsmiths74/status/1936045767434863086#m
22,szef_dywizji,"Moim zdaniem to jest najlepsza wypowiedź nowego rzecznika rządu rudego ""Rafał Trzaskowski boi się konfrontacji, jest tchórzem, nie przyszedł na debatę dzisiaj"" Hahahahahahahaha",3,132,9,144,20-06-25,176,23,,https://nitter.net/szef_dywizji/status/1936031764088037619#m
23,cezarypietrus,Nikt o kasę z Austriackiej firmy węgierskich przyjaciół nie prosił. Ale. Skoro badać przypływy forsy na kampanię to trzeba by sprawdzić czy nie płynęła ze wschodu i czy nie była wcześniej ukradziona z naszej społecznej kasy!,0,0,0,0,20-06-25,224,36,,https://nitter.net/cezarypietrus/status/1936059707547918699#m
24,WolnaRadio,"Tego miało nie być! Pamiętacie?! @donaldtusk Obiecywał że tego nie będzie? Pamiętacie?! Rafał @trzaskowski_ w kampanii wyborczej obiecywał, że tego nie będzie. I co?!",0,122,12,134,20-06-25,166,24,,https://nitter.net/WolnaRadio/status/1935986256607166521#m
25,CDzwoni,Nowy rzecznik rządu. Obejrzyjcie koniecznie. Tego jeszcze nie było.,20,225,121,366,20-06-25,67,9,,https://nitter.net/CDzwoni/status/1936022052298702874#m
26,karol_karolix,TAK❗️❗️❗️ Wybory Prezydenckie nie były uczciwe❗️❗️❗️ Przez całą kampanię niemiecka szczujnia atakowała pro polskiego kandydata fejkami😡😡 Gdyby nie to… @NawrockiKn miałby 70% @trzaskowski_ 30%,1,20,2,23,20-06-25,191,24,,https://nitter.net/karol_karolix/status/1936056242440421572#m
27,szef_dywizji,"Moim zdaniem to jest najlepsza wypowiedź nowego rzecznika rządu rudego ""Rafał Trzaskowski boi się konfrontacji, jest tchórzem, nie przyszedł na debatę dzisiaj"" Hahahahahahahaha",3,132,9,144,20-06-25,176,23,,https://nitter.net/szef_dywizji/status/1936031764088037619#m
28,KarinaKrawczyk2,"Jedź, wielbłądzie.",0,0,0,0,20-06-25,18,2,,https://nitter.net/KarinaKrawczyk2/status/1936060759781359972#m
29,WolnaRadio,"Tego miało nie być! Pamiętacie?! @donaldtusk Obiecywał że tego nie będzie? Pamiętacie?! Rafał @trzaskowski_ w kampanii wyborczej obiecywał, że tego nie będzie. I co?!",0,122,12,134,20-06-25,166,24,,https://nitter.net/WolnaRadio/status/1935986256607166521#m
30,Michal_Kowanski,Mioduski i płacenie dobrych pensji jakościowym zawodnikom? To tak jak Trzaskowski i zwycięstwo w wyborach prezydenckich.,0,0,0,0,20-06-25,120,16,,https://nitter.net/Michal_Kowanski/status/1936060668140028262#m
31,EnterSandMan95,Kurwa piwniczaku jebany. Wypierdalaj do Wwa jak ci coś nie odpowiada i noś Rafalali kawę codziennie z samego rana.,0,0,0,0,20-06-25,114,19,,https://nitter.net/EnterSandMan95/status/1936060533549285870#m
32,szczygor79,szczygor79 @szczygor79 1m Replying to @trzaskowski_ @adamSzlapka,0,0,0,0,20-06-25,64,7,,https://nitter.net/szczygor79/status/1936060459586929138#m
33,paweljablonski_,"😀Coś pięknego! @GiertychRoman jak Safjan. Przed wyborami – kiedy sami uwierzyli w swoje kłamliwe sondaże i byli pewni, że Trzaskowski wygra: „NIE MA TECHNICZNEJ MOŻLIWOŚCI SFAŁSZOWANIA WYBORÓW” 🙃🤸",267,2010,204,2481,19-06-25,196,28,,https://nitter.net/paweljablonski_/status/1935708057834496489#m
34,GiertychRoman,"A co byłoby gdybyśmy to my sfałszowali wybory? Wyobraźcie sobie odwrotną sytuację. Rządzi PiS. Dwa badania exit wykazują zwycięstwo Nawrockiego, ale po przeliczeniu okazuje się, że wygrał minimalnie Trzaskowski. Następnie ukazują się informacje, że ludzie zorganizowani przeze mnie utworzyli kilka fikcyjnych komitetów, uzyskali nieuczciwą przewagę i opanowali większość obwodowych komisji wyborczych. Następnie zaczynają wychodzić na jaw informacje, że w komisjach opanowanych przez nas ordynarnie fałszują głosy. Starzy sędziowie SN zajmujący się sprawą utajniają wyniki przeliczeń. PKW przerażona skalą nieprawidłowości oświadcza, że wyniki jest niejasny, bo fałszerstwa mogły mieć wpływ na wynik. Wyobrażacie sobie co by się działo? Powiem wam. Wszyscy przewodniczący obwodowych komisji wyborczych gdzie ujawniono fałszerstwa siedzieliby w areszcie, dokumenty z SN zabezpieczałaby już prokuratura, zostałaby wszczęta procedura ponownego przeliczenia głosów w ramach oględzin przewidzianych przez kodeks postępowania karnego i kodeks wyborczy (art. 79 par. 4). PiS codziennie organizowałby konferencje prasowe zarzucając nam oszustwa i domagając się aresztowania sprawców. Dlaczego my dajemy się zakrzyczeć??? Przecież jest jasne, że PiS fałszował wybory. Kilka dni temu PDT zaapelował do prokuratury o wyjaśnienie sprawy i powołanie zespołu. Kiedy powstanie ten zespół? Jakie są kroki? Kiedy poznamy utajnione komisje. Obudźcie się! Oni bezczelnie oszukiwali w wyborach, a my dajemy się zastraszyć groźbami, że jak będziemy ich oszustwa badać, to nas zamkną na dożywocie za próbę zamachu stanu. Bezczelność tych gróźb nie robi na nikim wrażenia? Media wyzywają tych, którzy chcą przeliczać głosy jakbyśmy antydemokratyczną rewolucję robili, bo nie chcemy się zgodzić na to, aby demokracja oznaczała liczenie naszych głosów przez proputinowskie partyjki. Czy ABW dokonała jakichkolwiek działań wobec liderów tych partyjek? Co się z nami dzieje, że taka jakaś bezwolność nas opadła i dajemy się zakrzyczeć? Jeżeli chcemy żyć w wolnym kraju to musimy o tę wolność walczyć. Ona nigdy nie była za darmo. I na koniec do mediów. Nikt nie ma obowiązku mnie lubić, ale akceptowanie faktu, że PiS atakuje mnie ukradzionymi ze służb taśmami skrupi się na Was, a nie na mnie. Na mnie gdyby PiS coś miał, to by użyli 5lat temu, 4 lata temu, 3 lata temu, 2 lata temu lub rok temu. A skoro akceptujecie (na szczęście nie wszyscy) takie metody zastraszania i upokarzania i roztrząsacie sobie moje prywatne rozmowy to wiedzcie, że kiedyś może ktoś roztrząsać tak wasze. I zobaczycie jaka to przyjemność.",45,787,754,1586,20-06-25,2590,376,,https://nitter.net/GiertychRoman/status/1935995597187625298#m
35,an_te_k,"Czy wiecie, że w 2020 przy większej różnicy w exit pollu Ipsos stwierdził, że nie jest w stanie wskazać zwycięzcy? W tym roku nie mieli z tym problemu, bo wyszedł im Trzaskowski, i teraz wszyscy za to płacimy, oglądając meltdown wyborców RT.",4,67,9,80,20-06-25,241,42,,https://nitter.net/an_te_k/status/1936010776575115476#m
36,NigdyWiecejPiS,Sąd Najwyższy przeliczył głosy na razie w dwóch komisjach i w obu stwierdził nieprawidłowości mogące mieć wpływ na wynik wyborów. Zostało jeszcze 29 813 komisji do przeliczenia. Prezydentem zostanie Rafał Trzaskowski. 🇵🇱✌️,4,156,185,345,18-06-25,222,32,,https://nitter.net/NigdyWiecejPiS/status/1935346299684917377#m
37,GiertychRoman,"A co byłoby gdybyśmy to my sfałszowali wybory? Wyobraźcie sobie odwrotną sytuację. Rządzi PiS. Dwa badania exit wykazują zwycięstwo Nawrockiego, ale po przeliczeniu okazuje się, że wygrał minimalnie Trzaskowski. Następnie ukazują się informacje, że ludzie zorganizowani przeze mnie utworzyli kilka fikcyjnych komitetów, uzyskali nieuczciwą przewagę i opanowali większość obwodowych komisji wyborczych. Następnie zaczynają wychodzić na jaw informacje, że w komisjach opanowanych przez nas ordynarnie fałszują głosy. Starzy sędziowie SN zajmujący się sprawą utajniają wyniki przeliczeń. PKW przerażona skalą nieprawidłowości oświadcza, że wyniki jest niejasny, bo fałszerstwa mogły mieć wpływ na wynik. Wyobrażacie sobie co by się działo? Powiem wam. Wszyscy przewodniczący obwodowych komisji wyborczych gdzie ujawniono fałszerstwa siedzieliby w areszcie, dokumenty z SN zabezpieczałaby już prokuratura, zostałaby wszczęta procedura ponownego przeliczenia głosów w ramach oględzin przewidzianych przez kodeks postępowania karnego i kodeks wyborczy (art. 79 par. 4). PiS codziennie organizowałby konferencje prasowe zarzucając nam oszustwa i domagając się aresztowania sprawców. Dlaczego my dajemy się zakrzyczeć??? Przecież jest jasne, że PiS fałszował wybory. Kilka dni temu PDT zaapelował do prokuratury o wyjaśnienie sprawy i powołanie zespołu. Kiedy powstanie ten zespół? Jakie są kroki? Kiedy poznamy utajnione komisje. Obudźcie się! Oni bezczelnie oszukiwali w wyborach, a my dajemy się zastraszyć groźbami, że jak będziemy ich oszustwa badać, to nas zamkną na dożywocie za próbę zamachu stanu. Bezczelność tych gróźb nie robi na nikim wrażenia? Media wyzywają tych, którzy chcą przeliczać głosy jakbyśmy antydemokratyczną rewolucję robili, bo nie chcemy się zgodzić na to, aby demokracja oznaczała liczenie naszych głosów przez proputinowskie partyjki. Czy ABW dokonała jakichkolwiek działań wobec liderów tych partyjek? Co się z nami dzieje, że taka jakaś bezwolność nas opadła i dajemy się zakrzyczeć? Jeżeli chcemy żyć w wolnym kraju to musimy o tę wolność walczyć. Ona nigdy nie była za darmo. I na koniec do mediów. Nikt nie ma obowiązku mnie lubić, ale akceptowanie faktu, że PiS atakuje mnie ukradzionymi ze służb taśmami skrupi się na Was, a nie na mnie. Na mnie gdyby PiS coś miał, to by użyli 5lat temu, 4 lata temu, 3 lata temu, 2 lata temu lub rok temu. A skoro akceptujecie (na szczęście nie wszyscy) takie metody zastraszania i upokarzania i roztrząsacie sobie moje prywatne rozmowy to wiedzcie, że kiedyś może ktoś roztrząsać tak wasze. I zobaczycie jaka to przyjemność.",45,787,754,1586,20-06-25,2590,376,,https://nitter.net/GiertychRoman/status/1935995597187625298#m
38,agntwo1,Wszyscy jesteście fikcyjni i zakłamani w tej platformie.,0,0,0,0,20-06-25,56,8,,https://nitter.net/agntwo1/status/1936060121437913577#m
39,robertkozieja1,Ile procent miał Trzaskowski?,0,0,0,0,20-06-25,29,4,,https://nitter.net/robertkozieja1/status/1936060052504515067#m
40,skalpel24,"Właśnie, że się podoba się. ""W 2020 r. najwięcej głosów w pierwszej turze wyborów prezydenckich w woj. śląskim otrzymał Andrzej Duda - 41,22 proc. Drugi wynik osiągnął Rafał Trzaskowski - 31,28 proc. Frekwencja wyniosła 64,32%""",0,0,0,0,20-06-25,227,35,,https://nitter.net/skalpel24/status/1936060040558866846#m
41,AdamKAS7,"""KE zrobiła błąd, odmrażając pieniądze dla Polski po wyborze Donalda Tuska. Trzeba było czekać na reformy"" - stwierdza w rozmowie z Deutsche Welle niemiecki europoseł Moritz Körner. 😂😂😂😂😂Wyłażą kłamstwa rudzielca. !!!!",0,2,0,2,20-06-25,218,31,,https://nitter.net/AdamKAS7/status/1936046456885874816#m
42,ArkadiuszMyrcha,"Po przeliczeniu głosów w jednej z obwodowych komisji, zwyciężył jednak Trzaskowski. Sytuację potwierdził właściwy miejscowo sąd. wiadomosci.wp.pl/ponownie-pr…",17,287,495,799,19-06-25,158,17,,https://nitter.net/ArkadiuszMyrcha/status/1935803863497617741#m
43,karol_karolix,TAK❗️❗️❗️ Wybory Prezydenckie nie były uczciwe❗️❗️❗️ Przez całą kampanię niemiecka szczujnia atakowała pro polskiego kandydata fejkami😡😡 Gdyby nie to… @NawrockiKn miałby 70% @trzaskowski_ 30%,1,20,2,23,20-06-25,191,24,,https://nitter.net/karol_karolix/status/1936056242440421572#m
44,MichalOleksyn,"Jedna myśl nie daje mi spokoju. Może Trzaskowski wygrał z Dudą w 2020 wtedy też wynik był na styku. Grzeczni i liczący na uczciwość drugiej strony pomimo wygranej, przegrywają. Czas zmienić sposób myślenia. Zbyt dużo Polska i Polacy mają do stracenia.",6,449,131,586,19-06-25,251,41,,https://nitter.net/MichalOleksyn/status/1935715680109596746#m
45,Zaradkiewicz_K,"Organy państwa działają wyłączenie na podstawie konkretnych (!) przepisów, czyli „mogą tylko to co im wolno”. Byłbym wdzięczny za wskazanie przepisu, który pozwala: ♦️ Prezydentowi „wycofać” veto, ♦️ Premierowi „wycofać” kontrasygnatę ♦️ Izbie Pracy i Ubezpieczeń, Społecznych SN orzekać o wyborach, ♦️ Marszałkowi Sejmu „weryfikować” orzeczenia SN, ♦️ komukolwiek zarządzać „ponowne liczenie głosów”?",3,212,2,217,20-06-25,401,53,,https://nitter.net/Zaradkiewicz_K/status/1936043608622211398#m
46,johnsmiths74,"Tego co się dzieje w Polsce nie można oderwać od sytuacji geopolitycznej. Gratulacje dla Nawrockiego od przywódców USA, Chin i państw UE i te nasze miejscowe skurwysyny siedziały cicho. Ale po zaangażowaniu USA w konflikt na Bliskim Wsch. zwietrzyli szansę na skręcenie wyborów.",0,40,7,47,20-06-25,278,43,,https://nitter.net/johnsmiths74/status/1936045767434863086#m
47,szef_dywizji,"Moim zdaniem to jest najlepsza wypowiedź nowego rzecznika rządu rudego ""Rafał Trzaskowski boi się konfrontacji, jest tchórzem, nie przyszedł na debatę dzisiaj"" Hahahahahahahaha",3,132,9,144,20-06-25,176,23,,https://nitter.net/szef_dywizji/status/1936031764088037619#m
48,cezarypietrus,Nikt o kasę z Austriackiej firmy węgierskich przyjaciół nie prosił. Ale. Skoro badać przypływy forsy na kampanię to trzeba by sprawdzić czy nie płynęła ze wschodu i czy nie była wcześniej ukradziona z naszej społecznej kasy!,0,0,0,0,20-06-25,224,36,,https://nitter.net/cezarypietrus/status/1936059707547918699#m
49,RadekKar,"Po decyzji Sądu Najwyższego w Obwodowej Komisji Wyborczej nr 25 w Grudziądzu ponownie przeliczono głosy. Ustalono, że członkowie komisji źle zaraportowali wyniki. Z dokumentów dostarczonych przez komisję wynikało, że Karol Nawrocki zdobył 504 głosy, a Rafał Trzaskowski – 324. Ponowne przeliczenie wykazało, że wyniki zamieniono. W rzeczywistości to Rafał Trzaskowski uzyskał lepszy rezultat.",23,497,227,747,19-06-25,392,53,,https://nitter.net/RadekKar/status/1935755557282955715#m
50,CDzwoni,Nowy rzecznik rządu. Obejrzyjcie koniecznie. Tego jeszcze nie było.,20,225,121,366,20-06-25,67,9,,https://nitter.net/CDzwoni/status/1936022052298702874#m
51,karol_karolix,TAK❗️❗️❗️ Wybory Prezydenckie nie były uczciwe❗️❗️❗️ Przez całą kampanię niemiecka szczujnia atakowała pro polskiego kandydata fejkami😡😡 Gdyby nie to… @NawrockiKn miałby 70% @trzaskowski_ 30%,1,20,2,23,20-06-25,191,24,,https://nitter.net/karol_karolix/status/1936056242440421572#m
52,szef_dywizji,"Moim zdaniem to jest najlepsza wypowiedź nowego rzecznika rządu rudego ""Rafał Trzaskowski boi się konfrontacji, jest tchórzem, nie przyszedł na debatę dzisiaj"" Hahahahahahahaha",3,132,9,144,20-06-25,176,23,,https://nitter.net/szef_dywizji/status/1936031764088037619#m
