id,username,text,likes,retweets,replies,total_interactions,post_date_iso,text_length,word_count,sentiment_label
710,PodkomisjaS,"Od 0:33 plany Bodnara ujawnione gdy jeszcze myślał, ze wygrał Trzaskowski. Chcieli zrobić w Polsce piekło.",3,44,3,50,"Jun 2, 2025 · 5:26 PM UTC",106,16,
711,MurzynfrogXXX,"Najważniejszym jest fakt, że Rafał Trzaskowski nie został prezydentem. Jednak trzeba przyznać, że bardzo miłym akcentem są te wszystkie wylane łzy tych którzy przegrali. Dobrej nocy.",0,19,18,37,"Jun 2, 2025 · 11:49 PM UTC",182,26,
712,hermanntertsch,"El Partido Popular, los socialistas, los comunistas y los verdes tenían en Polonia el mismo candidato, Rafael Trzaskowski, apoyado por la Comisión Europea, por los gobiernos de Berlín y de París y la casi totalidad de los medios del continente. Ha perdido. Ha sido derrotado por nuestro candidato de Ley y Justicia y del ECR que apoyarnos los PaTRIOTAS, Karol Nawrocki, nuevo presidente de Polonia. Todos ellos juntos con todos los medios y sin ningún escrúpulo contra las fuerzas nacionales y conservadoras y ya pierden siempre que no hay trampas ni anulaciones. Van a perder en todas partes en Europa y occidente porque solo hacen daño, solo mienten y no tienen razón.",17,713,54,784,"Jun 2, 2025 · 12:40 PM UTC",670,112,
713,roughrav,Każdy normalny rodzic mając takiego syna chciałby mieć go zawsze przy boku. Nie to co resortowe dziecko Trzaskowski.,0,0,0,0,"Jun 3, 2025 · 12:12 PM UTC",116,18,
714,Ewa_zodiak_ryby,,0,0,0,0,"Jun 3, 2025 · 12:12 PM UTC",0,0,
715,f_asselineau,"POLOGNE LES ESTIMATIONS SE SONT ENCORE TROMPÉES EN FAVEUR DU CANDIDAT EUROPÉISTE 2h après la fin du scrutin,elles donnaient 51% au candidat européiste Trzaskowski. En fait,c'est l'inverse: 51% pour Nawrocki. Le trucage à la moldave ou à la roumaine aurait-il foiré in extremis ?",8,916,49,973,"Jun 2, 2025 · 10:15 AM UTC",278,44,
716,Jan34733995,"03.06.1944 r. - Niemcy spalili litewską wieś Pirciupie i jej 119 mieszkańców. Rozkaz wydał Walter Titel, dowódca 16 Pułku SS i Policji. Zamordowali 21 mężczyzn, 69 dzieci i 29 kobiet.",0,2,2,4,"Jun 3, 2025 · 10:04 AM UTC",183,30,
717,Pabl3r,"No to jak z Dudą nie wygrał Trzaskowski, bo tamten przystojny. To liczyli, że wygra z Nawrockim? 🥳 Niby wykształceni, ale jednak pewne luki w logice mają. 🤡",0,0,0,0,"Jun 3, 2025 · 12:13 PM UTC",156,28,
718,p13trak,"Trzaskowski i Tusk idą na dno dzięki takim ludziom jak Pan, dlatego popieram i proszę o #wincyj",0,0,0,0,"Jun 3, 2025 · 12:12 PM UTC",95,17,
719,Renata512339531,"W 2020 roku Dworczyk pisał w mailu, że Trzaskowski wygrał z Dudą. Nikt nie kiwnął palcem!!! Trochę protestów... łyknęli tę przegraną jak pelikan rybę. Teraz też tak będzie? Kur...co to jest 300 tysięcy głosów? Dacie sobie nasrać na głowę Koalicjo? Kolejny raz?",0,83,21,104,"Jun 3, 2025 · 6:00 AM UTC",260,42,
720,Maciej_Swirski,"Wynik wyborów w Dziadkowicach, miejscowości w pobliżu Malinowa, w którym mieszkała ś.p. Filomena Leszczyńska walcząca o dobre imię Polski przeciwko dr. Janowi Grabowskiemu i prof. Barbarze Engelking. Karol Nawrocki 80,19% Rafał Trzaskowski 19,81% Stryj Pani Filomeny ocalił kilkudziesięciu Żydów, ukrywał Żołnierzy Niezłomnych, ratował sąsiadów od wywózki do Niemiec. Te okolice, niedaleko Siemiatycz i Drohiczyna to ostoja patriotyzmu i antykomunizmu .",4,1104,39,1147,"Jun 2, 2025 · 7:12 AM UTC",453,60,
721,Albert_Konopka,"Nie doczekamy się wolnej Polski, tymczasem 1 tura Trzaskowski i Nawrocki po 40% głosów emerytów, oni sami nie chcą wolnej Polski",0,0,0,0,"Jun 3, 2025 · 12:12 PM UTC",128,21,
722,m_uciechowska,"Popieram Pana wypowiedź. Jak można. Ja widziałam wspaniałą dziewczynkę pokazująca serduszka, bijącą brawo, machającą rączkami do zebranych. Cudowna, urocza dziewczynka. 🥰",0,0,0,0,"Jun 3, 2025 · 12:12 PM UTC",170,21,
723,nieryba,"Wielu nie rozumie,że to nie był konkurs piękności,tylko obstawialismy wersję przyszłości.Z Trzaskowski była oczywista i zdaniem większości stanowi zagrozenie-globalistyczna wersja świata.Z Nawrockim daje nadzieję na zmianę tej wizji,a może tylko opóźnienie,czyli czas.",0,1,0,1,"Jun 3, 2025 · 3:10 AM UTC",268,32,
724,Magdale22740227,‼Piesek globalistów - Trzaskowski.,0,36,3,39,"May 30, 2025 · 5:12 PM UTC",34,4,
725,floydgreg2,Jak siedział przy stole z @sikorskiradek i @trzaskowski_ przy piwie to z radością mało co sobie lachy nie zrobiłeś.,0,0,0,0,"Jun 3, 2025 · 12:12 PM UTC",115,19,
726,MiMichalewicz,"Zorganizowaliście bezprecedensową kampanię nienawiści, którą chcieliście podeprzeć kandydaturę skrajnego progresywisty. Przez pierwszą fazę kampanii przebraliście Trzaskowskiego w patriotyczny mundurek w celu wprowadzenia w błąd opinii publicznej. Przegraliście. Wygrała Polska",0,18,12,30,"Jun 3, 2025 · 8:00 AM UTC",277,29,
727,dominik_tomczyk,"Po której Szanowny Pan Redaktor jest stronie?! — przecież to gotowy sposób na przebudzenie reżimu, znajdującego się w stanie półsnu — pełnego świerzbiących mięśni. Chyba nie chce Pan przypadkowo przebić żadnego wrażliwego bąbla napięcia!?",0,0,0,0,"Jun 3, 2025 · 12:12 PM UTC",238,34,
728,chrzanikx,"Stanowski o tym dlaczego przegrał Trzaskowski: „Platforma nie rozumie, że to nie są czasy gdy można robić z ludzi debili”",20,755,176,951,"Jun 3, 2025 · 8:58 AM UTC",121,20,
729,MrJohnBingham,"Już po wyborach, więc możemy wrócić do afery nielegalnego finansowania kampanii wyborczej @trzaskowski_ i nielegalnych działań prowadzonych m.in. za pośrednictwem firmy Estratos oraz spółek skarbu państwa i Fundacji Twój Głos Jest Ważny. Prawda, @Adbodnar?",10,563,21,594,"Jun 3, 2025 · 7:34 AM UTC",256,34,
730,Wojtek_Hagen,"Klarembach genialny. ""Państwo wybaczą, ale wystarczy już tego bredzenia"" I wyłączył transmisję z konferencji Hołowni",0,22,2,24,"Jun 3, 2025 · 9:45 AM UTC",116,15,
731,okiemtomkaw,"Szanowny Panie Premierze @donaldtusk, Panie Prezydencie @trzaskowski_, zapraszam na wysłuchanie głosu wyborców, rozgoryczonych i sponiewieranych arogancję wielu posłów i działaczy. Większość listów kierowanych do Panów ląduje w spamie, albo jest zwyczajnie kasowana. Ja je dzisiaj publicznie odczytam, abyście Panowie mieli świadomość, do czego doprowadził brak rozliczeń PiS, indolencja pp. Bodnara i Siemoniaka i ignorowanie głosu wyborców. Zapraszam też innych polityków K15X, będzie i o Was. Vox populi vox Dei. piped.video/watch?v=d84dis_P…",1,56,9,66,"Jun 3, 2025 · 9:06 AM UTC",545,70,
732,PNisztor,"Słuszna uwaga. Tym bardziej, że @SlawomirNitras ma swój duży udział w kompromitacji @trzaskowski_ w kampanii wyborczej.",0,28,1,29,"Jun 3, 2025 · 7:58 AM UTC",119,16,
733,AsiaJaworowska,To są wasi wyborcy - ta wykształcona elita 🤣 - obraża 7 letnie dziecko Prezydenta. 🤦 Jesteście bydłem!!!!!! Dlatego przegraliście i zawsze przegracie!,0,17,1,18,"Jun 3, 2025 · 8:37 AM UTC",150,23,
734,manojez07,"Trzaskowski z kimś takim pił piwo dobrze, że nie wygrał.",0,0,0,0,"Jun 3, 2025 · 12:12 PM UTC",56,10,
735,SirRincewind,"Gdyby były inne reguły gry, to sztaby grałyby w inna grę. Niesamowicie rozczarowujący są ludzie i organizacje, którzy nie potrafią pogodzić się z przegrana.",0,0,0,0,"Jun 3, 2025 · 12:12 PM UTC",156,24,
736,Load newest,Brak treści,0,0,0,0,,11,2,
737,lolekxrp,No no...tak tak ;-),0,0,0,0,"Jun 3, 2025 · 12:12 PM UTC",19,4,
738,RpsAgainstTrump,"BREAKING: Exit polls project that moderate, pro-EU candidate Rafał Trzaskowski has defeated Trump-backed nationalist Karol Nawrocki in Poland’s presidential election, 50.3% to 49.7%",223,2405,1024,3652,"Jun 1, 2025 · 7:03 PM UTC",181,23,
739,sjastrzebowski,"Wstałem i morda mi się cieszy od ucha do ucha. Co ona się tak cieszy - myślę sobie. Aha, ona się cieszy, bo filmik z Bodnarem oglądam, a tam łamacz prawa opowiada co teraz zrobi, jak Trzaskowski został już prezydentem. Dzień dobry cieszącym się Państwu! Za chwilę Przyjaciele Republiki @RepublikaTV",0,182,37,219,"Jun 3, 2025 · 4:14 AM UTC",298,50,
740,olasempruch,"Kampania kłamstw, oszczerstw i hejtu z nielegalnym finansowaniem z zagranicy. Ze wsparciem służb, instytucji i mediów. Z zabranymi subwencjami przeciwnikowi. Dzięki Bogu Nitras, Nowacka, Tomczyk i Szłapka nie znajdą się w pałacu.",1,87,18,106,"Jun 3, 2025 · 8:25 AM UTC",229,32,
741,TheCalvinCooli1,Breaking News: Karol Nawrocki wins the 2025 Poland Presidential Election defeating pro-EU liberal Rafal Trzaskowski in a stunning upset,21,225,38,284,"Jun 2, 2025 · 2:00 AM UTC",135,19,
742,marcin_brachu,"W zeszłym roku byłem, w tym też się szykuję",0,0,0,0,"Jun 3, 2025 · 12:12 PM UTC",43,9,
743,gdzie_mi,"Ponieważ nie wygrał Trzaskowski z obozu demokratycznego, więc ogłaszam że obóz demokratyczny już nie chce demokracji. Tylko zgromadzenie posłów, monarchia elekcyjna, potem dziedziczna 🤡 Konstytucja! Demokracja! Konstytucja!",0,0,0,0,"Jun 3, 2025 · 12:12 PM UTC",223,27,
744,patykiempisane,"Nic za tym nic po tym, ale po co Trzaskowski wystawiał się na strzały. To też wina Stanowskiego? Przecież to Trzaskowski todorosły facet i powinien myśleć. Jak ktoś go naparzał powinien oddać na odlew.",0,0,0,0,"Jun 3, 2025 · 12:12 PM UTC",201,34,
745,dabakuzu,Przeprosić proszę Państwa Nawrockich. Z małą Kasią na czele,0,14,0,14,"Jun 3, 2025 · 9:34 AM UTC",59,9,
746,Konrad_Wernicki,"Zacytuję Rycha Peję z jego FB, bo dotknął sedna tych wyborów: ""Jestem jak to się mówi chłopakiem z ludu i zapewne zdażyło mi się poznać w swoim życiu ludzi pokroju Karola Nawrockiego. Przykre jest to, iż nigdy nie miałem okazji poznać takich ludzi jak Rafał Trzaskowski. Polacy! Pamiętajcie, że tzw. elita (okropne słowo) to strasznie hermetyczna mniejszość. Mniejszość, do której większość z Was w tym i ja nigdy nie uzyska dostępu"".",11,193,46,250,"Jun 2, 2025 · 8:17 AM UTC",434,71,
747,imzuziaaa,"Za ten wynik odpowiada PO. Trzaskowski przegrał z najsłabszym kandydatem PiS w historii. To efekt bezczynności wobec realnych problemów ludzi. Koalicja traci zaufanie. Dołącz do Partii Razem – lewicy, która walczy, nie przytakuje partiarazem.pl/dolacz",1,28,8,37,"Jun 2, 2025 · 10:08 AM UTC",251,34,
748,obserwator1976,Mów za siebie!,0,0,0,0,"Jun 3, 2025 · 12:12 PM UTC",14,3,
749,AggaZet,Za to Nawrocki wszystko im zapewni razem z PiSem jak wróci do władzy. Gdzie się takie ameby lęgną 🤦‍,0,0,0,0,"Jun 3, 2025 · 12:12 PM UTC",100,19,
750,Piotr69Wielgosz,3-2-1 i do domu.,0,0,0,0,"Jun 3, 2025 · 12:12 PM UTC",16,4,
751,AsiaJaworowska,To są wasi wyborcy - ta wykształcona elita 🤣 - obraża 7 letnie dziecko Prezydenta. 🤦 Jesteście bydłem!!!!!! Dlatego przegraliście i zawsze przegracie!,0,18,1,19,"Jun 3, 2025 · 8:37 AM UTC",150,23,
752,RuchOsmiuGwiazd,"Dziękujemy za przeprosiny, ale w zasadzie one niczego nie zmieniają poza uspokojeniem wyborców PO, że widzicie swoje błędy. No i co z tego, że je widzicie jak i tak niczego z tym nie robicie. Zmarnowaliście kolejne X lat i niczego się przez ten czas nie nauczyliście. Nawet kurwa kibol z wami wygrał. W sieci nie istniejecie. PiSowcy mają swoje media dla starszych - Republika - i stworzyli swoje media dla młodych - Kanał Zero. Cały FB zasrany przekazem Mateckiego i spółki, fejkami robią milionowe zasięgi. TikTok przejęty przez Konfę i PiS. To tam siedzą zwykli ludzie, nie na X, na którym zresztą też przegrywacie. PiS już użył sztucznej inteligencji do analizy przekazu i celowości zasięgu. Kupują boty AI, podrabiają strony przeciwników, zasrywają przekaz kontami z Muchosrańska. W następnych wyborach pewnie jeszcze grube deepfejki na was wlecą i będzie totalna manipulacja przekazem, kiedy wy będziecie się zastanawiać czemu wrzucenie dwóch filmów pod rząd na FB uwala zasięgi. A to tylko Internet. O Tusku z Murańskim czy Gajewskiej z ziemniakami nawet nie wspominam. Co druga osoba, z którą rozmawiam, a która na was nie głosowała i nie ma dostępu do neta lub ograniczony do takich sociali jak wyżej, przyznaje że zrobiła to z dość oczywistych powodów - od braku jakichkolwiek działań, w tym realizacji 100 konkretów czy rozliczeń, po wiarę z strachy, że ""Czaskowski pedał będzie dzieci gejować"". Nie zrobiliście niczego przez 2 lata, by tych ludzi uświadomić że tak nie jest, że to fejki, żeby pokazać że rząd działa, żeby pochwalić się sukcesami. No chyba, że nagły fikoł, że Rafał jest prawakiem to miał być ten gejmczendżer, to ostrzegam, że zadziałało odwrotnie. Zamiast tego, kiedy Kaczor schował się do szafy i grzał spin obywatelskiego kandydata, u was Tusk, ten znienawidzony przez społeczeństwo Tusk, promował Trzaskowskiego i odwalał cyrki z patusem Muranem. Ludzie wprost mi przyznają, że zagłosowaliby na Rafała gdyby nie miał za plecami Tuska. Kiedy PiS z Konfą zgarniali elektorat młodszych grup, kiedy ich słuchali, kiedy pokazywali, że są blisko ich, wy razem z warszafką kisiliście się z Giertychem w odklejonej silcznikowej bańce. Badania fokusowe należy przeprowadzać na właściwej grupie, a nie przy piwku po pracy z ziomkami ze sztabu i bańce już przekonanych. Trzeba było odszukać grupy docelowe wśród niezdecydowanych i do nich adresować przekaz. Tu wielkiej filozofii przecież nie ma, ale jakoś tego zabrakło, bo na debatach Rafał może i dobrze sobie radził, ale cały jego pozytywny przekaz był kierowany do nikogo, a zamiast tego ataki na kibola. Nie rozumiecie backfire effect, nie ogarniacie, że dosłownie przegrzaliście temat afer, tak jak wcześniej TVPiS przegrzała atak na Tuska, co skutkowało Jagodnem. Tylko to Jagodno zobaczyło przez dwa lata, że Cysorz z memów to w sumie jest nagi, nie ma ustaw, nie ma rozliczeń, niczego. Nie ma igrzysk, a i chleba też nie dali. Do tego brak nowych twarzy. Nie promujecie nikogo nowego, nie ma zmiany pokoleniowej - ciągle odpychające boomerstwo ""warszafki"" i te same stare dziady, z Giertychem, Lisem i Tuskiem na czele. A jak już się pojawi ktoś młodszy to wychodzi z tego Gajewska z workiem kartofli albo Nitras. Może tym traficie do silniczków, ale fanatykami wyborów się nie wygrywa. Nie rozumiecie czym jest nowoczesna kampania. Minęło 15 lat od wygranej Komorowskiego i 10 od sromotnej przegranej w kolejnych wyborach. Już wtedy było widać różnicę w prowadzeniu kampanii. Wy jej nie zauważyliście, PiS tak. I w sumie nie wiem po co ten mój wysryw. I tak się niczego nie nauczycie na błędach. Jak zawsze.",33,237,105,375,"Jun 3, 2025 · 9:11 AM UTC",3590,576,
753,MarKow281773,"Głos na Nawrockiego w Poznaniu, to akt odwagi! Rafał Trzaskowski w Poznaniu uzyskał miażdżącą przewagę. Rzecz jasna, platformiany aparatczyk będący prezydentem Poznania Jacek Jaśkowiak, podziękował mieszkańcom Poznania za wyniki. W stolicy Wielkopolski Rafał Trzaskowski uzyskał",0,1,1,2,"Jun 3, 2025 · 11:51 AM UTC",278,35,
754,czlowiek__bobr,Alez nie ma za co. Świetna robota. Mam nadzieję że Giertych wbrew zapowiedziom nie doprowadzi do rozliczenia sztabu. Liczę na ten sam skład personalny i taką samą taktykę w następnych wyborach - była znakomita. W końcu się uda.,0,1,0,1,"Jun 3, 2025 · 12:05 PM UTC",227,38,
755,chrzanikx,"Stanowski o tym dlaczego przegrał Trzaskowski: „Platforma nie rozumie, że to nie są czasy gdy można robić z ludzi debili”",20,757,177,954,"Jun 3, 2025 · 8:58 AM UTC",121,20,
756,KrissMoro,A nigdy Cię nie zastanowiło jakim człowiekiem musi być Tusk i Trzaskowski skoro nawet ich WŁAŚNI koalicjanci są przeciwko nim??,0,0,0,0,"Jun 3, 2025 · 12:13 PM UTC",127,20,
757,WinnickijanJan,Szach i mat.,0,0,0,0,"Jun 3, 2025 · 12:13 PM UTC",12,3,
758,Dariusz95477236,"Wasz przekręt w Końskich, Tusk z Muranskim i worek kartofli zrobiły robotę….dziekujemy Wiola",0,0,0,0,"Jun 3, 2025 · 12:13 PM UTC",92,13,
759,piotrmacai,"jesteście symbolem spierdolenia totalnego - opartego na szczuciu, dwulicowości, gdzie fałszem śmierdziało na kilometr. Te sociale z dupiarzem ... dla byle lokalnego abdullah kebsa robią lepiej. Oderwanie od rzeczywistości was dopiero zacznie smagać.",0,0,0,0,"Jun 3, 2025 · 12:13 PM UTC",249,33,
760,okiemtomkaw,"Szanowny Panie Premierze @donaldtusk, Panie Prezydencie @trzaskowski_, zapraszam na wysłuchanie głosu wyborców, rozgoryczonych i sponiewieranych arogancję wielu posłów i działaczy. Większość listów kierowanych do Panów ląduje w spamie, albo jest zwyczajnie kasowana. Ja je dzisiaj publicznie odczytam, abyście Panowie mieli świadomość, do czego doprowadził brak rozliczeń PiS, indolencja pp. Bodnara i Siemoniaka i ignorowanie głosu wyborców. Zapraszam też innych polityków K15X, będzie i o Was. Vox populi vox Dei. piped.video/watch?v=d84dis_P…",1,56,9,66,"Jun 3, 2025 · 9:06 AM UTC",545,70,
761,Jan34733995,"03.06.1944 r. - Niemcy spalili litewską wieś Pirciupie i jej 119 mieszkańców. Rozkaz wydał Walter Titel, dowódca 16 Pułku SS i Policji. Zamordowali 21 mężczyzn, 69 dzieci i 29 kobiet.",0,2,2,4,"Jun 3, 2025 · 10:04 AM UTC",183,30,
762,Pabl3r,"No to jak z Dudą nie wygrał Trzaskowski, bo tamten przystojny. To liczyli, że wygra z Nawrockim? 🥳 Niby wykształceni, ale jednak pewne luki w logice mają. 🤡",0,0,0,0,"Jun 3, 2025 · 12:13 PM UTC",156,28,
763,p13trak,"Trzaskowski i Tusk idą na dno dzięki takim ludziom jak Pan, dlatego popieram i proszę o #wincyj",0,0,0,0,"Jun 3, 2025 · 12:12 PM UTC",95,17,
764,Renata512339531,"W 2020 roku Dworczyk pisał w mailu, że Trzaskowski wygrał z Dudą. Nikt nie kiwnął palcem!!! Trochę protestów... łyknęli tę przegraną jak pelikan rybę. Teraz też tak będzie? Kur...co to jest 300 tysięcy głosów? Dacie sobie nasrać na głowę Koalicjo? Kolejny raz?",0,83,21,104,"Jun 3, 2025 · 6:00 AM UTC",260,42,
765,Maciej_Swirski,"Wynik wyborów w Dziadkowicach, miejscowości w pobliżu Malinowa, w którym mieszkała ś.p. Filomena Leszczyńska walcząca o dobre imię Polski przeciwko dr. Janowi Grabowskiemu i prof. Barbarze Engelking. Karol Nawrocki 80,19% Rafał Trzaskowski 19,81% Stryj Pani Filomeny ocalił kilkudziesięciu Żydów, ukrywał Żołnierzy Niezłomnych, ratował sąsiadów od wywózki do Niemiec. Te okolice, niedaleko Siemiatycz i Drohiczyna to ostoja patriotyzmu i antykomunizmu .",4,1104,39,1147,"Jun 2, 2025 · 7:12 AM UTC",453,60,
766,Albert_Konopka,"Nie doczekamy się wolnej Polski, tymczasem 1 tura Trzaskowski i Nawrocki po 40% głosów emerytów, oni sami nie chcą wolnej Polski",0,0,0,0,"Jun 3, 2025 · 12:12 PM UTC",128,21,
767,m_uciechowska,"Popieram Pana wypowiedź. Jak można. Ja widziałam wspaniałą dziewczynkę pokazująca serduszka, bijącą brawo, machającą rączkami do zebranych. Cudowna, urocza dziewczynka. 🥰",0,0,0,0,"Jun 3, 2025 · 12:12 PM UTC",170,21,
768,nieryba,"Wielu nie rozumie,że to nie był konkurs piękności,tylko obstawialismy wersję przyszłości.Z Trzaskowski była oczywista i zdaniem większości stanowi zagrozenie-globalistyczna wersja świata.Z Nawrockim daje nadzieję na zmianę tej wizji,a może tylko opóźnienie,czyli czas.",0,1,0,1,"Jun 3, 2025 · 3:10 AM UTC",268,32,
769,Load newest,Brak treści,0,0,0,0,,11,2,
770,Magdale22740227,‼Piesek globalistów - Trzaskowski.,0,36,3,39,"May 30, 2025 · 5:12 PM UTC",34,4,
771,floydgreg2,Jak siedział przy stole z @sikorskiradek i @trzaskowski_ przy piwie to z radością mało co sobie lachy nie zrobiłeś.,0,0,0,0,"Jun 3, 2025 · 12:12 PM UTC",115,19,
772,MiMichalewicz,"Zorganizowaliście bezprecedensową kampanię nienawiści, którą chcieliście podeprzeć kandydaturę skrajnego progresywisty. Przez pierwszą fazę kampanii przebraliście Trzaskowskiego w patriotyczny mundurek w celu wprowadzenia w błąd opinii publicznej. Przegraliście. Wygrała Polska",0,18,12,30,"Jun 3, 2025 · 8:00 AM UTC",277,29,
773,dominik_tomczyk,"Po której Szanowny Pan Redaktor jest stronie?! — przecież to gotowy sposób na przebudzenie reżimu, znajdującego się w stanie półsnu — pełnego świerzbiących mięśni. Chyba nie chce Pan przypadkowo przebić żadnego wrażliwego bąbla napięcia!?",0,0,0,0,"Jun 3, 2025 · 12:12 PM UTC",238,34,
774,chrzanikx,"Stanowski o tym dlaczego przegrał Trzaskowski: „Platforma nie rozumie, że to nie są czasy gdy można robić z ludzi debili”",20,757,177,954,"Jun 3, 2025 · 8:58 AM UTC",121,20,
775,MrJohnBingham,"Już po wyborach, więc możemy wrócić do afery nielegalnego finansowania kampanii wyborczej @trzaskowski_ i nielegalnych działań prowadzonych m.in. za pośrednictwem firmy Estratos oraz spółek skarbu państwa i Fundacji Twój Głos Jest Ważny. Prawda, @Adbodnar?",10,563,21,594,"Jun 3, 2025 · 7:34 AM UTC",256,34,
776,Wojtek_Hagen,"Klarembach genialny. ""Państwo wybaczą, ale wystarczy już tego bredzenia"" I wyłączył transmisję z konferencji Hołowni",0,22,2,24,"Jun 3, 2025 · 9:45 AM UTC",116,15,
777,okiemtomkaw,"Szanowny Panie Premierze @donaldtusk, Panie Prezydencie @trzaskowski_, zapraszam na wysłuchanie głosu wyborców, rozgoryczonych i sponiewieranych arogancję wielu posłów i działaczy. Większość listów kierowanych do Panów ląduje w spamie, albo jest zwyczajnie kasowana. Ja je dzisiaj publicznie odczytam, abyście Panowie mieli świadomość, do czego doprowadził brak rozliczeń PiS, indolencja pp. Bodnara i Siemoniaka i ignorowanie głosu wyborców. Zapraszam też innych polityków K15X, będzie i o Was. Vox populi vox Dei. piped.video/watch?v=d84dis_P…",1,56,9,66,"Jun 3, 2025 · 9:06 AM UTC",545,70,
778,PNisztor,"Słuszna uwaga. Tym bardziej, że @SlawomirNitras ma swój duży udział w kompromitacji @trzaskowski_ w kampanii wyborczej.",0,28,1,29,"Jun 3, 2025 · 7:58 AM UTC",119,16,
779,AsiaJaworowska,To są wasi wyborcy - ta wykształcona elita 🤣 - obraża 7 letnie dziecko Prezydenta. 🤦 Jesteście bydłem!!!!!! Dlatego przegraliście i zawsze przegracie!,0,18,1,19,"Jun 3, 2025 · 8:37 AM UTC",150,23,
780,manojez07,"Trzaskowski z kimś takim pił piwo dobrze, że nie wygrał.",0,0,0,0,"Jun 3, 2025 · 12:12 PM UTC",56,10,
781,SirRincewind,"Gdyby były inne reguły gry, to sztaby grałyby w inna grę. Niesamowicie rozczarowujący są ludzie i organizacje, którzy nie potrafią pogodzić się z przegrana.",0,0,0,0,"Jun 3, 2025 · 12:12 PM UTC",156,24,
782,lolekxrp,No no...tak tak ;-),0,0,0,0,"Jun 3, 2025 · 12:12 PM UTC",19,4,
783,RpsAgainstTrump,"BREAKING: Exit polls project that moderate, pro-EU candidate Rafał Trzaskowski has defeated Trump-backed nationalist Karol Nawrocki in Poland’s presidential election, 50.3% to 49.7%",223,2405,1024,3652,"Jun 1, 2025 · 7:03 PM UTC",181,23,
784,sjastrzebowski,"Wstałem i morda mi się cieszy od ucha do ucha. Co ona się tak cieszy - myślę sobie. Aha, ona się cieszy, bo filmik z Bodnarem oglądam, a tam łamacz prawa opowiada co teraz zrobi, jak Trzaskowski został już prezydentem. Dzień dobry cieszącym się Państwu! Za chwilę Przyjaciele Republiki @RepublikaTV",0,182,37,219,"Jun 3, 2025 · 4:14 AM UTC",298,50,
785,olasempruch,"Kampania kłamstw, oszczerstw i hejtu z nielegalnym finansowaniem z zagranicy. Ze wsparciem służb, instytucji i mediów. Z zabranymi subwencjami przeciwnikowi. Dzięki Bogu Nitras, Nowacka, Tomczyk i Szłapka nie znajdą się w pałacu.",1,87,18,106,"Jun 3, 2025 · 8:25 AM UTC",229,32,
786,TheCalvinCooli1,Breaking News: Karol Nawrocki wins the 2025 Poland Presidential Election defeating pro-EU liberal Rafal Trzaskowski in a stunning upset,21,225,38,284,"Jun 2, 2025 · 2:00 AM UTC",135,19,
787,marcin_brachu,"W zeszłym roku byłem, w tym też się szykuję",0,0,0,0,"Jun 3, 2025 · 12:12 PM UTC",43,9,
788,Ewa_zodiak_ryby,"Dziękujemy, pani Wiolu. Na to, jako prawaki, liczyliśmy.",0,0,0,0,"Jun 3, 2025 · 12:13 PM UTC",56,8,
789,Dariusz45309181,"Jestem jednym z 10 237 177 Polek i Polaków, który nie przyłożył ręki do stoczenia się Polski na dno‼ Nadal nie mam Prezydenta, choć bardzo pomagałem , żeby @trzaskowski_ nim został …. Jednak 10 lat dałem radę z pajacem , dam i następne 5 lat…z kibolem, ćpunem, lichwiarzem, sutenerem… A teraz ostrzeżenie do mojego Premiera @donaldtusk . Jeśli rząd będzie postępować tak jak dotąd, to rozwinie czerwony dywan przed przyszłym rządem PiS i Konfederacji ‼ #SolidarniZTuskiem",0,39,4,43,"Jun 3, 2025 · 10:51 AM UTC",471,76,
790,Caro25555,Prezydent samozwaniec 🤣🤣🤣,0,0,0,0,"Jun 3, 2025 · 12:13 PM UTC",25,3,
791,KacperPlazynski,"Obóz polityczny, który sam siebie nazywa „demokratycznym”, w ocenie OBWE pozwolił na nielegalne finansowanie kampanii politycznej @trzaskowski_ przez zagranicę. Cóż za upadek. Cóż za nieznaczące tytuły. A co do tego finansowania - niezbędny jest niezależny audyt tego, kto i w jakiej skali na to pozwolił. Ktoś za to musi wziąć odpowiedzialność!",3,80,3,86,"Jun 3, 2025 · 7:11 AM UTC",345,51,
792,col_Kwiatkos,"To może kurwa Ty zrozum, o czym mówisz! Raz mam prawo do własnej decyzji, a po chwili go nie mam! Ja nie jestem agresywny ale kurwa DOSADNY! Rozumiesz to pojęcie? I w przeciwieństwie jestem szczęśliwy, a inni niech sobie żyją własnym życiem. Ode mnie kurwa z daleka. Jasne?",0,0,0,0,"Jun 3, 2025 · 12:13 PM UTC",273,48,
793,Karol52580331,Kupiłbym tak mieszkanie licząc na to że kopnie w kalendarz poprzedni właściciel. Na to właśnie liczył Nawrocki..takie procedery były znane-wykup bo np dziadek nieporadny i za wykup i dożywotnie mieszkanie w tym lokalu nowy właściciel tylko czynsz płacił i czekał az umrze dziadek,0,0,0,0,"Jun 3, 2025 · 12:13 PM UTC",279,43,
794,Napowrocie22,O tak zayebisty był. Świeży nowy propolski katolicki prawy i wogole. Jesteście tak śmieszni że na smiechometrze skali zabrakło #NawrockiPrezydent2025,0,0,0,0,"Jun 3, 2025 · 12:13 PM UTC",149,20,
