id,username,text,likes,retweets,replies,total_interactions,post_date_iso,text_length,word_count,sentiment_label,link
1,KaziSmolinski,"No dobrze, wiedziałem, że Prezydent Nawrocki na dzisiejszej radzie gabinetowej ostro będzie punktował Tuska, ale to co się dzieje przerosło moje oczekiwania. Prezydent ostatecznie skompromitował ten rząd. Na ich miejscu wstyd by mi było wrócić do swoich ministerstw.",2,107,161,270,27-08-25,266,38,,https://nitter.net/KaziSmolinski/status/1960614390803091500#m
2,e_wrzosek,"Prezydent Nawrocki swoje uprawnienia czerpie wyłącznie z Konstytucji i to ona określa zakres jego kompetencji. Konstytucja wymienia 30 spraw, w których prezydent samodzielnie podejmuje decyzję, wydając tzw. akty urzędowe, m.in. w sprawie zarządzania wyborów parlamentarnych, inicjatywy ustawodawczej i prawa łaski. Pozostałe akty urzędowe wydawane przez prezydenta, aby stały się ważne, wymagają kontrasygnaty, czyli podpisu premiera. I to by było na tyle.",13,428,90,531,27-08-25,456,61,,https://nitter.net/e_wrzosek/status/1960791714219581455#m
3,lis_tomasz,"Jeśli to był wstęp do stworzenia w Polsce systemu prezydenckiego, to raczej słabo wyszło. Ale Kaczyński, choć widział katastrofę Batyra, wie, że owcom i tak się wytłumaczy, że Nawrocki wypadł świetnie.",1,32,40,73,27-08-25,201,31,,https://nitter.net/lis_tomasz/status/1960648517136867633#m
4,Gameover1920,"Donald Tusk jako niemiecki patriota, zamierzał zapasy ropy i gazu trzymać w Niemczech, ale z Prezydentem Karolem Nawrockim takie numery nie przejdą i ustawa zawetowana. Po pierwsze Polska, po pierwsze Polacy! Nawrocki to Prezydent moich marzeń! 😍🤗🇵🇱",0,114,6,120,27-08-25,249,37,,https://nitter.net/Gameover1920/status/1960763954315002290#m
5,HubnerrMax,"Prezydent Karol Nawrocki zawetował, narzucaną przez UE, nowelizację ustawy o zapasach ropu i gazy. Przełożę to tak, żebyście zrozumieli. Prezydent nie pozwolił Miłoszowi Motyce posiadać kompetencji do wyrażania zgody na trzymanie rezerw polskiego gazu w Niemczech. Pięknie.",11,676,42,729,27-08-25,273,37,,https://nitter.net/HubnerrMax/status/1960746565510770984#m
6,szef_dywizji,"Pan Prezydent RP Karol Nawrocki zawetował ustawę, która zakładała, że nasze STRATEGICZNE zapasy ropy i gazu mogliby przechowywać niemcy w swoich magazynach! Wszyscy WON! Dziękujemy, Panie Prezydencie 🇵🇱",8,731,44,783,27-08-25,202,28,,https://nitter.net/szef_dywizji/status/1960764923509625196#m
7,reniajak,Dla ciebie ciulu Pan Prezydent Karol Nawrocki,0,0,0,0,28-08-25,45,7,,https://nitter.net/reniajak/status/1960926157093675510#m
8,KoneserUnii,"🛡️ Prezydent Karol Nawrocki zawetował dwie ustawy — i to była dobra decyzja. Nie z przekory, nie dla politycznego efektu. Ale w trosce o bezpieczeństwo państwa i zdrowy rozsądek w prawie. 🇵🇱 👇 Dlaczego te weta mają sens? ⛽ 1. Weto ws. zapasów ropy i gazu – obrona suwerenności energetycznej Nowelizacja zakładała możliwość przechowywania obowiązkowych zapasów gazu za granicą, wydłużenie czasu ich dostarczenia z 40 do 50 dni i zniesienie obowiązku rezerwowania przepustowości na interkonektorze. 💡 Brzmi technicznie, ale w praktyce oznaczało: oddanie kontroli nad strategicznymi surowcami innym państwom. Prezydent słusznie zauważył, że takie zmiany: ❌ Osłabiają krajową infrastrukturę magazynową ❌ Zniechęcają do budowy magazynów w Polsce ❌ Otwierają drzwi do uzależnienia się od zewnętrznych dostawców „To niewystarczające dla zapewnienia bezpieczeństwa energetycznego” – zaznaczył prezydent. W czasach geopolitycznej niepewności magazyny surowców powinny być jak armia – własne, gotowe, niezależne. ⚔️ 🌿 2. Weto ws. środków ochrony roślin – w obronie rolników i zdrowego rozsądku Nowela nakładała na rolników obowiązek prowadzenia wyłącznie cyfrowej dokumentacji stosowania środków ochrony roślin — z danymi zgodnymi z kodami EPPO i BBCH. Miało być nowocześnie, a wyszło… oderwanie od rzeczywistości. 👨‍🌾 Czy każdy rolnik w Polsce – zwłaszcza starszy – ma komputer, szybki internet i wiedzę o systemach cyfrowych? Prezydent powiedział ""stop"", bo: ✔️ Dostrzegł realne wykluczenie cyfrowe ✔️ Zauważył brak proporcjonalności i równości wobec prawa ✔️ Zadbał o to, by nowe technologie nie były barierą, tylko narzędziem wspierającym ""To narusza konstytucyjne standardy"" – podkreślił Nawrocki. ✅ Podsumowanie: dwa weta, jeden cel – ochrona interesu publicznego Weto nie musi być znakiem sprzeciwu wobec zmian. Może być aktem odpowiedzialności – i tak było tym razem. 📌 W obliczu nieprzemyślanych, technokratycznych rozwiązań prezydent wybrał rozsądek nad pośpiech. 📌 Postawił na niezależność energetyczną i uczciwe traktowanie polskiej wsi.",3,178,32,213,27-08-25,2039,289,,https://nitter.net/KoneserUnii/status/1960768532704063628#m
9,lis_tomasz,"Z tymi wszystkimi bezmyślnymi wetami, Nawrocki prowadzi politykę otwarcie antypaństwową, antypolską i antynarodową. W imieniu PiS, w imieniu Moskwy czy to i to?",2,101,86,189,27-08-25,160,23,,https://nitter.net/lis_tomasz/status/1960768558222233955#m
10,DWielowieyska,"Prezydent Karol Nawrocki zapowiedział, że będzie pomagał innym ugrupowaniom realizować ich obietnice wyborcze. To bardzo ładnie z jego strony. Rozumiem, że podpisze wszystkie ustawy przywracające praworządność, bo to obiecywała Koalicja 15 Października.",11,220,281,512,27-08-25,253,32,,https://nitter.net/DWielowieyska/status/1960601434480873964#m
11,OficjalneZero,"🗣️ Karol Nawrocki: „Chciałbym zadeklarować, że jestem gotowy do budowania mniejszości blokującej w radzie UE, aby powstrzymać umowę UE z państwami Mercosur.”",0,149,16,165,27-08-25,157,22,,https://nitter.net/OficjalneZero/status/1960748705486700979#m
12,LukaszBok,Kolejne weta prezydenta. Karol Nawrocki odmówił podpisania nowelizacji ustawy o zapasach ropy i gazu oraz nowelizacji ustawy o środkach ochrony roślin.,90,248,320,658,27-08-25,151,21,,https://nitter.net/LukaszBok/status/1960730781791199506#m
13,Nawrocki25,"Prezydent Nawrocki nie zważa na ataki układu rządzącego. Jest i będzie Ambasadorem naszych spraw. Po pierwsze Polska, po pierwsze Polacy! 🇵🇱",12,412,241,665,26-08-25,140,21,,https://nitter.net/Nawrocki25/status/1960420231475556753#m
14,chrzanikx,"Kosiniak mówi, że Nawrocki wszystko wetuje i porównuje to z liberum veto i upadkiem państwa polskiego XDDD Panie Kosiniak, pogadaj z Kamyszem, może Ci powie, że Nawrocki podpisał 26 ustaw a zawetował tylko 4",17,949,190,1156,26-08-25,207,34,,https://nitter.net/chrzanikx/status/1960284507405160507#m
15,JacekPiekara,"♦️Sikorski pisze, że uchwalili na Radzie Ministrów, co prezydent Nawrocki ma mówić w USA, a czego nie mówić♦️ Radku, pan prezydent ma w dupie ciebie, twojego premiera, radę ministrów i wasze durne uchwały... W przeciwieństwie do was nie jest persona non grata w Białym Domu, bo nie celował Trumpowi w plecy, nie wygadywał kłamstw, że Trump to wieloletni rosyjski agent i nie nazywał go niezrównoważonym. I nie porównywał go do Hitlera i Stalina, tak jak twoja obłąkana z nienawiści żona...",13,587,127,727,27-08-25,489,80,,https://nitter.net/JacekPiekara/status/1960756792213786967#m
16,JacekPiekara,"O społecznym odbiorze kandydatów na prezydenta: ""Trzaskowski - wypieszczone dziecko ""warszawki"". A po drugiej stronie, Nawrocki: jeden z nas, twardy gość, fajny facet. I wykształcony, i dyrektor, i w mordę potrafi dać. To się naprawdę podoba"" - prof. Ewa Pietrzyk-Zieniewicz 😀😉",0,42,8,50,27-08-25,277,41,,https://nitter.net/JacekPiekara/status/1960646184399183935#m
17,Korek1102,Pan Prezydent Nawrocki psi zwisie,0,0,0,0,28-08-25,33,5,,https://nitter.net/Korek1102/status/1960926005998043581#m
18,se_pl,"Czy Waszym zdaniem Karol Nawrocki dobrze zrobił, wetując ustawę o pomoc dla Ukrainy?",7,469,24,500,27-08-25,84,13,,https://nitter.net/se_pl/status/1960687967170654302#m
19,OficjalneZero,"🗣️ Karol Nawrocki: „Chciałbym zadeklarować, że jestem gotowy do budowania mniejszości blokującej w radzie UE, aby powstrzymać umowę UE z państwami Mercosur.”",0,149,16,165,27-08-25,157,22,,https://nitter.net/OficjalneZero/status/1960748705486700979#m
20,AbramczykPawel,"Znów gong w tępy rudy dziób 😂. Obowiązkowe zapasy gazu i ropy nie mogą być magazynowane poza granicami🇵🇱, szczególnie w 🇩🇪. Panie Prezydencie @NawrockiKn jest jeszcze kwestia🇵🇱dzieł sztuki,które reżim @donaldtusk chce magazynować w🇩🇪.To też ważne ☝️ fronda.pl/a/Prezydent-Nawroc… za",0,37,3,40,27-08-25,282,38,,https://nitter.net/AbramczykPawel/status/1960793118891978888#m
21,Propeertys,Karol Nawrocki nie został zaproszony do Mołdawii,0,43,72,115,27-08-25,48,7,,https://nitter.net/Propeertys/status/1960800647000846476#m
22,e_wrzosek,"Prezydent Nawrocki swoje uprawnienia czerpie wyłącznie z Konstytucji i to ona określa zakres jego kompetencji. Konstytucja wymienia 30 spraw, w których prezydent samodzielnie podejmuje decyzję, wydając tzw. akty urzędowe, m.in. w sprawie zarządzania wyborów parlamentarnych, inicjatywy ustawodawczej i prawa łaski. Pozostałe akty urzędowe wydawane przez prezydenta, aby stały się ważne, wymagają kontrasygnaty, czyli podpisu premiera. I to by było na tyle.",13,428,90,531,27-08-25,456,61,,https://nitter.net/e_wrzosek/status/1960791714219581455#m
23,jodenfan,Tusk w Moldawi. Nawrocki w USA. Taka tam mała różnica,0,0,0,0,28-08-25,53,10,,https://nitter.net/jodenfan/status/1960925970136789404#m
24,HubnerrMax,"Prezydent Karol Nawrocki zawetował, narzucaną przez UE, nowelizację ustawy o zapasach ropu i gazy. Przełożę to tak, żebyście zrozumieli. Prezydent nie pozwolił Miłoszowi Motyce posiadać kompetencji do wyrażania zgody na trzymanie rezerw polskiego gazu w Niemczech. Pięknie.",11,676,42,729,27-08-25,273,37,,https://nitter.net/HubnerrMax/status/1960746565510770984#m
25,KarolinaPawli15,"Panie Nawrocki #RadaGabinetowa, to nie ustawka! Trzeba być zawsze przygotowanym. Zderzył się pan z faktami i liczbami. Powinien pan częściej korzystać z politycznych korepetycji i nauki, którą przekazał panu dziś Pan Premier @donaldtusk . Dla dobra Polski🇵🇱 #RobimyNieGadamy",14,348,299,661,27-08-25,274,38,,https://nitter.net/KarolinaPawli15/status/1960632165919576242#m
26,Stasiekmu,NASZ NEWS. Karol Nawrocki odwiedzi Litwę i Finlandię! wpolityce.pl/polityka/738873…,0,3,0,3,28-08-25,83,9,,https://nitter.net/Stasiekmu/status/1960920616866807925#m
27,Andruszkiewicz1,"Prezydent K. Nawrocki będzie twardo rozliczał rząd, czego dowodem była dzisiejsza Rada Gabinetowa. Musimy pilnować kwestii strategicznych dla rozwoju Polski!🇵🇱",4,154,258,416,27-08-25,159,20,,https://nitter.net/Andruszkiewicz1/status/1960735567668265078#m
28,ZCzerniecki,"Dzień dobry:) Jak patrzę na tego pajaca Dudę to mnie śmiech 🤣 bierze. Nawrocki zaś chce rządzić sam w kraju ale myślę,że Tusk nie pozwoli mu na to bo jest za głupi . Dobrego, spokojnego i pogodnego czwartku życzę Ci!☕️🌹🦋🍀🎶😊☀️🙋‍♂️",0,0,0,0,28-08-25,229,40,,https://nitter.net/ZCzerniecki/status/1960925934875234729#m
29,szef_dywizji,"Pan Prezydent RP Karol Nawrocki zawetował ustawę, która zakładała, że nasze STRATEGICZNE zapasy ropy i gazu mogliby przechowywać niemcy w swoich magazynach! Wszyscy WON! Dziękujemy, Panie Prezydencie 🇵🇱",8,731,44,783,27-08-25,202,28,,https://nitter.net/szef_dywizji/status/1960764923509625196#m
30,WolnaRadio,"Po wczorajszym dniu zaczynam wierzyć, że Prezydent Nawrocki obali ten rząd!",13,533,331,877,26-08-25,75,11,,https://nitter.net/WolnaRadio/status/1960222086749737288#m
31,poselTTrela,"Rada Gabinetowa go przerosła, więc sięgnął po jedyne, co mu zostało - weto. Cały Nawrocki!",0,7,5,12,28-08-25,90,15,,https://nitter.net/poselTTrela/status/1960921741456204230#m
32,krzysztof_dykas,"Czy zna ktoś uzasadnienie weta do Nowelizacji ustawy o Ochronie Roślin? Serio pytam, bo trudno mi uwierzyć, że Nawrocki zawetował to na zasadzie : Nie Bo Nie #StopBatyryzacjiPolski",0,108,68,176,27-08-25,180,28,,https://nitter.net/krzysztof_dykas/status/1960754052171751659#m
33,JanMolskiIII,"Nie no bez jaj. 🤦🏼‍♂️ W TVP teraz kręcą aferę, że Prezydent Nawrocki powiedział: „Trzeba porozmawiać po męsku” XDDDDD nitter.net/chrzanikx/status/19607…",13,161,177,351,27-08-25,152,20,,https://nitter.net/JanMolskiIII/status/1960710461977997555#m
34,Gasiuk_Pihowicz,Po porażce Rady Gabinetowej Nawrocki wpadł w amok wetowania. Ofiarami przypadkowe ustawy o środkach ochrony roślin i o zapasach ropy. Zdecydowanie za dużo snusów.,2,136,214,352,27-08-25,162,24,,https://nitter.net/Gasiuk_Pihowicz/status/1960773985286939078#m
35,LepkowskaGolas,"Prezydent Nawrocki pisał ustawę o CPK, żeby kolej wróciła do Łomży… a tymczasem my już mamy konkretne terminy – 2026 rok pierwsze pociągi, 2027 Intercity 🚄 bo my #RobimyNieGadamy #KolejNaŁomżę",6,237,37,280,27-08-25,192,30,,https://nitter.net/LepkowskaGolas/status/1960674324399980550#m
36,MarcinPalade,"""Tageszeitung"": ""Zawetowaniem ustawy dotyczącej pomocy obywatelom Ukrainy, Karol Nawrocki gra na rękę prezydentowi Rosji"". Niemcy są chyba ostatnim krajem z prawem do zarzucania innemu krajowi, że gra na rękę prezydentowi Rosji. Choćby takie Nord Stream nie wzięło się z powietrza",0,86,14,100,27-08-25,280,40,,https://nitter.net/MarcinPalade/status/1960786991194251631#m
37,GiertychRoman,"Rozumiem, że Nawrocki walczy z wiatrakami, ale z zapasami ropy i ochroną roślin? Ten gość jest coraz śmieszniejszy. To pewnie zemsta za baty jakie dostał od PDT na oczach całej Polski.",7,480,340,827,27-08-25,184,31,,https://nitter.net/GiertychRoman/status/1960757527903121414#m
38,KaziSmolinski,"No dobrze, wiedziałem, że Prezydent Nawrocki na dzisiejszej radzie gabinetowej ostro będzie punktował Tuska, ale to co się dzieje przerosło moje oczekiwania. Prezydent ostatecznie skompromitował ten rząd. Na ich miejscu wstyd by mi było wrócić do swoich ministerstw.",2,107,161,270,27-08-25,266,38,,https://nitter.net/KaziSmolinski/status/1960614390803091500#m
39,e_wrzosek,"Prezydent Nawrocki swoje uprawnienia czerpie wyłącznie z Konstytucji i to ona określa zakres jego kompetencji. Konstytucja wymienia 30 spraw, w których prezydent samodzielnie podejmuje decyzję, wydając tzw. akty urzędowe, m.in. w sprawie zarządzania wyborów parlamentarnych, inicjatywy ustawodawczej i prawa łaski. Pozostałe akty urzędowe wydawane przez prezydenta, aby stały się ważne, wymagają kontrasygnaty, czyli podpisu premiera. I to by było na tyle.",13,428,90,531,27-08-25,456,61,,https://nitter.net/e_wrzosek/status/1960791714219581455#m
40,lis_tomasz,"Jeśli to był wstęp do stworzenia w Polsce systemu prezydenckiego, to raczej słabo wyszło. Ale Kaczyński, choć widział katastrofę Batyra, wie, że owcom i tak się wytłumaczy, że Nawrocki wypadł świetnie.",1,32,40,73,27-08-25,201,31,,https://nitter.net/lis_tomasz/status/1960648517136867633#m
41,Gameover1920,"Donald Tusk jako niemiecki patriota, zamierzał zapasy ropy i gazu trzymać w Niemczech, ale z Prezydentem Karolem Nawrockim takie numery nie przejdą i ustawa zawetowana. Po pierwsze Polska, po pierwsze Polacy! Nawrocki to Prezydent moich marzeń! 😍🤗🇵🇱",0,114,6,120,27-08-25,249,37,,https://nitter.net/Gameover1920/status/1960763954315002290#m
42,HubnerrMax,"Prezydent Karol Nawrocki zawetował, narzucaną przez UE, nowelizację ustawy o zapasach ropu i gazy. Przełożę to tak, żebyście zrozumieli. Prezydent nie pozwolił Miłoszowi Motyce posiadać kompetencji do wyrażania zgody na trzymanie rezerw polskiego gazu w Niemczech. Pięknie.",11,676,42,729,27-08-25,273,37,,https://nitter.net/HubnerrMax/status/1960746565510770984#m
43,szef_dywizji,"Pan Prezydent RP Karol Nawrocki zawetował ustawę, która zakładała, że nasze STRATEGICZNE zapasy ropy i gazu mogliby przechowywać niemcy w swoich magazynach! Wszyscy WON! Dziękujemy, Panie Prezydencie 🇵🇱",8,731,44,783,27-08-25,202,28,,https://nitter.net/szef_dywizji/status/1960764923509625196#m
44,reniajak,Dla ciebie ciulu Pan Prezydent Karol Nawrocki,0,0,0,0,28-08-25,45,7,,https://nitter.net/reniajak/status/1960926157093675510#m
45,KoneserUnii,"🛡️ Prezydent Karol Nawrocki zawetował dwie ustawy — i to była dobra decyzja. Nie z przekory, nie dla politycznego efektu. Ale w trosce o bezpieczeństwo państwa i zdrowy rozsądek w prawie. 🇵🇱 👇 Dlaczego te weta mają sens? ⛽ 1. Weto ws. zapasów ropy i gazu – obrona suwerenności energetycznej Nowelizacja zakładała możliwość przechowywania obowiązkowych zapasów gazu za granicą, wydłużenie czasu ich dostarczenia z 40 do 50 dni i zniesienie obowiązku rezerwowania przepustowości na interkonektorze. 💡 Brzmi technicznie, ale w praktyce oznaczało: oddanie kontroli nad strategicznymi surowcami innym państwom. Prezydent słusznie zauważył, że takie zmiany: ❌ Osłabiają krajową infrastrukturę magazynową ❌ Zniechęcają do budowy magazynów w Polsce ❌ Otwierają drzwi do uzależnienia się od zewnętrznych dostawców „To niewystarczające dla zapewnienia bezpieczeństwa energetycznego” – zaznaczył prezydent. W czasach geopolitycznej niepewności magazyny surowców powinny być jak armia – własne, gotowe, niezależne. ⚔️ 🌿 2. Weto ws. środków ochrony roślin – w obronie rolników i zdrowego rozsądku Nowela nakładała na rolników obowiązek prowadzenia wyłącznie cyfrowej dokumentacji stosowania środków ochrony roślin — z danymi zgodnymi z kodami EPPO i BBCH. Miało być nowocześnie, a wyszło… oderwanie od rzeczywistości. 👨‍🌾 Czy każdy rolnik w Polsce – zwłaszcza starszy – ma komputer, szybki internet i wiedzę o systemach cyfrowych? Prezydent powiedział ""stop"", bo: ✔️ Dostrzegł realne wykluczenie cyfrowe ✔️ Zauważył brak proporcjonalności i równości wobec prawa ✔️ Zadbał o to, by nowe technologie nie były barierą, tylko narzędziem wspierającym ""To narusza konstytucyjne standardy"" – podkreślił Nawrocki. ✅ Podsumowanie: dwa weta, jeden cel – ochrona interesu publicznego Weto nie musi być znakiem sprzeciwu wobec zmian. Może być aktem odpowiedzialności – i tak było tym razem. 📌 W obliczu nieprzemyślanych, technokratycznych rozwiązań prezydent wybrał rozsądek nad pośpiech. 📌 Postawił na niezależność energetyczną i uczciwe traktowanie polskiej wsi.",3,178,32,213,27-08-25,2039,289,,https://nitter.net/KoneserUnii/status/1960768532704063628#m
46,e_wrzosek,"Prezydent Nawrocki swoje uprawnienia czerpie wyłącznie z Konstytucji i to ona określa zakres jego kompetencji. Konstytucja wymienia 30 spraw, w których prezydent samodzielnie podejmuje decyzję, wydając tzw. akty urzędowe, m.in. w sprawie zarządzania wyborów parlamentarnych, inicjatywy ustawodawczej i prawa łaski. Pozostałe akty urzędowe wydawane przez prezydenta, aby stały się ważne, wymagają kontrasygnaty, czyli podpisu premiera. I to by było na tyle.",13,428,90,531,27-08-25,456,61,,https://nitter.net/e_wrzosek/status/1960791714219581455#m
47,lis_tomasz,"Z tymi wszystkimi bezmyślnymi wetami, Nawrocki prowadzi politykę otwarcie antypaństwową, antypolską i antynarodową. W imieniu PiS, w imieniu Moskwy czy to i to?",2,101,86,189,27-08-25,160,23,,https://nitter.net/lis_tomasz/status/1960768558222233955#m
48,DWielowieyska,"Prezydent Karol Nawrocki zapowiedział, że będzie pomagał innym ugrupowaniom realizować ich obietnice wyborcze. To bardzo ładnie z jego strony. Rozumiem, że podpisze wszystkie ustawy przywracające praworządność, bo to obiecywała Koalicja 15 Października.",11,220,281,512,27-08-25,253,32,,https://nitter.net/DWielowieyska/status/1960601434480873964#m
49,OficjalneZero,"🗣️ Karol Nawrocki: „Chciałbym zadeklarować, że jestem gotowy do budowania mniejszości blokującej w radzie UE, aby powstrzymać umowę UE z państwami Mercosur.”",0,150,16,166,27-08-25,157,22,,https://nitter.net/OficjalneZero/status/1960748705486700979#m
50,LukaszBok,Kolejne weta prezydenta. Karol Nawrocki odmówił podpisania nowelizacji ustawy o zapasach ropy i gazu oraz nowelizacji ustawy o środkach ochrony roślin.,90,248,320,658,27-08-25,151,21,,https://nitter.net/LukaszBok/status/1960730781791199506#m
51,Nawrocki25,"Prezydent Nawrocki nie zważa na ataki układu rządzącego. Jest i będzie Ambasadorem naszych spraw. Po pierwsze Polska, po pierwsze Polacy! 🇵🇱",12,412,241,665,26-08-25,140,21,,https://nitter.net/Nawrocki25/status/1960420231475556753#m
52,chrzanikx,"Kosiniak mówi, że Nawrocki wszystko wetuje i porównuje to z liberum veto i upadkiem państwa polskiego XDDD Panie Kosiniak, pogadaj z Kamyszem, może Ci powie, że Nawrocki podpisał 26 ustaw a zawetował tylko 4",17,949,190,1156,26-08-25,207,34,,https://nitter.net/chrzanikx/status/1960284507405160507#m
53,JacekPiekara,"♦️Sikorski pisze, że uchwalili na Radzie Ministrów, co prezydent Nawrocki ma mówić w USA, a czego nie mówić♦️ Radku, pan prezydent ma w dupie ciebie, twojego premiera, radę ministrów i wasze durne uchwały... W przeciwieństwie do was nie jest persona non grata w Białym Domu, bo nie celował Trumpowi w plecy, nie wygadywał kłamstw, że Trump to wieloletni rosyjski agent i nie nazywał go niezrównoważonym. I nie porównywał go do Hitlera i Stalina, tak jak twoja obłąkana z nienawiści żona...",13,587,127,727,27-08-25,489,80,,https://nitter.net/JacekPiekara/status/1960756792213786967#m
54,JacekPiekara,"O społecznym odbiorze kandydatów na prezydenta: ""Trzaskowski - wypieszczone dziecko ""warszawki"". A po drugiej stronie, Nawrocki: jeden z nas, twardy gość, fajny facet. I wykształcony, i dyrektor, i w mordę potrafi dać. To się naprawdę podoba"" - prof. Ewa Pietrzyk-Zieniewicz 😀😉",0,42,8,50,27-08-25,277,41,,https://nitter.net/JacekPiekara/status/1960646184399183935#m
55,Korek1102,Pan Prezydent Nawrocki psi zwisie,0,0,0,0,28-08-25,33,5,,https://nitter.net/Korek1102/status/1960926005998043581#m
56,se_pl,"Czy Waszym zdaniem Karol Nawrocki dobrze zrobił, wetując ustawę o pomoc dla Ukrainy?",7,469,24,500,27-08-25,84,13,,https://nitter.net/se_pl/status/1960687967170654302#m
57,AbramczykPawel,"Znów gong w tępy rudy dziób 😂. Obowiązkowe zapasy gazu i ropy nie mogą być magazynowane poza granicami🇵🇱, szczególnie w 🇩🇪. Panie Prezydencie @NawrockiKn jest jeszcze kwestia🇵🇱dzieł sztuki,które reżim @donaldtusk chce magazynować w🇩🇪.To też ważne ☝️ fronda.pl/a/Prezydent-Nawroc… za",0,37,3,40,27-08-25,282,38,,https://nitter.net/AbramczykPawel/status/1960793118891978888#m
58,Propeertys,Karol Nawrocki nie został zaproszony do Mołdawii,0,43,72,115,27-08-25,48,7,,https://nitter.net/Propeertys/status/1960800647000846476#m
59,jodenfan,Tusk w Moldawi. Nawrocki w USA. Taka tam mała różnica,0,0,0,0,28-08-25,53,10,,https://nitter.net/jodenfan/status/1960925970136789404#m
60,HubnerrMax,"Prezydent Karol Nawrocki zawetował, narzucaną przez UE, nowelizację ustawy o zapasach ropu i gazy. Przełożę to tak, żebyście zrozumieli. Prezydent nie pozwolił Miłoszowi Motyce posiadać kompetencji do wyrażania zgody na trzymanie rezerw polskiego gazu w Niemczech. Pięknie.",11,676,42,729,27-08-25,273,37,,https://nitter.net/HubnerrMax/status/1960746565510770984#m
61,JacekPiekara,"♦️Sikorski pisze, że uchwalili na Radzie Ministrów, co prezydent Nawrocki ma mówić w USA, a czego nie mówić♦️ Radku, pan prezydent ma w dupie ciebie, twojego premiera, radę ministrów i wasze durne uchwały... W przeciwieństwie do was nie jest persona non grata w Białym Domu, bo nie celował Trumpowi w plecy, nie wygadywał kłamstw, że Trump to wieloletni rosyjski agent i nie nazywał go niezrównoważonym. I nie porównywał go do Hitlera i Stalina, tak jak twoja obłąkana z nienawiści żona...",13,588,127,728,27-08-25,489,80,,https://nitter.net/JacekPiekara/status/1960756792213786967#m
62,OficjalneZero,"🗣️ Karol Nawrocki: „Chciałbym zadeklarować, że jestem gotowy do budowania mniejszości blokującej w radzie UE, aby powstrzymać umowę UE z państwami Mercosur.”",0,152,16,168,27-08-25,157,22,,https://nitter.net/OficjalneZero/status/1960748705486700979#m
63,WolnoscTV,"‼️BRAWO, PANIE PREZYDENCIE NAWROCKI‼️ ""Podwyższanie podatków i danin jest rzeczą, której nie zamierzam akceptować jako prezydent Polski!"" @NawrockiKn",1,189,27,217,27-08-25,149,18,,https://nitter.net/WolnoscTV/status/1960646720309653978#m
64,RyszardPetru,"Karol Nawrocki pomylił role. Prezydent nie jest „narodowym egzaminatorem” rządu. Niech najpierw przepyta PiS z 8 ostatnich lat rządów: rekordowej inflacji, budżetowej „magii” Morawieckiego: ukrywania wydatków poza budżetem, gigantycznego marnotrawstwa i niekompetencji. Niech zada też pytanie swojemu poprzednikowi o to, czemu podpisał Polski Ład - wyrok na setki tysięcy polskich firm.",20,374,419,813,27-08-25,386,51,,https://nitter.net/RyszardPetru/status/1960621756982382989#m
65,DoRzeczy_pl,Prezydent zawetował kolejne ustawy. Polska nie dostosuje prawa do UE ⬇️ dorzeczy.pl/ekonomia/771153/…,13,199,92,304,27-08-25,101,12,,https://nitter.net/DoRzeczy_pl/status/1960737289476231370#m
66,KarolPopieramy,POLSKA BĘDZIE ZNÓW WIELKA ! 🇵🇱💪 Prezydent Karol Nawrocki już nad tym pracuje 😎🇵🇱,8,289,146,443,26-08-25,80,14,,https://nitter.net/KarolPopieramy/status/1960424246364209650#m
