id,username,text,likes,retweets,replies,total_interactions,post_date_iso,text_length,word_count,sentiment_label,link
67,nicto1111,"A dlaczego Nawrocki był na karcie do głosowania pierwszy? No, dlaczego?!",0,0,0,0,13-08-25,72,11,,https://nitter.net/nicto1111/status/1955570074326286617#m
68,JanuszMali33660,"Nawrocki grozi, że nie podpisze ustawy wiatrakowej. O wysokości budżetu prezydenta decyduje parlament i rząd. Obciąć o połowę, abyśmy nie musieli płacić z naszych podatków tym prezydenckim szkodnikom i idiotom…",3,121,88,212,12-08-25,210,30,,https://nitter.net/JanuszMali33660/status/1955366926927978715#m
69,SolidarityRnwd,Everyone now waking up to who and what Nawrocki is and why ruZZia went all in to get him elected?! 🤨,0,9,3,12,13-08-25,100,21,,https://nitter.net/SolidarityRnwd/status/1955536818595827732#m
70,RobinUeOpt,Takich znajomych ma Nawrocki. Jakże to nie dziwi. #niemójprezydent,0,4,0,4,13-08-25,66,9,,https://nitter.net/RobinUeOpt/status/1955530148268347417#m
71,HubnerrMax,"PO i ich sekta nie ma pojęcia o państwowości. Zwłaszcza polskiej. Prezydent Nawrocki mówiąc ""Prezydent"" nie mówi o sobie. Mówi o urzędzie który pełni, odseparowując go od swojej osoby. Jest to wyrazem głębokiego szacunku do Rzeczpospolitej. Nigdy nie pojmiecie tej dumy.",0,18,1,19,13-08-25,270,41,,https://nitter.net/HubnerrMax/status/1955564340964192654#m
72,Beata_Andre,Nawrocki może dziś blokować obniżkę cen prądu bez żadnych konsekwencji. Bo jego wyborcy nie głosowali na tańsze rachunki. Głosowali na nienawiść do Tuska. Reszta ich nie obchodzi. Dobranoc 😴,0,80,53,133,12-08-25,190,29,,https://nitter.net/Beata_Andre/status/1955381382315905115#m
73,AndrzejekMitura,"Nawrocki to sobie może wsadzić ten silny mandat w buty. Każda ustawa podpisana przez tego alfonsa może zostać zaskarżona do TSUE !!! Niby wygrał wybory, które odbywały się z pogwałceniem naszej konstytucji. Rząd PiS uchwalił ustawę sprzeczną z naszą konstytucją, właśnie po to przejął TK . Chciał rządzić wiecznie i bezkarnie okradać Polaków 😡 Nie wiem tylko dlaczego Pan @donaldtusk marnuje nasz czas. Praworządności nie da się w ten sposób przywrócić. Każde ustanowione prawo z podpisem tego alfonsa można zaskarżyć, Polska zapłaci kary i będzie musiała się z tego wycofać !!! Art. 8. Naszej konstytucji Konstytucja jest najwyższym prawem Rzeczypospolitej Polskiej. Przepisy Konstytucji stosuje się bezpośrednio, chyba że Konstytucja stanowi inaczej.",0,0,0,0,13-08-25,752,111,,https://nitter.net/AndrzejekMitura/status/1955496035955904899#m
74,MrWhitie,"Jeśli Nawrocki będzie wetował durne ustawy, chodził na mecze i gadał z ludźmi na ulicy, za 5 lat znowu na niego zagłosuje. Żeby się elita narodu zesrywała dalej.",12,457,171,640,11-08-25,161,28,,https://nitter.net/MrWhitie/status/1954986403554791559#m
75,j_wisniewska,"Miazga! Prezydent Nawrocki do Żurka: nie jesteś Bogiem, uświadom to sobie! Zgadzasz się? Zostaw lajka i podaj dalej 🔁",10,466,217,693,12-08-25,117,19,,https://nitter.net/j_wisniewska/status/1955358752603074920#m
76,znowu_samolotem,No to przypomnijmy sobie wykształcenie prezydentów RP: - Lech Wałęsa - zawodowe - Aleksander Kwaśniewski wyższe 1 stopnia - Lech Kaczyński - profesor - Bronisław Komorowski - magister - Andrzej Duda - doktor - Karol Nawrocki - doktor Ktoś z Państwa ma jakieś pytania?,12,413,479,904,12-08-25,267,44,,https://nitter.net/znowu_samolotem/status/1955333667246461284#m
77,gfkot,"Czy Nawrocki wie, że byśmy mogli sobie pofedrować, dopłacamy z budżetu milion złotych na godzinę? Pytanie retoryczne.",3,58,23,84,13-08-25,117,17,,https://nitter.net/gfkot/status/1955555296627077456#m
78,Woloszanski2023,Jeśli prezydent Nawrocki zawetuje ustawę o mrożeniu cen prądu to rachunki typowego gospodarstwa wzrosną o 20-30 zł miesięcznie.,1,16,16,33,13-08-25,127,18,,https://nitter.net/Woloszanski2023/status/1955557675175129443#m
79,CamaroJaro,"Pierwszym ""wiatrakiem"" był żagiel, kawał szmaty rozpiętej na maszcie od tysiącleci zamieniał energię wiatru na siłę napędzającą łodzie. Pierwsze wiatraki ""wiatrakowe"" budowali Persowie kilkaset lat p.n.e. Wynalazek zdobył cały świat. A potem przyszedł Nawrocki.",0,63,10,73,12-08-25,261,34,,https://nitter.net/CamaroJaro/status/1955212428196651375#m
80,RPasnicki,"Widzę ekscytację projektem tzw. podatku kościelnego. Nie ma co bić piany, ponieważ nie jest to w interesie KK, więc Nawrocki takiej ustawy nie podpisze. A może nawet odeśle ją do tzw. TK, aby ten orzekł, iż taki podatek jest absolutnie niezgodny z Konstytucją i nawet konkordatem.",1,21,11,33,13-08-25,280,46,,https://nitter.net/RPasnicki/status/1955502706799546438#m
81,HubnerrMax,"PO i ich sekta nie ma pojęcia o państwowości. Zwłaszcza polskiej. Prezydent Nawrocki mówiąc ""Prezydent"" nie mówi o sobie. Mówi o urzędzie który pełni, odseparowując go od swojej osoby. Jest to wyrazem głębokiego szacunku do Rzeczpospolitej. Nigdy nie pojmiecie tej dumy.",0,18,1,19,13-08-25,270,41,,https://nitter.net/HubnerrMax/status/1955564340964192654#m
82,JimFergusonUK,"BREAKING:🚨 MAKE EUROPE GREAT AGAIN — RISING VOICES OF FREEDOM 🚨 At the inauguration of Poland’s new President Karol Nawrocki, my friend Gheorghe Piperea, Romanian MP and fearless defender of Romania’s sovereignty, delivered a speech that electrified the room. 🇷🇴 From Bucharest to Brussels, he warned of the erosion of national sovereignty and the creeping hand of EU overreach. CBDC's are the end of freedom and privacy. 🇵🇱 He praised the courage of George Simion and the new Polish President, calling them proof that patriots are taking their nations back. 🗣️ He stands for free speech, a strong Europe of nations, and a future where our countries write their own destiny — not Brussels bureaucrats. 💥 And he dropped a political thunderbolt: Ursula von der Leyen will soon face ANOTHER vote of no confidence. The fight is far from over. 🔥 Europe needs more voices like Gheorghe Piperea — principled, unyielding, and committed to freedom. Together, we are building the alliances that will break the chains of globalist control. @georgesimion @GPiperea @NawrockiKn @elonmusk @GiorgiaMeloni",5,121,11,137,12-08-25,1089,174,,https://nitter.net/JimFergusonUK/status/1955258988947296434#m
83,Bart_Wielinski,"Skoro Nawrocki napomina Żurka, że nie jest Bogiem to byłoby fajnie, gdyby sam przestał się za Boga uważać Bo też Nim nie jest",6,367,70,443,12-08-25,125,23,,https://nitter.net/Bart_Wielinski/status/1955340186046672958#m
84,KaziSmolinski,"Obniżka cen prądu? Nie. Ustawa wiatrakowa to ustawa napisana przez lobbystów, aby wpuścić do Polski szeroką ławą niemieckie wiatraki. Niedługo Prezydent Nawrocki złoży ustawę o obniżce cen prądu bez niemieckich wiatraków w gratisie i zobaczymy co zrobi Tusk.",3,114,55,172,12-08-25,258,38,,https://nitter.net/KaziSmolinski/status/1955340917344268463#m
85,lis_tomasz,"Jak Pan Nawrocki chce się spotkać z premierem RP, to powinien go zaprosić do pałacu. Tego wymagają protokół i kurtuazja. Na razie muszą mu wystarczyc spotkania z kibolami. Tam zasady są inne.",2,114,107,223,13-08-25,191,32,,https://nitter.net/lis_tomasz/status/1955544673583591470#m
86,KrzyLuft,"Jeśli Prezydent Nawrocki zawetuje ustawę o obniżeniu cen prądu, to każdy odbiorca prądu powinien dostać, razem z fakturą ulotkę wyjaśniającą, że ceny rosną z powodu prezydenckiego weta do tej ustawy. PiS robił takie akcje wielokrotnie, więc nikt nie powinien mieć pretensji.",28,306,468,802,12-08-25,274,41,,https://nitter.net/KrzyLuft/status/1955370835952406554#m
87,Kryhor,"Ten cep mówi że jeśli Ukraina przegra wojnę to winny będzie Nawrocki. A może durniu, te 80 tys banderowskich byków, powinno być w Donbasie, zamiast na Narodowym.",0,6,4,10,13-08-25,161,27,,https://nitter.net/Kryhor/status/1955563256200011805#m
88,AldonaScha22463,Czekam na wyrok🤣 może być ciekawiej. A czemu to Nawrocki na pozwał w trybie wyborczym. Myślę że Onet bez sprawdzenia nie pisze. Zawszę są wiarygodni.,0,3,0,3,12-08-25,149,25,,https://nitter.net/AldonaScha22463/status/1955264218791281082#m
89,j_wisniewska,"Miazga! Prezydent Nawrocki do Żurka: nie jesteś Bogiem, uświadom to sobie! Zgadzasz się? Zostaw lajka i podaj dalej 🔁",10,466,217,693,12-08-25,117,19,,https://nitter.net/j_wisniewska/status/1955358752603074920#m
90,Wlodkowski65884,Ty tępa Dzido alfons nawrocki też nie jest bogiem,0,0,0,0,13-08-25,49,9,,https://nitter.net/Wlodkowski65884/status/1955569863671636280#m
91,SebiA52469230,"Nawrocki – człowiek nielegalnie zajmujący pałac prezydencki, polityk na sznurku Kaczyńskiego paradujący w mundurku historyka – postanowił wejść w buty komisarza partyjnej rewolucji.",0,0,0,0,13-08-25,181,23,,https://nitter.net/SebiA52469230/status/1955569859951317500#m
92,KarolPopieramy,"Dzień dobry 🇵🇱 Polecam z rana posłuchać mądrego człowieka, jakim jest nasz Prezydent Karol Nawrocki 😃🇵🇱👏",1,66,24,91,13-08-25,104,16,,https://nitter.net/KarolPopieramy/status/1955513819012460845#m
93,lis_tomasz,"Nawrocki mówi Żurkowi, że ten nie jest Bogiem. Dzięki Bogu Żurek to wie. Teraz wystarczy, by- być może z pomocą Boga- dowiedział się tego o sobie Nawrocki.",0,44,20,64,13-08-25,155,27,,https://nitter.net/lis_tomasz/status/1955551459963257046#m
94,B_Galusik,"Zamiast apelować i żalić się. Proszę przygotować spot z informacją o tym, że prezydent zafundował ludziom droższy prąd. Nawrocki i tak wszystko będzie wetował, ale spot o drogim prądzie ludzie zrozumieją.",0,59,39,98,12-08-25,204,31,,https://nitter.net/B_Galusik/status/1955292095054307595#m
95,_Afraniusz,"Pierdololo Nawrocki. Najpierw się czegoś naucz, potem sie odzywaj.",0,5,1,6,13-08-25,66,9,,https://nitter.net/_Afraniusz/status/1955499410009493545#m
96,StGawlowski,"Nawrocki zaczyna od oszustwa, podpisuje projekt ustawy zakazujący sprzedaży obcokrajowcom ziemię rolną i leśną‼️ Rekordy w sprzedaży pobił rząd PiS😡. Tylko w 2022 sprzedał: ❌5 120 ha gruntów rolnych i leśnych obcokrajowcom. Największa grupa to Niemcy. #oszustwaNawrockiego",7,338,198,543,12-08-25,272,37,,https://nitter.net/StGawlowski/status/1955163213517005230#m
97,PolsatNewsPL,"- Polacy są zbyt mądrym narodem, aby myśleć, że premier chce obniżyć ceny energii. Chodzi w istocie o to, aby zwiększyć oddziaływanie firm lobbystycznych na gospodarstwa domowe - przekazał @NawrockiKn w programie #GoscWydarzen. 🎙️@BogRymanowski polsatnews.pl/wiadomosc/2025…",14,357,193,564,12-08-25,274,35,,https://nitter.net/PolsatNewsPL/status/1955330353713062324#m
98,Inevitablewest,"🚨BREAKING: Thousands of Polish football fans erupt chanting ""Karol Nawrocki"", when the new President entered the stadium The EU bureaucrats are finished. Poland has found their leader.",85,4735,209,5029,12-08-25,184,27,,https://nitter.net/Inevitablewest/status/1955182934358393110#m
99,OKonserwa,"Czy @prezydentpl Karol Nawrocki ""nie chce taniego prądu dla Polaków""? A może nie chce żeby lobbyści rękami polskich parlamentarzystów wciskali nam turbiny wiatrowe, których nie ma komu ""opchnąć""? 🤔 Najnowszy komentarz @KZiemiec wjechał na nasz kanał",0,14,2,16,13-08-25,249,36,,https://nitter.net/OKonserwa/status/1955551989267669484#m
100,Bart_Wielinski,"Skoro Nawrocki napomina Żurka, że nie jest Bogiem to byłoby fajnie, gdyby sam przestał się za Boga uważać Bo też Nim nie jest",6,368,70,444,12-08-25,125,23,,https://nitter.net/Bart_Wielinski/status/1955340186046672958#m
101,szyna1991,"Nie podobał mi się Nawrocki jako kandydat, ale dla takich pańskich wpisów warto było na niego głosować.",0,0,0,0,13-08-25,103,17,,https://nitter.net/szyna1991/status/1955570201036280022#m
102,lis_tomasz,"Jak Pan Nawrocki chce się spotkać z premierem RP, to powinien go zaprosić do pałacu. Tego wymagają protokół i kurtuazja. Na razie muszą mu wystarczyc spotkania z kibolami. Tam zasady są inne.",2,115,108,225,13-08-25,191,32,,https://nitter.net/lis_tomasz/status/1955544673583591470#m
103,Darekbrzoza,"Wreszcie ktoś powiedział „dość”. Prezydent Karol Nawrocki pozywa Onet – portal należący do spółki z obcym kapitałem, działającej na polskim rynku – za kłamstwa i manipulacje w czasie kampanii wyborczej, wymierzone w niego, jego rodzinę i nawet dzieci. Sprawa trafiła do Sądu Okręgowego w Warszawie, a obok pozwu cywilnego złożono też prywatny akt oskarżenia. W opinii wielu Polaków takie „media” – podobnie jak TVN – od lat budują swój wizerunek na szczuciu, jednostronnym przekazie i manipulacji faktami. Nie jest więc przypadkiem, że dziś stają przed sądem. Portal Onet, powiązany z międzynarodowym koncernem Ringier Axel Springer, będzie musiał wytłumaczyć się z publikacji, które w ocenie Nawrockiego nie miały nic wspólnego z rzetelnym dziennikarstwem. Warto przypomnieć, że zawód dziennikarza to nie tylko praca, ale także misja – zobowiązanie do przestrzegania zasad etyki i moralności zawodowej. Kodeks etyki dziennikarskiej mówi jasno: obowiązkiem jest oddzielanie informacji od komentarza, weryfikowanie źródeł i działanie w interesie prawdy. Kłamstwa i manipulacje, zwłaszcza ze strony mediów finansowanych przez zagraniczny kapitał, są zaprzeczeniem tych zasad. To plucie w twarz odbiorcom i lekceważenie polskiej opinii publicznej. Coraz częściej słychać też głosy, że Polska powinna pójść śladem wielu państw europejskich i wprowadzić realne ograniczenia udziału kapitału obcego w mediach. Takie regulacje funkcjonują m.in.: Francja – maksymalny udział zagranicznego kapitału w radiu i telewizji to 20 proc , a w przypadku prasy drukowanej – 30 proc. Austria – w mediach audiowizualnych udział zagranicznego kapitału nie może przekraczać 49 proc. Dania – ograniczenia własnościowe i licencyjne chronią rynek przed przejęciem przez zagraniczne podmioty spoza UE. Włochy – surowe przepisy antymonopolowe uniemożliwiają nadmierną koncentrację i przejmowanie stacji przez obcy kapitał. Grecja – maksymalny udział zagraniczny w telewizji to 25 proc. Skoro takie mechanizmy od lat chronią media w innych krajach Europy, trudno zrozumieć, dlaczego Polska – państwo z tak burzliwą historią walki o suwerenność i niepodległość – wciąż pozwala, by największe portale informacyjne działały pod dyktando obcych korporacji. Dziś toczy się proces sądowy, ale jutro może to być proces całego środowiska medialnego przed opinią publiczną. Jeśli chcemy, by Polska miała własne, niezależne media – musimy wymusić zmiany. Tak jak bronimy granic, tak samo musimy bronić przestrzeni informacyjnej. Bo kto odda media w obce ręce, ten odda także duszę narodu. za Albert Łyjak",66,1677,346,2089,12-08-25,2566,368,,https://nitter.net/Darekbrzoza/status/1955234035623420296#m
104,twittTM,"Nawrocki w pierwszą podróż jako prezydent miał udać się do Watykanu, po drodze do Białego Domu, ale nie wyszło. Po pierwsze nie jest Prezydentem lecz oszustem mafijnym zaprzysiezonym przez kawalera zakonu maltańskiego Hołownę, po drugie w pierwsz podróż odleciał na żyletę. Dno🤭",1,37,8,46,13-08-25,278,42,,https://nitter.net/twittTM/status/1955524131950108997#m
105,nicto1111,"A dlaczego Nawrocki był na karcie do głosowania pierwszy? No, dlaczego?!",0,0,0,0,13-08-25,72,11,,https://nitter.net/nicto1111/status/1955570074326286617#m
106,JanuszMali33660,"Nawrocki grozi, że nie podpisze ustawy wiatrakowej. O wysokości budżetu prezydenta decyduje parlament i rząd. Obciąć o połowę, abyśmy nie musieli płacić z naszych podatków tym prezydenckim szkodnikom i idiotom…",3,121,88,212,12-08-25,210,30,,https://nitter.net/JanuszMali33660/status/1955366926927978715#m
107,SolidarityRnwd,Everyone now waking up to who and what Nawrocki is and why ruZZia went all in to get him elected?! 🤨,0,9,3,12,13-08-25,100,21,,https://nitter.net/SolidarityRnwd/status/1955536818595827732#m
108,RobinUeOpt,Takich znajomych ma Nawrocki. Jakże to nie dziwi. #niemójprezydent,0,4,0,4,13-08-25,66,9,,https://nitter.net/RobinUeOpt/status/1955530148268347417#m
109,HubnerrMax,"PO i ich sekta nie ma pojęcia o państwowości. Zwłaszcza polskiej. Prezydent Nawrocki mówiąc ""Prezydent"" nie mówi o sobie. Mówi o urzędzie który pełni, odseparowując go od swojej osoby. Jest to wyrazem głębokiego szacunku do Rzeczpospolitej. Nigdy nie pojmiecie tej dumy.",0,18,1,19,13-08-25,270,41,,https://nitter.net/HubnerrMax/status/1955564340964192654#m
110,Beata_Andre,Nawrocki może dziś blokować obniżkę cen prądu bez żadnych konsekwencji. Bo jego wyborcy nie głosowali na tańsze rachunki. Głosowali na nienawiść do Tuska. Reszta ich nie obchodzi. Dobranoc 😴,0,80,53,133,12-08-25,190,29,,https://nitter.net/Beata_Andre/status/1955381382315905115#m
111,AndrzejekMitura,"Nawrocki to sobie może wsadzić ten silny mandat w buty. Każda ustawa podpisana przez tego alfonsa może zostać zaskarżona do TSUE !!! Niby wygrał wybory, które odbywały się z pogwałceniem naszej konstytucji. Rząd PiS uchwalił ustawę sprzeczną z naszą konstytucją, właśnie po to przejął TK . Chciał rządzić wiecznie i bezkarnie okradać Polaków 😡 Nie wiem tylko dlaczego Pan @donaldtusk marnuje nasz czas. Praworządności nie da się w ten sposób przywrócić. Każde ustanowione prawo z podpisem tego alfonsa można zaskarżyć, Polska zapłaci kary i będzie musiała się z tego wycofać !!! Art. 8. Naszej konstytucji Konstytucja jest najwyższym prawem Rzeczypospolitej Polskiej. Przepisy Konstytucji stosuje się bezpośrednio, chyba że Konstytucja stanowi inaczej.",0,0,0,0,13-08-25,752,111,,https://nitter.net/AndrzejekMitura/status/1955496035955904899#m
112,MrWhitie,"Jeśli Nawrocki będzie wetował durne ustawy, chodził na mecze i gadał z ludźmi na ulicy, za 5 lat znowu na niego zagłosuje. Żeby się elita narodu zesrywała dalej.",12,457,171,640,11-08-25,161,28,,https://nitter.net/MrWhitie/status/1954986403554791559#m
113,j_wisniewska,"Miazga! Prezydent Nawrocki do Żurka: nie jesteś Bogiem, uświadom to sobie! Zgadzasz się? Zostaw lajka i podaj dalej 🔁",10,466,217,693,12-08-25,117,19,,https://nitter.net/j_wisniewska/status/1955358752603074920#m
114,znowu_samolotem,No to przypomnijmy sobie wykształcenie prezydentów RP: - Lech Wałęsa - zawodowe - Aleksander Kwaśniewski wyższe 1 stopnia - Lech Kaczyński - profesor - Bronisław Komorowski - magister - Andrzej Duda - doktor - Karol Nawrocki - doktor Ktoś z Państwa ma jakieś pytania?,12,413,479,904,12-08-25,267,44,,https://nitter.net/znowu_samolotem/status/1955333667246461284#m
115,gfkot,"Czy Nawrocki wie, że byśmy mogli sobie pofedrować, dopłacamy z budżetu milion złotych na godzinę? Pytanie retoryczne.",3,58,24,85,13-08-25,117,17,,https://nitter.net/gfkot/status/1955555296627077456#m
116,Woloszanski2023,Jeśli prezydent Nawrocki zawetuje ustawę o mrożeniu cen prądu to rachunki typowego gospodarstwa wzrosną o 20-30 zł miesięcznie.,1,16,16,33,13-08-25,127,18,,https://nitter.net/Woloszanski2023/status/1955557675175129443#m
117,CamaroJaro,"Pierwszym ""wiatrakiem"" był żagiel, kawał szmaty rozpiętej na maszcie od tysiącleci zamieniał energię wiatru na siłę napędzającą łodzie. Pierwsze wiatraki ""wiatrakowe"" budowali Persowie kilkaset lat p.n.e. Wynalazek zdobył cały świat. A potem przyszedł Nawrocki.",0,63,10,73,12-08-25,261,34,,https://nitter.net/CamaroJaro/status/1955212428196651375#m
118,RPasnicki,"Widzę ekscytację projektem tzw. podatku kościelnego. Nie ma co bić piany, ponieważ nie jest to w interesie KK, więc Nawrocki takiej ustawy nie podpisze. A może nawet odeśle ją do tzw. TK, aby ten orzekł, iż taki podatek jest absolutnie niezgodny z Konstytucją i nawet konkordatem.",1,21,11,33,13-08-25,280,46,,https://nitter.net/RPasnicki/status/1955502706799546438#m
119,j_wisniewska,"Miazga! Prezydent Nawrocki do Żurka: nie jesteś Bogiem, uświadom to sobie! Zgadzasz się? Zostaw lajka i podaj dalej 🔁",10,466,217,693,12-08-25,117,19,,https://nitter.net/j_wisniewska/status/1955358752603074920#m
120,JimFergusonUK,"BREAKING:🚨 MAKE EUROPE GREAT AGAIN — RISING VOICES OF FREEDOM 🚨 At the inauguration of Poland’s new President Karol Nawrocki, my friend Gheorghe Piperea, Romanian MP and fearless defender of Romania’s sovereignty, delivered a speech that electrified the room. 🇷🇴 From Bucharest to Brussels, he warned of the erosion of national sovereignty and the creeping hand of EU overreach. CBDC's are the end of freedom and privacy. 🇵🇱 He praised the courage of George Simion and the new Polish President, calling them proof that patriots are taking their nations back. 🗣️ He stands for free speech, a strong Europe of nations, and a future where our countries write their own destiny — not Brussels bureaucrats. 💥 And he dropped a political thunderbolt: Ursula von der Leyen will soon face ANOTHER vote of no confidence. The fight is far from over. 🔥 Europe needs more voices like Gheorghe Piperea — principled, unyielding, and committed to freedom. Together, we are building the alliances that will break the chains of globalist control. @georgesimion @GPiperea @NawrockiKn @elonmusk @GiorgiaMeloni",5,121,11,137,12-08-25,1089,174,,https://nitter.net/JimFergusonUK/status/1955258988947296434#m
121,Bart_Wielinski,"Skoro Nawrocki napomina Żurka, że nie jest Bogiem to byłoby fajnie, gdyby sam przestał się za Boga uważać Bo też Nim nie jest",6,368,70,444,12-08-25,125,23,,https://nitter.net/Bart_Wielinski/status/1955340186046672958#m
122,KaziSmolinski,"Obniżka cen prądu? Nie. Ustawa wiatrakowa to ustawa napisana przez lobbystów, aby wpuścić do Polski szeroką ławą niemieckie wiatraki. Niedługo Prezydent Nawrocki złoży ustawę o obniżce cen prądu bez niemieckich wiatraków w gratisie i zobaczymy co zrobi Tusk.",3,114,55,172,12-08-25,258,38,,https://nitter.net/KaziSmolinski/status/1955340917344268463#m
123,lis_tomasz,"Jak Pan Nawrocki chce się spotkać z premierem RP, to powinien go zaprosić do pałacu. Tego wymagają protokół i kurtuazja. Na razie muszą mu wystarczyc spotkania z kibolami. Tam zasady są inne.",2,115,108,225,13-08-25,191,32,,https://nitter.net/lis_tomasz/status/1955544673583591470#m
124,KrzyLuft,"Jeśli Prezydent Nawrocki zawetuje ustawę o obniżeniu cen prądu, to każdy odbiorca prądu powinien dostać, razem z fakturą ulotkę wyjaśniającą, że ceny rosną z powodu prezydenckiego weta do tej ustawy. PiS robił takie akcje wielokrotnie, więc nikt nie powinien mieć pretensji.",28,306,468,802,12-08-25,274,41,,https://nitter.net/KrzyLuft/status/1955370835952406554#m
125,Kryhor,"Ten cep mówi że jeśli Ukraina przegra wojnę to winny będzie Nawrocki. A może durniu, te 80 tys banderowskich byków, powinno być w Donbasie, zamiast na Narodowym.",0,6,4,10,13-08-25,161,27,,https://nitter.net/Kryhor/status/1955563256200011805#m
126,AldonaScha22463,Czekam na wyrok🤣 może być ciekawiej. A czemu to Nawrocki na pozwał w trybie wyborczym. Myślę że Onet bez sprawdzenia nie pisze. Zawszę są wiarygodni.,0,3,0,3,12-08-25,149,25,,https://nitter.net/AldonaScha22463/status/1955264218791281082#m
127,Wlodkowski65884,Ty tępa Dzido alfons nawrocki też nie jest bogiem,0,0,0,0,13-08-25,49,9,,https://nitter.net/Wlodkowski65884/status/1955569863671636280#m
128,SebiA52469230,"Nawrocki – człowiek nielegalnie zajmujący pałac prezydencki, polityk na sznurku Kaczyńskiego paradujący w mundurku historyka – postanowił wejść w buty komisarza partyjnej rewolucji.",0,0,0,0,13-08-25,181,23,,https://nitter.net/SebiA52469230/status/1955569859951317500#m
129,lis_tomasz,"Nawrocki mówi Żurkowi, że ten nie jest Bogiem. Dzięki Bogu Żurek to wie. Teraz wystarczy, by- być może z pomocą Boga- dowiedział się tego o sobie Nawrocki.",0,44,20,64,13-08-25,155,27,,https://nitter.net/lis_tomasz/status/1955551459963257046#m
130,_Afraniusz,"Pierdololo Nawrocki. Najpierw się czegoś naucz, potem sie odzywaj.",0,5,1,6,13-08-25,66,9,,https://nitter.net/_Afraniusz/status/1955499410009493545#m
131,StGawlowski,"Nawrocki zaczyna od oszustwa, podpisuje projekt ustawy zakazujący sprzedaży obcokrajowcom ziemię rolną i leśną‼️ Rekordy w sprzedaży pobił rząd PiS😡. Tylko w 2022 sprzedał: ❌5 120 ha gruntów rolnych i leśnych obcokrajowcom. Największa grupa to Niemcy. #oszustwaNawrockiego",7,338,198,543,12-08-25,272,37,,https://nitter.net/StGawlowski/status/1955163213517005230#m
132,HubnerrMax,"PO i ich sekta nie ma pojęcia o państwowości. Zwłaszcza polskiej. Prezydent Nawrocki mówiąc ""Prezydent"" nie mówi o sobie. Mówi o urzędzie który pełni, odseparowując go od swojej osoby. Jest to wyrazem głębokiego szacunku do Rzeczpospolitej. Nigdy nie pojmiecie tej dumy.",0,18,1,19,13-08-25,270,41,,https://nitter.net/HubnerrMax/status/1955564340964192654#m
133,znowu_samolotem,No to przypomnijmy sobie wykształcenie prezydentów RP: - Lech Wałęsa - zawodowe - Aleksander Kwaśniewski wyższe 1 stopnia - Lech Kaczyński - profesor - Bronisław Komorowski - magister - Andrzej Duda - doktor - Karol Nawrocki - doktor Ktoś z Państwa ma jakieś pytania?,12,414,479,905,12-08-25,267,44,,https://nitter.net/znowu_samolotem/status/1955333667246461284#m
134,EwaZamojska,"Nawrocki do Żurka:"" Panie ministrze, nie jesteś Bogiem, uświadom to sobie"". Może minister Żurek nie jest Bogiem, ale na pewno nie jest sutenerem, lichwiarzem, kibolem i sympatykiem nazioli.",5,246,118,369,13-08-25,189,28,,https://nitter.net/EwaZamojska/status/1955508884271161803#m
