id,username,text,likes,retweets,replies,total_interactions,post_date_iso,text_length,word_count,sentiment_label,link
142,Oltom154,Nie łżyj gamoniu. Pan prezydent Karol Nawrocki 3 września spotka się z prezydentem Trumpem w cztery oczy. Tymczasem Tusk i Zdradek mają całkowity szlaban na wstęp do Białego Domu. 😂🤣😂,0,1,0,1,19-08-25,183,30,,https://nitter.net/Oltom154/status/1957728609059090787#m
143,Bart_Wielinski,"W kampanii wyborczej sztabowcy Nawrockiego przekonywali, że najważniejszą zaletą ich kandydata, jest to że umie dać po zębach, zaś znajomość języków obcych to cecha mięczaków i słabeuszy W drugim tygodniu prezydentury oni i Nawrocki zostali boleśnie zweryfikowani",3,399,53,455,19-08-25,263,37,,https://nitter.net/Bart_Wielinski/status/1957672282760876468#m
144,MalgosiaCal,"Prof. Czaputowicz w Poranku @Radio_TOK_FM: Nawrocki nie pojechał wczoraj do Waszngtonu, bo nikt go tam nie chciał. W czasie ostatniej telekonferencji Nawrocki miał pouczać Trumpa, jak rozmawiać z Putinem i opowiadać o Bitwie Warszawskiej bez większego związku z tematem. Dramat!",12,289,22,323,19-08-25,278,40,,https://nitter.net/MalgosiaCal/status/1957679074081427850#m
145,GiertychRoman,W pierwszym tygodniu po wadliwym zaprzysiężeniu Nawrocki dopuścił się zdrady dyplomatycznej. Wyrzucił Polskę z najważniejszego formatu światowych przywódców. #ZdradaDyplomatyczna,21,887,464,1372,18-08-25,178,19,,https://nitter.net/GiertychRoman/status/1957396045073183111#m
146,Insightful345,"Nawrocki to celebryta. Nie zdaje sobie sprawy z powagi sytuacji, jest amatorem. Realna polityka rozgrywa się teraz, a on chowa głowę w piasek, bo wie, że nie nadaje się na tak ważne stanowisko. To amator w krajowej i międzynarodowej polityce.",0,0,0,0,19-08-25,242,40,,https://nitter.net/Insightful345/status/1957730676028932197#m
147,FarmerkaPL,"Prezydent Nawrocki „Na wojnę polskich chłopców nie wyślę!!!""",1,31,6,38,19-08-25,60,8,,https://nitter.net/FarmerkaPL/status/1957701169154756842#m
148,CzcigodnaPolka,"Premier Tusk wyraźnie podkreślił, że będzie współpracował, poprosił o spotkanie, nie prowadził agresywnej narracji walki o krzesło przy stole, a Nawrocki oświadczył, że ma świetne stosunki z Trumpem - a nie ma go w USA. Dzisiaj trzeba zadać pytanie: jakie rodzaju są to stosunki?",1,8,3,12,19-08-25,279,44,,https://nitter.net/CzcigodnaPolka/status/1957722625150710251#m
149,ryszcuk,Dzisiaj gdy wszyscy ważni w Europie zbierają się aby pomóc Ukrainie...Nawrocki odstawiał dla pismatołków takie właśnie szopki...👎👎👎👎,25,289,676,990,17-08-25,132,17,,https://nitter.net/ryszcuk/status/1957200844719284369#m
150,NocnaZ,"Trump raczył powiedzieć, że w spotkaniu wzięły udział silne kraje europejskie, które reprezentowały inne kraje europejskie. Pierwszy egzamin oblany panie Nawrocki.",2,180,57,239,18-08-25,163,21,,https://nitter.net/NocnaZ/status/1957520482653393285#m
151,poselTTrela,"Trump przy stole z liderami Europy. Nawrocki przy stole w kuchni. Wystarczyło 13 dni, to będzie jeszcze większa błazenada niż za Dudy. #NiewidzialneKontakty",6,85,254,345,19-08-25,156,23,,https://nitter.net/poselTTrela/status/1957675429537489367#m
152,Anna_Hev,"Pozornie dobre kontakty prez. Nawrockiego z prez. Trumpem mają charakter selfie. Prez. Nawrocki w polityce zagranicznej, w dyplomacji, jest kompletnym amatorem. Przy Tusku czy przy Sikorskim ta amatorszczyzna. Widoczna i dotkliwa. - @BZdrojewski",0,43,5,48,18-08-25,245,33,,https://nitter.net/Anna_Hev/status/1957540827460206610#m
153,KarolPopieramy,"🚨 Prezydent Karol Nawrocki: „Jako Prezydent RP jestem w stałym kontakcie z sojusznikami. W spotkaniach „koalicji chętnych” reprezentuje nas rząd D. Tuska, który nie został zaproszony. Natomiast już trzeciego września jako europejski lider będę w Białym Domu.” 👏🇵🇱",0,57,38,95,19-08-25,263,38,,https://nitter.net/KarolPopieramy/status/1957709669016670598#m
154,832xxl,"""Zostaliśmy bez dobrych kart i dlatego nie ma nas w Białym Domu"". Dlaczego Polacy nie polecieli do Trumpa onet.pl/informacje/newsweek/…",0,0,0,0,19-08-25,135,19,,https://nitter.net/832xxl/status/1957730619493843357#m
155,egizelska,"Rubio stwierdził, że europejscy przywódcy nie przylatują, by niańczyć prezydenta Ukrainy, ale dlatego, że zostali zaproszeni. Kolejny potwierdza, że to nie Żeleński wybierał sobie otoczenie. Nawrocki nie został zaproszony przez Trumpa i basta,",1,104,4,109,18-08-25,243,33,,https://nitter.net/egizelska/status/1957558948082368837#m
156,Woloszanski2023,"Były MSZ w rządzie PiS, prof. Czaputowicz: Nawrocki nie pojechał wczoraj do Waszngtonu, bo nikt go tam nie chciał. W czasie ostatniej telekonferencji Nawrocki miał pouczać Trumpa, jak rozmawiać z Putinem i opowiadać o Bitwie Warszawskiej bez większego związku z tematem.",4,148,47,199,19-08-25,270,41,,https://nitter.net/Woloszanski2023/status/1957711892815761587#m
157,Dariusz_Jonski,"To Karol Nawrocki powinien wyjaśnić, dlaczego nie ma go w Białym Domu. polityka.se.pl/wiadomosci/da…",8,144,271,423,18-08-25,100,13,,https://nitter.net/Dariusz_Jonski/status/1957446483214553493#m
158,Memy_Polityczne,"W Białym Domu przy stole są Trump, Zełenski, Macron, Scholz… a Polska? Nikogo. Prezydent Nawrocki tłumaczy się: ""we wrześniu"", ""uprzywilejowane relacje""… Efekt? Polska poza stołem, kiedy dzieje się historia. Hipokryzja w czystej postaci. Dziękujemy PiS. Proszę o szerokiego RT! Wesprzyj memiczną walkę z absurdem: buycoffee.to/memy-polityczne #Memy #MemyPolityczne #Polska2025 #Polityka #SilniRazem #TeamTuska",1,50,11,62,18-08-25,409,51,,https://nitter.net/Memy_Polityczne/status/1957534623207993830#m
159,IIAnnaMagdalena,"To nie Nawrocki nie dotarł wczoraj do Białego Domu. To europejscy liderzy zepsuli mu plan lansu na ""nowego lidera Europy"" (to nie żart) planowany ""inauguracyjnym przytupem"" na 3 września i za wcześnie tam dotarli.. 😉Dlaczego przedstawiciele Kancelarii Prezydenta tak nerwowo reagują na informację, że do ostatnich chwil ""nie wykluczali jego uczestnictwa"", co byłoby logicznie spójne z zaplanowaną strategią i równie logicznym następstwem wykluczenia z rozmów Premiera Tuska? Bo równie logicznym następstwem są pytania, dlaczego finalnie wykluczyli? A odpowiedź jest przyziemnie prosta. Czym innym jest aranżowanie ustawek z telefonem w ręku, wykute na pamięć przemówienia, sztywny plan wizyt na najwyższym szczeblu z przyklejonym uśmiechem i uściskiem rąk, czym innym spontaniczne spotkania w gronie europejskich przywódców, nad którymi PR- owo zapanować się nie da. I tu dochodzimy do sedna. Nie mamy prezydenta międzynarodowego kalibru, sprawnie operującego językiem angielskim, wytrawnego gracza, wytrenowanego w rozmowach. Mamy kukłę z marnymi kompetencjami bez doświadczenia i obserwujemy usilne próby lepienia jej na podobiznę lidera. Niestety, kosztem niszczenia wiarygodności Polski.",16,406,124,546,19-08-25,1191,162,,https://nitter.net/IIAnnaMagdalena/status/1957677666884112424#m
160,Woloszanski2023,"Były MSZ w rządzie PiS, prof. Czaputowicz: Nawrocki nie pojechał wczoraj do Waszngtonu, bo nikt go tam nie chciał. W czasie ostatniej telekonferencji Nawrocki miał pouczać Trumpa, jak rozmawiać z Putinem i opowiadać o Bitwie Warszawskiej bez większego związku z tematem.",4,148,48,200,19-08-25,270,41,,https://nitter.net/Woloszanski2023/status/1957711892815761587#m
161,Kasia__SZ,"Najwyższa pora, żeby Nawrocki zrozumiał na jaki urząd się rzucił…. To już nie ustawki kibolskie i statki miłości…",0,0,0,0,19-08-25,113,18,,https://nitter.net/Kasia__SZ/status/1957730557137178772#m
162,irenagos,"Bajka o zapatrzonym w siebie gangsterze-bokserze i dyplomatycznym zerze... A morał z tej bajki niech będzie przestrogą, za pychę w polityce płaci się bardzo drogo... #ZdradaDyplomatyczna #KomuSłużyNawrocki wyborcza.pl/7,75399,32184360…",0,32,0,32,18-08-25,235,28,,https://nitter.net/irenagos/status/1957409847336435790#m
163,olo_adam,Batyr obraził się na Nawrockiego a Nawrocki na Batyra i oba dwa strzelili focha i żaden nie pojechał. Łot co.,0,0,0,0,19-08-25,109,20,,https://nitter.net/olo_adam/status/1957730539244290169#m
164,magdazwarmii,"A poważnie, co miałby Nawrocki powiedzieć, gdyby tam pojechał. Przecież jest antyukraiński, antyeuropejski, więc tym samym antypolski. Nie mógłby siedzieć po stronie Żeleńskiego z europejskimi przywódcami. Dzisiaj broni go cały konfederacki aktyw. Nawet mocniej niż pisowski.",2,262,48,312,18-08-25,275,36,,https://nitter.net/magdazwarmii/status/1957456845129330748#m
165,jachcy,"Wielki człowiek, wielki krzyk, wielki wrzask i Rosja w sercu…🔥 ➡️„Panie Karolu Nawrocki co pan powiedział temu Trumpowi, że on tak nagle przyjaźnie do tego Putina podchodzi…”🤡",4,48,102,154,19-08-25,175,27,,https://nitter.net/jachcy/status/1957661463029649690#m
166,KONFEDERACJA_,"🇵🇱 @EwaZajaczkowska: Daliście Ukrainie wszystko, nie oczekując niczego w zamian! Andrzej Duda był bardziej prezydentem Ukrainy niż Polski. Mam nadzieję, że prezydent Nawrocki będzie rzecznikiem polskich interesów!",8,179,125,312,17-08-25,213,27,,https://nitter.net/KONFEDERACJA_/status/1956993345827618958#m
167,Dariusz_Jonski,Nawrocki będzie się uczył dyplomacji jak Duda angielskiego. Musimy być bardzo cierpliwi.,15,195,767,977,18-08-25,88,12,,https://nitter.net/Dariusz_Jonski/status/1957476885358686260#m
168,MSzurstor,"PiS obrzuca błotem Premiera Tuska, że nie pojechał do Białego Domu. Fakty? Premierów od 2008 r. tam nie zapraszają. Pominięto więc rezydenta Nawrockiego. Znowu odwracają kota ogonem.Nawrocki taki byl piękny Amerykanki, i co? i nic , i od premiera wara bo to nie jest wina jego i taka jest prawda",0,7,1,8,19-08-25,295,50,,https://nitter.net/MSzurstor/status/1957717770340016545#m
169,LilkaK664303,"Panie psycholog, Pan Prezydent Nawrocki nie należy do Koalicji Chętnych, to Donek w niej jest, ale go tam nie chcieli. Jeśli tak wyglądają twoje procesy kojarzeniowe, to ja bym twojej porady psychologicznej nie chciała. Nawet, gdybyś mi dopłacił.",0,1,0,1,19-08-25,246,38,,https://nitter.net/LilkaK664303/status/1957718319827390505#m
170,IIAnnaMagdalena,"To nie Nawrocki nie dotarł wczoraj do Białego Domu. To europejscy liderzy zepsuli mu plan lansu na ""nowego lidera Europy"" (to nie żart) planowany ""inauguracyjnym przytupem"" na 3 września i za wcześnie tam dotarli.. 😉Dlaczego przedstawiciele Kancelarii Prezydenta tak nerwowo reagują na informację, że do ostatnich chwil ""nie wykluczali jego uczestnictwa"", co byłoby logicznie spójne z zaplanowaną strategią i równie logicznym następstwem wykluczenia z rozmów Premiera Tuska? Bo równie logicznym następstwem są pytania, dlaczego finalnie wykluczyli? A odpowiedź jest przyziemnie prosta. Czym innym jest aranżowanie ustawek z telefonem w ręku, wykute na pamięć przemówienia, sztywny plan wizyt na najwyższym szczeblu z przyklejonym uśmiechem i uściskiem rąk, czym innym spontaniczne spotkania w gronie europejskich przywódców, nad którymi PR- owo zapanować się nie da. I tu dochodzimy do sedna. Nie mamy prezydenta międzynarodowego kalibru, sprawnie operującego językiem angielskim, wytrawnego gracza, wytrenowanego w rozmowach. Mamy kukłę z marnymi kompetencjami bez doświadczenia i obserwujemy usilne próby lepienia jej na podobiznę lidera. Niestety, kosztem niszczenia wiarygodności Polski.",16,406,124,546,19-08-25,1191,162,,https://nitter.net/IIAnnaMagdalena/status/1957677666884112424#m
171,ABNPoland,"Wczoraj debilu pisałeś, że to Prezydent Karol Nawrocki powinien brać udział w spotkaniu tej grupy! Ty pierdolnięty w mózg łomem debilu zapomniałeś co pisałeś wczoraj?! Masz kurwa i sam czytaj!",0,14,1,15,19-08-25,192,30,,https://nitter.net/ABNPoland/status/1957725000208662687#m
172,DariuszSmo,Fakty. To Żełeński zapraszał przywódców europejskich którzy towarzyszą mu w rozmowach z Trumpem. Żełenski nie zaprosił Nawrockiego bo go nie lubi za prawdę którą mówi o Ukrainie. Tuska nie zaprosił bo nic nie znaczy. Nawrocki jedzie do Trumpa na jego zaproszenie 3 września.,0,33,4,37,18-08-25,274,43,,https://nitter.net/DariuszSmo/status/1957562510531334431#m
173,wirtualnemedia,Karol @NawrockiKn nie odpuścił Onetowi ws. Grand Hotelu. Jest pozew cywilny i oskarżenie z art. 212 [NASZ NEWS] wirtualnemedia.pl/artykul/ka…,17,156,113,286,19-08-25,141,19,,https://nitter.net/wirtualnemedia/status/1957672587749720331#m
174,KoneserUnii,❗️PILNE❗️ Prezydent Karol Nawrocki mówi o dzisiejszym spotkaniu w Waszyngtonie. To wiele wyjaśnia,10,234,60,304,18-08-25,97,13,,https://nitter.net/KoneserUnii/status/1957376638410248496#m
175,RioGrande2025,Nawrocki zanim zaczął już się skończył!,0,0,0,0,19-08-25,39,6,,https://nitter.net/RioGrande2025/status/1957730298839376382#m
176,ok_graba,"A teraz wyobraźcie sobie to szczucie: 😱 „Nawrocki jak uczniak u Trumpa!” 😱 „Polska straciła suwerenność na rzecz USA” 😱 „Nowy Prezydent RP siedział na rogu jak stara panna” 😱 „Trump pokazał Nawrockiemu gdzie jego miejsce… [ZDJĘCIA]” Takie byłyby nagłówki, gdyby Karol Nawrocki zasiadł po drugiej stronie biurka. A tak muszą się szykować na eleganckie zdjęcia z wrześniowego bilateralnego spotkania Trump-Nawrocki. 😎",0,8,1,9,19-08-25,415,62,,https://nitter.net/ok_graba/status/1957718608563372068#m
177,to_be_honest9,"Nawrocki miał reprezentować Polskę i odmówił. Może to lepiej, niż kolejna kompromitacja po Dudzie, który również miał trudności w kontaktach z europejskimi liderami. PiS ma swojego człowieka, ale szkoda Polski. A moglibyśmy mieć prezydenta, który by nas godnie reprezentował.😔",0,0,0,0,19-08-25,276,39,,https://nitter.net/to_be_honest9/status/1957730287992922438#m
178,Bart_Wielinski,"W kampanii wyborczej sztabowcy Nawrockiego przekonywali, że najważniejszą zaletą ich kandydata, jest to że umie dać po zębach, zaś znajomość języków obcych to cecha mięczaków i słabeuszy W drugim tygodniu prezydentury oni i Nawrocki zostali boleśnie zweryfikowani",3,400,53,456,19-08-25,263,37,,https://nitter.net/Bart_Wielinski/status/1957672282760876468#m
179,miloszlodowski,"Nie no jednak Karol Nawrocki miał największy wpływ, z całym szacunkiem, ale to @NawrockiKn udźwignął kampanię w okolicznościach krytycznych",0,1,0,1,19-08-25,139,19,,https://nitter.net/miloszlodowski/status/1957728685462524231#m
180,MarzenaPaczuska,"Nawrocki konsekwentnie zrobił to, co zapowiadał. A Wyborcza dzisiaj chlipie:",4,113,22,139,19-08-25,76,10,,https://nitter.net/MarzenaPaczuska/status/1957686769035436461#m
181,szumand,"Jakby nie patrzeć, to ten cały Nawrocki to jest zwykła PiSda. Otaczające się innymi PiSdami. Jedyne co osłabił tym, że nie poleciał wczoraj do Washingtonu, jest on sam i jego pozycja, bo cały świat zobaczył, że to PiSda.",0,12,5,17,19-08-25,220,38,,https://nitter.net/szumand/status/1957709051191533859#m
182,TheBardon1969,"Ja to widzę tak. Nawrocki nie poleciał do Stanów na spotkanie liderów bo jego angielski jest na poziomie ""TuTiTu rum tu tu"" czyli "" dwie herbaty do pokoju 22"" i siedząc w gronie osób biegle rozmawiających w języku angielskim siedziałby tam jak pizda w kącie ewentualnie mógłby tylko w szatni numerki wydawać. Mógł być w gronie wielkich ustanawiających porządek świata ale jak się ma doradcę w postaci Kempy i Andruszkiewicza to jednak lepiej że został w domu.",0,137,51,188,18-08-25,459,77,,https://nitter.net/TheBardon1969/status/1957534647560106163#m
183,gfkot,Za brak polskiej reprezentacji w trakcie dzisiejszych rozmów Trump - Zełenski odpowiada w 100% Nawrocki i jego kancelaria. Płacimy za “nie” dla Ukrainy w NATO zadeklarowane przez Nawrockiego i jego agresywne przepychanki z rządem w sprawie kontaktów z administracją amerykańską.,7,426,58,491,18-08-25,278,40,,https://nitter.net/gfkot/status/1957376569011208539#m
184,Sikorka789,"Prezydent Nawrocki nie pojechał bo do "" koalicji chętnych ""należy Tusk i to jego nie chciał widzieć prezydent Trump.Nie obracaj kota ogonem komunistyczny debilu.",0,0,0,0,19-08-25,161,24,,https://nitter.net/Sikorka789/status/1957730712477487513#m
185,MalgosiaCal,"Prof. Czaputowicz w Poranku @Radio_TOK_FM: Nawrocki nie pojechał wczoraj do Waszngtonu, bo nikt go tam nie chciał. W czasie ostatniej telekonferencji Nawrocki miał pouczać Trumpa, jak rozmawiać z Putinem i opowiadać o Bitwie Warszawskiej bez większego związku z tematem. Dramat!",12,289,22,323,19-08-25,278,40,,https://nitter.net/MalgosiaCal/status/1957679074081427850#m
186,GiertychRoman,W pierwszym tygodniu po wadliwym zaprzysiężeniu Nawrocki dopuścił się zdrady dyplomatycznej. Wyrzucił Polskę z najważniejszego formatu światowych przywódców. #ZdradaDyplomatyczna,21,887,464,1372,18-08-25,178,19,,https://nitter.net/GiertychRoman/status/1957396045073183111#m
187,Insightful345,"Nawrocki to celebryta. Nie zdaje sobie sprawy z powagi sytuacji, jest amatorem. Realna polityka rozgrywa się teraz, a on chowa głowę w piasek, bo wie, że nie nadaje się na tak ważne stanowisko. To amator w krajowej i międzynarodowej polityce.",0,0,0,0,19-08-25,242,40,,https://nitter.net/Insightful345/status/1957730676028932197#m
188,FarmerkaPL,"Prezydent Nawrocki „Na wojnę polskich chłopców nie wyślę!!!""",1,31,6,38,19-08-25,60,8,,https://nitter.net/FarmerkaPL/status/1957701169154756842#m
189,CzcigodnaPolka,"Premier Tusk wyraźnie podkreślił, że będzie współpracował, poprosił o spotkanie, nie prowadził agresywnej narracji walki o krzesło przy stole, a Nawrocki oświadczył, że ma świetne stosunki z Trumpem - a nie ma go w USA. Dzisiaj trzeba zadać pytanie: jakie rodzaju są to stosunki?",1,9,3,13,19-08-25,279,44,,https://nitter.net/CzcigodnaPolka/status/1957722625150710251#m
190,ryszcuk,Dzisiaj gdy wszyscy ważni w Europie zbierają się aby pomóc Ukrainie...Nawrocki odstawiał dla pismatołków takie właśnie szopki...👎👎👎👎,25,289,676,990,17-08-25,132,17,,https://nitter.net/ryszcuk/status/1957200844719284369#m
191,NocnaZ,"Trump raczył powiedzieć, że w spotkaniu wzięły udział silne kraje europejskie, które reprezentowały inne kraje europejskie. Pierwszy egzamin oblany panie Nawrocki.",2,180,57,239,18-08-25,163,21,,https://nitter.net/NocnaZ/status/1957520482653393285#m
192,poselTTrela,"Trump przy stole z liderami Europy. Nawrocki przy stole w kuchni. Wystarczyło 13 dni, to będzie jeszcze większa błazenada niż za Dudy. #NiewidzialneKontakty",6,85,254,345,19-08-25,156,23,,https://nitter.net/poselTTrela/status/1957675429537489367#m
193,Anna_Hev,"Pozornie dobre kontakty prez. Nawrockiego z prez. Trumpem mają charakter selfie. Prez. Nawrocki w polityce zagranicznej, w dyplomacji, jest kompletnym amatorem. Przy Tusku czy przy Sikorskim ta amatorszczyzna. Widoczna i dotkliwa. - @BZdrojewski",0,43,5,48,18-08-25,245,33,,https://nitter.net/Anna_Hev/status/1957540827460206610#m
194,KarolPopieramy,"🚨 Prezydent Karol Nawrocki: „Jako Prezydent RP jestem w stałym kontakcie z sojusznikami. W spotkaniach „koalicji chętnych” reprezentuje nas rząd D. Tuska, który nie został zaproszony. Natomiast już trzeciego września jako europejski lider będę w Białym Domu.” 👏🇵🇱",0,57,38,95,19-08-25,263,38,,https://nitter.net/KarolPopieramy/status/1957709669016670598#m
195,832xxl,"""Zostaliśmy bez dobrych kart i dlatego nie ma nas w Białym Domu"". Dlaczego Polacy nie polecieli do Trumpa onet.pl/informacje/newsweek/…",0,0,0,0,19-08-25,135,19,,https://nitter.net/832xxl/status/1957730619493843357#m
196,egizelska,"Rubio stwierdził, że europejscy przywódcy nie przylatują, by niańczyć prezydenta Ukrainy, ale dlatego, że zostali zaproszeni. Kolejny potwierdza, że to nie Żeleński wybierał sobie otoczenie. Nawrocki nie został zaproszony przez Trumpa i basta,",1,104,4,109,18-08-25,243,33,,https://nitter.net/egizelska/status/1957558948082368837#m
197,Woloszanski2023,"Były MSZ w rządzie PiS, prof. Czaputowicz: Nawrocki nie pojechał wczoraj do Waszngtonu, bo nikt go tam nie chciał. W czasie ostatniej telekonferencji Nawrocki miał pouczać Trumpa, jak rozmawiać z Putinem i opowiadać o Bitwie Warszawskiej bez większego związku z tematem.",4,148,48,200,19-08-25,270,41,,https://nitter.net/Woloszanski2023/status/1957711892815761587#m
198,Dariusz_Jonski,"To Karol Nawrocki powinien wyjaśnić, dlaczego nie ma go w Białym Domu. polityka.se.pl/wiadomosci/da…",8,144,271,423,18-08-25,100,13,,https://nitter.net/Dariusz_Jonski/status/1957446483214553493#m
199,Memy_Polityczne,"W Białym Domu przy stole są Trump, Zełenski, Macron, Scholz… a Polska? Nikogo. Prezydent Nawrocki tłumaczy się: ""we wrześniu"", ""uprzywilejowane relacje""… Efekt? Polska poza stołem, kiedy dzieje się historia. Hipokryzja w czystej postaci. Dziękujemy PiS. Proszę o szerokiego RT! Wesprzyj memiczną walkę z absurdem: buycoffee.to/memy-polityczne #Memy #MemyPolityczne #Polska2025 #Polityka #SilniRazem #TeamTuska",1,50,11,62,18-08-25,409,51,,https://nitter.net/Memy_Polityczne/status/1957534623207993830#m
200,Bart_Wielinski,"W kampanii wyborczej sztabowcy Nawrockiego przekonywali, że najważniejszą zaletą ich kandydata, jest to że umie dać po zębach, zaś znajomość języków obcych to cecha mięczaków i słabeuszy W drugim tygodniu prezydentury oni i Nawrocki zostali boleśnie zweryfikowani",3,400,53,456,19-08-25,263,37,,https://nitter.net/Bart_Wielinski/status/1957672282760876468#m
