id,username,text,likes,retweets,replies,total_interactions,post_date_iso,text_length,word_count,sentiment_label,link
67,Bagniusz,Jak to jest że Trzaskowski sam zaproponował odebranie 800+ nie pracującym Ukraińcom i wtedy to było popierane a jak zrobił dokładnie to samo Nawrocki to nagle się tym lewakom to nie podoba? Czy ci ludzie są normalni? Zrealizował coś z waszego programu i dalej źle… istne debile,0,0,0,0,28-08-25,277,47,,https://nitter.net/Bagniusz/status/1960926355043791256#m
68,poselTTrela,"Rada Gabinetowa go przerosła, więc sięgnął po jedyne, co mu zostało - weto. Cały Nawrocki!",0,7,5,12,28-08-25,90,15,,https://nitter.net/poselTTrela/status/1960921741456204230#m
69,krzysztof_dykas,"Czy zna ktoś uzasadnienie weta do Nowelizacji ustawy o Ochronie Roślin? Serio pytam, bo trudno mi uwierzyć, że Nawrocki zawetował to na zasadzie : Nie Bo Nie #StopBatyryzacjiPolski",0,108,68,176,27-08-25,180,28,,https://nitter.net/krzysztof_dykas/status/1960754052171751659#m
70,JanMolskiIII,"Nie no bez jaj. 🤦🏼‍♂️ W TVP teraz kręcą aferę, że Prezydent Nawrocki powiedział: „Trzeba porozmawiać po męsku” XDDDDD nitter.net/chrzanikx/status/19607…",13,161,177,351,27-08-25,152,20,,https://nitter.net/JanMolskiIII/status/1960710461977997555#m
71,Gasiuk_Pihowicz,Po porażce Rady Gabinetowej Nawrocki wpadł w amok wetowania. Ofiarami przypadkowe ustawy o środkach ochrony roślin i o zapasach ropy. Zdecydowanie za dużo snusów.,2,136,214,352,27-08-25,162,24,,https://nitter.net/Gasiuk_Pihowicz/status/1960773985286939078#m
72,LepkowskaGolas,"Prezydent Nawrocki pisał ustawę o CPK, żeby kolej wróciła do Łomży… a tymczasem my już mamy konkretne terminy – 2026 rok pierwsze pociągi, 2027 Intercity 🚄 bo my #RobimyNieGadamy #KolejNaŁomżę",6,237,37,280,27-08-25,192,30,,https://nitter.net/LepkowskaGolas/status/1960674324399980550#m
73,MarcinPalade,"""Tageszeitung"": ""Zawetowaniem ustawy dotyczącej pomocy obywatelom Ukrainy, Karol Nawrocki gra na rękę prezydentowi Rosji"". Niemcy są chyba ostatnim krajem z prawem do zarzucania innemu krajowi, że gra na rękę prezydentowi Rosji. Choćby takie Nord Stream nie wzięło się z powietrza",0,86,14,100,27-08-25,280,40,,https://nitter.net/MarcinPalade/status/1960786991194251631#m
74,GiertychRoman,"Rozumiem, że Nawrocki walczy z wiatrakami, ale z zapasami ropy i ochroną roślin? Ten gość jest coraz śmieszniejszy. To pewnie zemsta za baty jakie dostał od PDT na oczach całej Polski.",7,480,340,827,27-08-25,184,31,,https://nitter.net/GiertychRoman/status/1960757527903121414#m
75,KaziSmolinski,"No dobrze, wiedziałem, że Prezydent Nawrocki na dzisiejszej radzie gabinetowej ostro będzie punktował Tuska, ale to co się dzieje przerosło moje oczekiwania. Prezydent ostatecznie skompromitował ten rząd. Na ich miejscu wstyd by mi było wrócić do swoich ministerstw.",2,107,161,270,27-08-25,266,38,,https://nitter.net/KaziSmolinski/status/1960614390803091500#m
76,e_wrzosek,"Prezydent Nawrocki swoje uprawnienia czerpie wyłącznie z Konstytucji i to ona określa zakres jego kompetencji. Konstytucja wymienia 30 spraw, w których prezydent samodzielnie podejmuje decyzję, wydając tzw. akty urzędowe, m.in. w sprawie zarządzania wyborów parlamentarnych, inicjatywy ustawodawczej i prawa łaski. Pozostałe akty urzędowe wydawane przez prezydenta, aby stały się ważne, wymagają kontrasygnaty, czyli podpisu premiera. I to by było na tyle.",13,429,90,532,27-08-25,456,61,,https://nitter.net/e_wrzosek/status/1960791714219581455#m
77,lis_tomasz,"Jeśli to był wstęp do stworzenia w Polsce systemu prezydenckiego, to raczej słabo wyszło. Ale Kaczyński, choć widział katastrofę Batyra, wie, że owcom i tak się wytłumaczy, że Nawrocki wypadł świetnie.",1,33,40,74,27-08-25,201,31,,https://nitter.net/lis_tomasz/status/1960648517136867633#m
78,Gameover1920,"Donald Tusk jako niemiecki patriota, zamierzał zapasy ropy i gazu trzymać w Niemczech, ale z Prezydentem Karolem Nawrockim takie numery nie przejdą i ustawa zawetowana. Po pierwsze Polska, po pierwsze Polacy! Nawrocki to Prezydent moich marzeń! 😍🤗🇵🇱",0,114,6,120,27-08-25,249,37,,https://nitter.net/Gameover1920/status/1960763954315002290#m
79,HubnerrMax,"Prezydent Karol Nawrocki zawetował, narzucaną przez UE, nowelizację ustawy o zapasach ropu i gazy. Przełożę to tak, żebyście zrozumieli. Prezydent nie pozwolił Miłoszowi Motyce posiadać kompetencji do wyrażania zgody na trzymanie rezerw polskiego gazu w Niemczech. Pięknie.",11,676,42,729,27-08-25,273,37,,https://nitter.net/HubnerrMax/status/1960746565510770984#m
80,szef_dywizji,"Pan Prezydent RP Karol Nawrocki zawetował ustawę, która zakładała, że nasze STRATEGICZNE zapasy ropy i gazu mogliby przechowywać niemcy w swoich magazynach! Wszyscy WON! Dziękujemy, Panie Prezydencie 🇵🇱",8,731,44,783,27-08-25,202,28,,https://nitter.net/szef_dywizji/status/1960764923509625196#m
81,reniajak,Dla ciebie ciulu Pan Prezydent Karol Nawrocki,0,0,0,0,28-08-25,45,7,,https://nitter.net/reniajak/status/1960926157093675510#m
82,KoneserUnii,"🛡️ Prezydent Karol Nawrocki zawetował dwie ustawy — i to była dobra decyzja. Nie z przekory, nie dla politycznego efektu. Ale w trosce o bezpieczeństwo państwa i zdrowy rozsądek w prawie. 🇵🇱 👇 Dlaczego te weta mają sens? ⛽ 1. Weto ws. zapasów ropy i gazu – obrona suwerenności energetycznej Nowelizacja zakładała możliwość przechowywania obowiązkowych zapasów gazu za granicą, wydłużenie czasu ich dostarczenia z 40 do 50 dni i zniesienie obowiązku rezerwowania przepustowości na interkonektorze. 💡 Brzmi technicznie, ale w praktyce oznaczało: oddanie kontroli nad strategicznymi surowcami innym państwom. Prezydent słusznie zauważył, że takie zmiany: ❌ Osłabiają krajową infrastrukturę magazynową ❌ Zniechęcają do budowy magazynów w Polsce ❌ Otwierają drzwi do uzależnienia się od zewnętrznych dostawców „To niewystarczające dla zapewnienia bezpieczeństwa energetycznego” – zaznaczył prezydent. W czasach geopolitycznej niepewności magazyny surowców powinny być jak armia – własne, gotowe, niezależne. ⚔️ 🌿 2. Weto ws. środków ochrony roślin – w obronie rolników i zdrowego rozsądku Nowela nakładała na rolników obowiązek prowadzenia wyłącznie cyfrowej dokumentacji stosowania środków ochrony roślin — z danymi zgodnymi z kodami EPPO i BBCH. Miało być nowocześnie, a wyszło… oderwanie od rzeczywistości. 👨‍🌾 Czy każdy rolnik w Polsce – zwłaszcza starszy – ma komputer, szybki internet i wiedzę o systemach cyfrowych? Prezydent powiedział ""stop"", bo: ✔️ Dostrzegł realne wykluczenie cyfrowe ✔️ Zauważył brak proporcjonalności i równości wobec prawa ✔️ Zadbał o to, by nowe technologie nie były barierą, tylko narzędziem wspierającym ""To narusza konstytucyjne standardy"" – podkreślił Nawrocki. ✅ Podsumowanie: dwa weta, jeden cel – ochrona interesu publicznego Weto nie musi być znakiem sprzeciwu wobec zmian. Może być aktem odpowiedzialności – i tak było tym razem. 📌 W obliczu nieprzemyślanych, technokratycznych rozwiązań prezydent wybrał rozsądek nad pośpiech. 📌 Postawił na niezależność energetyczną i uczciwe traktowanie polskiej wsi.",3,178,32,213,27-08-25,2039,289,,https://nitter.net/KoneserUnii/status/1960768532704063628#m
83,lis_tomasz,"Z tymi wszystkimi bezmyślnymi wetami, Nawrocki prowadzi politykę otwarcie antypaństwową, antypolską i antynarodową. W imieniu PiS, w imieniu Moskwy czy to i to?",2,101,86,189,27-08-25,160,23,,https://nitter.net/lis_tomasz/status/1960768558222233955#m
84,DWielowieyska,"Prezydent Karol Nawrocki zapowiedział, że będzie pomagał innym ugrupowaniom realizować ich obietnice wyborcze. To bardzo ładnie z jego strony. Rozumiem, że podpisze wszystkie ustawy przywracające praworządność, bo to obiecywała Koalicja 15 Października.",11,220,281,512,27-08-25,253,32,,https://nitter.net/DWielowieyska/status/1960601434480873964#m
85,OficjalneZero,"🗣️ Karol Nawrocki: „Chciałbym zadeklarować, że jestem gotowy do budowania mniejszości blokującej w radzie UE, aby powstrzymać umowę UE z państwami Mercosur.”",0,152,16,168,27-08-25,157,22,,https://nitter.net/OficjalneZero/status/1960748705486700979#m
86,LukaszBok,Kolejne weta prezydenta. Karol Nawrocki odmówił podpisania nowelizacji ustawy o zapasach ropy i gazu oraz nowelizacji ustawy o środkach ochrony roślin.,90,248,320,658,27-08-25,151,21,,https://nitter.net/LukaszBok/status/1960730781791199506#m
87,Nawrocki25,"Prezydent Nawrocki nie zważa na ataki układu rządzącego. Jest i będzie Ambasadorem naszych spraw. Po pierwsze Polska, po pierwsze Polacy! 🇵🇱",12,413,241,666,26-08-25,140,21,,https://nitter.net/Nawrocki25/status/1960420231475556753#m
88,chrzanikx,"Kosiniak mówi, że Nawrocki wszystko wetuje i porównuje to z liberum veto i upadkiem państwa polskiego XDDD Panie Kosiniak, pogadaj z Kamyszem, może Ci powie, że Nawrocki podpisał 26 ustaw a zawetował tylko 4",17,949,190,1156,26-08-25,207,34,,https://nitter.net/chrzanikx/status/1960284507405160507#m
89,JacekPiekara,"♦️Sikorski pisze, że uchwalili na Radzie Ministrów, co prezydent Nawrocki ma mówić w USA, a czego nie mówić♦️ Radku, pan prezydent ma w dupie ciebie, twojego premiera, radę ministrów i wasze durne uchwały... W przeciwieństwie do was nie jest persona non grata w Białym Domu, bo nie celował Trumpowi w plecy, nie wygadywał kłamstw, że Trump to wieloletni rosyjski agent i nie nazywał go niezrównoważonym. I nie porównywał go do Hitlera i Stalina, tak jak twoja obłąkana z nienawiści żona...",13,588,127,728,27-08-25,489,80,,https://nitter.net/JacekPiekara/status/1960756792213786967#m
90,lis_tomasz,"Jeśli to był wstęp do stworzenia w Polsce systemu prezydenckiego, to raczej słabo wyszło. Ale Kaczyński, choć widział katastrofę Batyra, wie, że owcom i tak się wytłumaczy, że Nawrocki wypadł świetnie.",1,34,40,75,27-08-25,201,31,,https://nitter.net/lis_tomasz/status/1960648517136867633#m
91,Dariusz_Jonski,"Dzisiejsza Rada Gabinetowa pokazuje, że Prezydent Nawrocki to nie tylko prezydent w podkoszulku, ale też w krótkich spodenkach. Sroga lekcja od Premiera Tuska. #RobimyNieGadamy",14,242,463,719,27-08-25,176,24,,https://nitter.net/Dariusz_Jonski/status/1960628970132512975#m
92,DariuszMatecki,"Pamiętasz kampanijne wideo, w którym Nawrocki mówił o bezpieczeństwie mieszkańców? Dziś to wdraża, gdy plugawa banda Tuska wciska wiatraki 500 metrów od zabudowań jak dogmat. Pamiętasz, jak mówił o prawdzie i godności? Dlatego nie odpuści ekshumacji ofiar Wołynia i karania za promowanie banderyzmu - nawet jeśli bandzie Tuska wygodniej o tym milczeć. Różnica jest prosta: on dowozi, oni się tłumaczą.",1,45,3,49,27-08-25,401,60,,https://nitter.net/DariuszMatecki/status/1960754358833819981#m
93,Lasota_Caroline,"Spotka się dwóch facetów bez kręgosłupa moralnego ani bez wychowania to minister musiał pomoc. Ośmiesza się pan tam samo jak Nawrocki. Panie Nawrocki konstytucja już przeczytana, bo się pan kompromituje. Analfabeta prawny 🤦🏼‍♀️",0,0,0,0,28-08-25,227,33,,https://nitter.net/Lasota_Caroline/status/1960926447385583657#m
94,e_wrzosek,"Prezydent Nawrocki swoje uprawnienia czerpie wyłącznie z Konstytucji i to ona określa zakres jego kompetencji. Konstytucja wymienia 30 spraw, w których prezydent samodzielnie podejmuje decyzję, wydając tzw. akty urzędowe, m.in. w sprawie zarządzania wyborów parlamentarnych, inicjatywy ustawodawczej i prawa łaski. Pozostałe akty urzędowe wydawane przez prezydenta, aby stały się ważne, wymagają kontrasygnaty, czyli podpisu premiera. I to by było na tyle.",13,429,90,532,27-08-25,456,61,,https://nitter.net/e_wrzosek/status/1960791714219581455#m
95,Nawrocki25,"Prezydent Nawrocki nie zważa na ataki układu rządzącego. Jest i będzie Ambasadorem naszych spraw. Po pierwsze Polska, po pierwsze Polacy! 🇵🇱",12,413,241,666,26-08-25,140,21,,https://nitter.net/Nawrocki25/status/1960420231475556753#m
96,lis_tomasz,"Mam wątpliwości czy dydaktyczna delikatność i wyrafinowana ironia Tuska to najlepsze podejście wobec Nawrockiego. Tzw suweren ironii nie złapie, niekompetencji Batyra nie dostrzeże, ale uzna, że Nawrocki pilnuje rządu i go rozlicza. Kurtuazja w relacjach z gościem od ustawek to może być ślepa uliczka.",3,43,45,91,27-08-25,302,44,,https://nitter.net/lis_tomasz/status/1960611303170392479#m
97,_Afraniusz,"Czytam komentarze po vetach rozdanych przez Nawrockiego i ciśnie mi się pytanie: serio jesteście tak naiwni? Myśleliście, że to co Nawrocki obiecał Konfie za poparcie w wyborach, zostało pokazane u Mentzena na YT?? Otóż to, co zostało ustalone poza kamerami, właśnie widzicie",0,11,1,12,28-08-25,275,42,,https://nitter.net/_Afraniusz/status/1960908695732154499#m
98,IIAnnaMagdalena,"Mam złą wiadomość dla „belwederskich”pomysłodawców dzisiejszej Rady Gabinetowej. Nawrocki był nieprzygotowany nawet do części oficjalnej. Jak gamoń i uczniak bezmyślnie przewalał kartki, kiedy Tusk błyszczał. Jeśli waszym celem było udowodnienie jego amatorszczyzny, udało się.",3,209,40,252,27-08-25,277,34,,https://nitter.net/IIAnnaMagdalena/status/1960627036881358932#m
99,DoRzeczy_pl,Prezydent zawetował kolejne ustawy. Polska nie dostosuje prawa do UE ⬇️ dorzeczy.pl/ekonomia/771153/…,13,200,92,305,27-08-25,101,12,,https://nitter.net/DoRzeczy_pl/status/1960737289476231370#m
100,Ela09573903,"Zmasakrowany to został jednak Nawrocki. Pokazał milionom Polaków, że jest zwykłym chamem, w dodatku nieprzygotowanym do pełnienia funkcji, którą niestety pełni. I wasze wypisywanie po kilkadziesiąt razy dziennie, jaki był cudowny tego nie zmieni.",0,0,0,0,28-08-25,246,34,,https://nitter.net/Ela09573903/status/1960926411536978314#m
101,JacekPiekara,"♦️Sikorski pisze, że uchwalili na Radzie Ministrów, co prezydent Nawrocki ma mówić w USA, a czego nie mówić♦️ Radku, pan prezydent ma w dupie ciebie, twojego premiera, radę ministrów i wasze durne uchwały... W przeciwieństwie do was nie jest persona non grata w Białym Domu, bo nie celował Trumpowi w plecy, nie wygadywał kłamstw, że Trump to wieloletni rosyjski agent i nie nazywał go niezrównoważonym. I nie porównywał go do Hitlera i Stalina, tak jak twoja obłąkana z nienawiści żona...",13,588,127,728,27-08-25,489,80,,https://nitter.net/JacekPiekara/status/1960756792213786967#m
102,OficjalneZero,"🗣️ Karol Nawrocki: „Chciałbym zadeklarować, że jestem gotowy do budowania mniejszości blokującej w radzie UE, aby powstrzymać umowę UE z państwami Mercosur.”",0,152,16,168,27-08-25,157,22,,https://nitter.net/OficjalneZero/status/1960748705486700979#m
103,WolnoscTV,"‼️BRAWO, PANIE PREZYDENCIE NAWROCKI‼️ ""Podwyższanie podatków i danin jest rzeczą, której nie zamierzam akceptować jako prezydent Polski!"" @NawrockiKn",1,189,27,217,27-08-25,149,18,,https://nitter.net/WolnoscTV/status/1960646720309653978#m
104,RyszardPetru,"Karol Nawrocki pomylił role. Prezydent nie jest „narodowym egzaminatorem” rządu. Niech najpierw przepyta PiS z 8 ostatnich lat rządów: rekordowej inflacji, budżetowej „magii” Morawieckiego: ukrywania wydatków poza budżetem, gigantycznego marnotrawstwa i niekompetencji. Niech zada też pytanie swojemu poprzednikowi o to, czemu podpisał Polski Ład - wyrok na setki tysięcy polskich firm.",20,374,419,813,27-08-25,386,51,,https://nitter.net/RyszardPetru/status/1960621756982382989#m
105,KarolPopieramy,POLSKA BĘDZIE ZNÓW WIELKA ! 🇵🇱💪 Prezydent Karol Nawrocki już nad tym pracuje 😎🇵🇱,8,289,146,443,26-08-25,80,14,,https://nitter.net/KarolPopieramy/status/1960424246364209650#m
106,Bagniusz,Jak to jest że Trzaskowski sam zaproponował odebranie 800+ nie pracującym Ukraińcom i wtedy to było popierane a jak zrobił dokładnie to samo Nawrocki to nagle się tym lewakom to nie podoba? Czy ci ludzie są normalni? Zrealizował coś z waszego programu i dalej źle… istne debile,0,0,0,0,28-08-25,277,47,,https://nitter.net/Bagniusz/status/1960926355043791256#m
107,poselTTrela,"Rada Gabinetowa go przerosła, więc sięgnął po jedyne, co mu zostało - weto. Cały Nawrocki!",0,8,5,13,28-08-25,90,15,,https://nitter.net/poselTTrela/status/1960921741456204230#m
108,krzysztof_dykas,"Czy zna ktoś uzasadnienie weta do Nowelizacji ustawy o Ochronie Roślin? Serio pytam, bo trudno mi uwierzyć, że Nawrocki zawetował to na zasadzie : Nie Bo Nie #StopBatyryzacjiPolski",0,108,68,176,27-08-25,180,28,,https://nitter.net/krzysztof_dykas/status/1960754052171751659#m
109,JanMolskiIII,"Nie no bez jaj. 🤦🏼‍♂️ W TVP teraz kręcą aferę, że Prezydent Nawrocki powiedział: „Trzeba porozmawiać po męsku” XDDDDD nitter.net/chrzanikx/status/19607…",13,161,177,351,27-08-25,152,20,,https://nitter.net/JanMolskiIII/status/1960710461977997555#m
110,Gasiuk_Pihowicz,Po porażce Rady Gabinetowej Nawrocki wpadł w amok wetowania. Ofiarami przypadkowe ustawy o środkach ochrony roślin i o zapasach ropy. Zdecydowanie za dużo snusów.,2,136,214,352,27-08-25,162,24,,https://nitter.net/Gasiuk_Pihowicz/status/1960773985286939078#m
111,LepkowskaGolas,"Prezydent Nawrocki pisał ustawę o CPK, żeby kolej wróciła do Łomży… a tymczasem my już mamy konkretne terminy – 2026 rok pierwsze pociągi, 2027 Intercity 🚄 bo my #RobimyNieGadamy #KolejNaŁomżę",6,237,37,280,27-08-25,192,30,,https://nitter.net/LepkowskaGolas/status/1960674324399980550#m
112,MarcinPalade,"""Tageszeitung"": ""Zawetowaniem ustawy dotyczącej pomocy obywatelom Ukrainy, Karol Nawrocki gra na rękę prezydentowi Rosji"". Niemcy są chyba ostatnim krajem z prawem do zarzucania innemu krajowi, że gra na rękę prezydentowi Rosji. Choćby takie Nord Stream nie wzięło się z powietrza",0,86,14,100,27-08-25,280,40,,https://nitter.net/MarcinPalade/status/1960786991194251631#m
113,GiertychRoman,"Rozumiem, że Nawrocki walczy z wiatrakami, ale z zapasami ropy i ochroną roślin? Ten gość jest coraz śmieszniejszy. To pewnie zemsta za baty jakie dostał od PDT na oczach całej Polski.",7,480,340,827,27-08-25,184,31,,https://nitter.net/GiertychRoman/status/1960757527903121414#m
114,KaziSmolinski,"No dobrze, wiedziałem, że Prezydent Nawrocki na dzisiejszej radzie gabinetowej ostro będzie punktował Tuska, ale to co się dzieje przerosło moje oczekiwania. Prezydent ostatecznie skompromitował ten rząd. Na ich miejscu wstyd by mi było wrócić do swoich ministerstw.",2,107,161,270,27-08-25,266,38,,https://nitter.net/KaziSmolinski/status/1960614390803091500#m
115,e_wrzosek,"Prezydent Nawrocki swoje uprawnienia czerpie wyłącznie z Konstytucji i to ona określa zakres jego kompetencji. Konstytucja wymienia 30 spraw, w których prezydent samodzielnie podejmuje decyzję, wydając tzw. akty urzędowe, m.in. w sprawie zarządzania wyborów parlamentarnych, inicjatywy ustawodawczej i prawa łaski. Pozostałe akty urzędowe wydawane przez prezydenta, aby stały się ważne, wymagają kontrasygnaty, czyli podpisu premiera. I to by było na tyle.",13,429,90,532,27-08-25,456,61,,https://nitter.net/e_wrzosek/status/1960791714219581455#m
116,lis_tomasz,"Jeśli to był wstęp do stworzenia w Polsce systemu prezydenckiego, to raczej słabo wyszło. Ale Kaczyński, choć widział katastrofę Batyra, wie, że owcom i tak się wytłumaczy, że Nawrocki wypadł świetnie.",1,34,40,75,27-08-25,201,31,,https://nitter.net/lis_tomasz/status/1960648517136867633#m
117,Gameover1920,"Donald Tusk jako niemiecki patriota, zamierzał zapasy ropy i gazu trzymać w Niemczech, ale z Prezydentem Karolem Nawrockim takie numery nie przejdą i ustawa zawetowana. Po pierwsze Polska, po pierwsze Polacy! Nawrocki to Prezydent moich marzeń! 😍🤗🇵🇱",0,114,6,120,27-08-25,249,37,,https://nitter.net/Gameover1920/status/1960763954315002290#m
118,HubnerrMax,"Prezydent Karol Nawrocki zawetował, narzucaną przez UE, nowelizację ustawy o zapasach ropu i gazy. Przełożę to tak, żebyście zrozumieli. Prezydent nie pozwolił Miłoszowi Motyce posiadać kompetencji do wyrażania zgody na trzymanie rezerw polskiego gazu w Niemczech. Pięknie.",11,676,42,729,27-08-25,273,37,,https://nitter.net/HubnerrMax/status/1960746565510770984#m
119,szef_dywizji,"Pan Prezydent RP Karol Nawrocki zawetował ustawę, która zakładała, że nasze STRATEGICZNE zapasy ropy i gazu mogliby przechowywać niemcy w swoich magazynach! Wszyscy WON! Dziękujemy, Panie Prezydencie 🇵🇱",8,731,44,783,27-08-25,202,28,,https://nitter.net/szef_dywizji/status/1960764923509625196#m
120,reniajak,Dla ciebie ciulu Pan Prezydent Karol Nawrocki,0,0,0,0,28-08-25,45,7,,https://nitter.net/reniajak/status/1960926157093675510#m
121,SybiKyme,"Bardzo spodobało mi się stwierdzenie, które mi gdzieś mignęło na X: Nawrocki to taki Trump. Tylko w wersji „z Temu”. Prawda, że trafione?;)",11,302,82,395,26-08-25,139,23,,https://nitter.net/SybiKyme/status/1960450286415437873#m
122,J74Jacek,"Nawrocki po nokaucie podczas rady gabinetowej zrobił na złość Tuskowi i znowu zawetował dwie ustawy. Ktoś mu powiedział, że działanie na szkodę Polaków, utoruje złodziejom z PiS powrót do władzy",14,308,124,446,27-08-25,194,30,,https://nitter.net/J74Jacek/status/1960737346942296289#m
123,salekk860,Wiatraki BĘDĄ powstawały 👊 Weto mało skuteczne 🤷‍♂️ Nawrocki będzie niezadowolony 😏 Premier i MY usatysfakcjonowani 😇 Tania zielona energia nie będzie zakładnikiem fobii i teorii spiskowych prawicowców 😎,7,200,193,400,27-08-25,203,29,,https://nitter.net/salekk860/status/1960722175876350432#m
124,epwok2,"Nawrocki jest jedynie "" decyzją prezesa"", tu ma Pan źródło całego zła , człowieka, który podzielił Polskę i skłócił Polaków . Nie ma przypadków są znaki.",0,0,0,0,28-08-25,153,26,,https://nitter.net/epwok2/status/1960926519154389408#m
125,smolny7,Polonia ha pagado a Elon Musk la factura de la conexión de Ucrania a internet y a partir del 1 de octubre dejará de hacerlo porque el presidente Karol Nawrocki ha vetado la ley de ayuda a Ucrania y al millón de refugiados ucranianos que hay en el país. mpr21.info/polonia-desconect…,0,1,0,1,28-08-25,282,50,,https://nitter.net/smolny7/status/1960925346888376604#m
126,poselTTrela,"Rada Gabinetowa go przerosła, więc sięgnął po jedyne, co mu zostało - weto. Cały Nawrocki!",0,8,5,13,28-08-25,90,15,,https://nitter.net/poselTTrela/status/1960921741456204230#m
127,DawidWildstein,"Dziś Nawrocki pokazał, czym jest Uśmiechnięta Polska. I jak należy z nią walczyć. Uśmiechnięta Polska i jej mesjasz to wrzask, populizm, bełkot, agresją i powtarzanie PiS. Jak to rozbić? Pytać o konkrety. O mercosur. O Pakt Migracyjny. O deficyt budżetowy. O łamanie prawa. Tylko tyle. I ich już nie ma. To pokazał Nawrocki.",2,232,17,251,27-08-25,324,53,,https://nitter.net/DawidWildstein/status/1960671614523125869#m
128,WolnaRadio,Tusk w amoku. Nawrocki to nie Duda. Prawda?!,0,26,10,36,27-08-25,44,8,,https://nitter.net/WolnaRadio/status/1960762359376494970#m
129,JacekPiekara,"♦️Sikorski pisze, że uchwalili na Radzie Ministrów, co prezydent Nawrocki ma mówić w USA, a czego nie mówić♦️ Radku, pan prezydent ma w dupie ciebie, twojego premiera, radę ministrów i wasze durne uchwały... W przeciwieństwie do was nie jest persona non grata w Białym Domu, bo nie celował Trumpowi w plecy, nie wygadywał kłamstw, że Trump to wieloletni rosyjski agent i nie nazywał go niezrównoważonym. I nie porównywał go do Hitlera i Stalina, tak jak twoja obłąkana z nienawiści żona...",13,590,127,730,27-08-25,489,80,,https://nitter.net/JacekPiekara/status/1960756792213786967#m
130,HubnerrMax,"Już wiemy dlaczego Prezydent Nawrocki ledwo się powstrzymywał od śmiechu, gdy Tusk bełkotał na temat Mercosur, mówiąc że nie da się stworzyć sojuszu przeciwko. Teraz wiemy, że w trakcie powrotu z USA Prezydent spotka się z Premier Włoch, Meloni, by temat Mercosur poruszyć. 😅",7,330,27,364,27-08-25,275,44,,https://nitter.net/HubnerrMax/status/1960693897744523657#m
131,lis_tomasz,"Jeśli to był wstęp do stworzenia w Polsce systemu prezydenckiego, to raczej słabo wyszło. Ale Kaczyński, choć widział katastrofę Batyra, wie, że owcom i tak się wytłumaczy, że Nawrocki wypadł świetnie.",1,34,40,75,27-08-25,201,31,,https://nitter.net/lis_tomasz/status/1960648517136867633#m
132,Dariusz_Jonski,"Dzisiejsza Rada Gabinetowa pokazuje, że Prezydent Nawrocki to nie tylko prezydent w podkoszulku, ale też w krótkich spodenkach. Sroga lekcja od Premiera Tuska. #RobimyNieGadamy",14,242,463,719,27-08-25,176,24,,https://nitter.net/Dariusz_Jonski/status/1960628970132512975#m
133,DariuszMatecki,"Pamiętasz kampanijne wideo, w którym Nawrocki mówił o bezpieczeństwie mieszkańców? Dziś to wdraża, gdy plugawa banda Tuska wciska wiatraki 500 metrów od zabudowań jak dogmat. Pamiętasz, jak mówił o prawdzie i godności? Dlatego nie odpuści ekshumacji ofiar Wołynia i karania za promowanie banderyzmu - nawet jeśli bandzie Tuska wygodniej o tym milczeć. Różnica jest prosta: on dowozi, oni się tłumaczą.",1,45,3,49,27-08-25,401,60,,https://nitter.net/DariuszMatecki/status/1960754358833819981#m
134,Lasota_Caroline,"Spotka się dwóch facetów bez kręgosłupa moralnego ani bez wychowania to minister musiał pomoc. Ośmiesza się pan tam samo jak Nawrocki. Panie Nawrocki konstytucja już przeczytana, bo się pan kompromituje. Analfabeta prawny 🤦🏼‍♀️",0,0,0,0,28-08-25,227,33,,https://nitter.net/Lasota_Caroline/status/1960926447385583657#m
