id,username,text,likes,retweets,replies,total_interactions,post_date_iso,text_length,word_count,sentiment_label,link
222,OmzRi,"BĘDZIE ŚLEDZTWO W SPRAWIE KAROLA NAWROCKIEGO I PISOWSKIEJ RADNEJ AGNIESZKI KURZAWY❗ Sąd Rejonowy w Szczecinie uwzględnił nasze zażalenie i nakazał prowadzenie śledztwa. Karol Nawrocki i szczecińska radna Agnieszka Kurzawa rozpowszechniali rasistowskie treści, będące skrajną manipulacją. Kurzawa zamieściła zdjęcie, na którym widać czarnoskóre osoby i podpisała je informując, że są to nielegalni migranci. TO KŁAMSTWO❗ Okazało się, że wszystkie osoby widoczne na zdjęciu to legalnie zatrudnieni pracownicy, posiadający zezwolenia na pobyt i pracę w Polsce i płacący w naszym kraju podatki. KAROL NAWROCKI SZCZUJE JAK RASISTA❗ Chwilę później do radnej dołączył prezes IPN Karol Nawrocki nagrał spot wyborczy o rasistowskim przesłaniu. Nawrocki również kłamał, że na przystanku stoją nielegalni migranci. Robił to by wywoływać nienawiść Polaków do osób o innym kolorze skóry. Nawrockiemu pomagał szef jego sztabu wyborczego, Paweł Szefernaker. W innym postępowaniu jest już oskarżony o rozpowszechnianie treści rasistowskich w jednej z poprzednich kampanii wyborczych. ZAWIADOMILIŚMY PROKURATURĘ W SZCZECINIE❗ Nasz Ośrodek złożył zawiadomienie o popełnieniu przestępstwa przez całą trójkę, czyli Karola Nawrockiego, Agnieszkę Kurzawę i Pawła Szefernakera. Naszym zdaniem wskazane osoby mogły dopuścić się propagowania rasizmu wobec osób o odmiennym pochodzeniu etnicznym. Chodzi o art. 256 kk, za naruszenie którego grozi kara do trzech lat bezwzględnego pozbawienia wolności. _____ Wspieraj nas. Ścigamy rasistów, homofobów, faszystów, ksenofobów. Bez żadnego wsparcia państwa, bez unijnych dotacji. Jedynym źródłem finansowania działań Ośrodka są dobrowolne darowizny naszych zwolenników. Wspieraj nas: PayPal i karta płatnicza: omzrik.pl/wesprzyj-nas zbiórka: zrzutka.pl/omzrik Dane do przelewu: nr konta 19 2490 0005 0000 4520 8435 8540 Ośrodek Monitorowania Zachowań Rasistowskich i Ksenofobicznych Plac Dąbrowskiego 5 00-057 Warszawa tytuł : ""darowizna na działalność statutową"" IBAN : PL19249000050000452084358540 SWIFT: ALBPPLPW Uruchomiliśmy nasz profil na portalu Patronite, będziemy zobowiązani jeśli zdecydujecie się Państwo zostać naszymi patronami: patronite.pl/omzrik",0,3,0,3,15-10-25,2181,282,,https://nitter.net/OmzRi/status/1978389763607404998#m
223,okiemtomkaw,"Gdzie likwidacja CBA? Tylko proszę nie odpowiadać ""bo Duda', a teraz ""bo Nawrocki"". Wystarczyło cofnąć funkom poświadczenia bezpieczeństwa. Gdzie audyty w służbach? Bo te, które rzekomo zostały przeprowadzone, to jakiś żart. Nie rozliczycie bezpieki PiS, nie wygracie wyborów. Zakład?",1,49,5,55,15-10-25,284,39,,https://nitter.net/okiemtomkaw/status/1978348860922544373#m
224,gfkot,"Niezwykle mocne słowa skierowane do lokatora pałacu prezydenckiego: zapłaciliśmy 3 miliardy złotych kar. To równowartość wielkiej góry snusów. Na stole leży naprawdę kompromisowy projekt ustawy, mimo to Nawrocki już teraz zapowiadanie, że jej nie podpisze.",7,206,60,273,14-10-25,256,35,,https://nitter.net/gfkot/status/1978196805662740744#m
225,TypowyKrzysiek2,"W sumie to nie, Nawrocki jeszcze nie okłamał. Jak na razie realizuje wszystko to o czym mówił w kampanii, w mniejszym lub większym stopniu ale realizuje.",0,0,0,0,15-10-25,153,26,,https://nitter.net/TypowyKrzysiek2/status/1978392182596796684#m
226,Mariusz1576383,"Ponieważ prezydent Nawrocki nie powołuje miernot i łapowników, tak jak to robiła Platforma gówniana.",0,0,0,0,15-10-25,100,14,,https://nitter.net/Mariusz1576383/status/1978392054364340400#m
227,WojPawelczyk,"Obama is meddling in Polish affairs, again. We exposed him in May this year, right before the last Polish presidential election, securing Karol Nawrocki's win:",4,507,52,563,12-10-25,159,25,,https://nitter.net/WojPawelczyk/status/1977310710263607762#m
228,amazgula,Nawrocki niczym się nie różni od zamachowca na konstytucyjny system prawny w Polsce Andrzeja Dudy. Czym gorzej dla Polski tym Nawrocki szczęśliwszy. Niech płaci za wyroki neosędziów. Przecież władza to odpowiedzialność. Dlaczego niby jego to nie dotyczy?,0,27,3,30,14-10-25,254,37,,https://nitter.net/amazgula/status/1978198847777124679#m
229,Jacek_Czerwinsk,"Argument, który spotkałem tu na X: obniżają rankingi bo widzą, że Nawrocki blokuje reformy wszystko wetując. Serio.",0,0,1,1,15-10-25,115,17,,https://nitter.net/Jacek_Czerwinsk/status/1978391953076072790#m
230,Przemilosz,A tylnym siedzeniu Wielki Bu i jego kumpel Karol Nawrocki (który in cognito wyrwał się poimprezować - jako Tadeusz Batyr).,0,0,0,0,15-10-25,122,20,,https://nitter.net/Przemilosz/status/1978391911783100761#m
231,AXChristoforou,"Poland demands Germany stop its Nord Stream investigation. The topic of Nord Stream causes panic within Poland's political class. Why? FT: Sławomir Cenckiewicz, who leads Poland’s national security bureau and is a key adviser to President Karol Nawrocki, told the Financial Times in an interview that Germany should not continue the prosecutions if it wanted to align Russia policy with Poland and other Nato allies. “From our point of view, this investigation doesn’t make sense, not only in terms of the interests of Poland but also the whole [Nato] alliance,” Cenckiewicz said, adding that prosecuting Nord Stream saboteurs might serve German justice, but also “Russian injustice”.",175,1190,301,1666,14-10-25,684,106,,https://nitter.net/AXChristoforou/status/1977991241989017814#m
232,okiemtomkaw,"Gdzie likwidacja CBA? Tylko proszę nie odpowiadać ""bo Duda', a teraz ""bo Nawrocki"". Wystarczyło cofnąć funkom poświadczenia bezpieczeństwa. Gdzie audyty w służbach? Bo te, które rzekomo zostały przeprowadzone, to jakiś żart. Nie rozliczycie bezpieki PiS, nie wygracie wyborów. Zakład?",1,49,5,55,15-10-25,284,39,,https://nitter.net/okiemtomkaw/status/1978348860922544373#m
233,chrzanikx,Kolejna funkcjonariuszka TVP w formie „Czy Karol Nawrocki jest groźniejszy dla państwa i demokracji niż Andrzej Duda?” Demokratycznie wybrany prezydent zagrożeniem dla demokracji XDDDDD,0,3,3,6,15-10-25,185,24,,https://nitter.net/chrzanikx/status/1978390985051668960#m
234,gfkot,"Niezwykle mocne słowa skierowane do lokatora pałacu prezydenckiego: zapłaciliśmy 3 miliardy złotych kar. To równowartość wielkiej góry snusów. Na stole leży naprawdę kompromisowy projekt ustawy, mimo to Nawrocki już teraz zapowiadanie, że jej nie podpisze.",7,206,60,273,14-10-25,256,35,,https://nitter.net/gfkot/status/1978196805662740744#m
235,Marian2059443,"Niemcy są 3. największą gospodarką świata. Po wyjściu RFN z UE następnego dnia UE pogrąży się w chaosie i rozpadnie się. Wt Odżyje wojskowy sojusz niemiecko - rosyjski, a to oznacza unicestwienie Polski. Dlaczego PiS,Konfederacja i Nawrocki wspierają neohitlerowską prosyjską AfD?",0,0,0,0,15-10-25,280,41,,https://nitter.net/Marian2059443/status/1978391532785856775#m
236,LeskiPiotr,"Nie dowiemy się, ile Nawrocki płaci Cenckiewiczowi, Boguckiemu, Szefernakerowi, Przydaczowi. Pomimo tego, że sądy administracyjne dawno temu przesądziły, iż wysokość pensji urzędników państwowych stanowi informację publiczną. A miało być ""po pierwsze Polacy"". Szybko poszło...",16,305,48,369,14-10-25,276,34,,https://nitter.net/LeskiPiotr/status/1978163008216924256#m
237,GoniaS1174991,"@GiertychRoman rzekomy pan Nawrocki to podróba prezydenta, falsyfikat, nielegalny i długo by wymieniać jego przydomki-niezbyt chwalebne🤮🤮🤮",0,11,12,23,14-10-25,138,16,,https://nitter.net/GoniaS1174991/status/1978117973098348862#m
238,HubnerrMax,"W Pałacu Prezydenckim zwyciężyła PRAWORZĄDNOŚĆ. Prezydent Karol Nawrocki wręczył nominacje NOWYM sędziom i asesorom. Później wygłosił cudowne przemówienie o Konstytucji, prawie i WIERNOŚCI wobec Rzeczpospolitej. Pomyślałem - a co, gdyby to połączyć? Zapraszam na prawy montaż.",1,79,9,89,14-10-25,276,36,,https://nitter.net/HubnerrMax/status/1978159188707615049#m
239,Ewa92642,"Nie pan Nawrocki palancie, tylko pan prezydent Nawrocki i nie rzekomo, tylko faktycznie decyduje o byciu sędzią, jest to wyłączna prerogatywa prezydenta. Jakim cudem taki debil został prawnikiem, bo że członkiem koalicji 13 grudnia to nie dziwi.",0,0,0,0,15-10-25,245,37,,https://nitter.net/Ewa92642/status/1978391050000441625#m
240,Wiesci24pl,Karol Nawrocki i bajońskie zarobki jego doradców. Nawet 40 tysięcy zł miesięcznie wiesci24.pl/2025/10/15/karol…,2,7,1,10,15-10-25,111,13,,https://nitter.net/Wiesci24pl/status/1978368993657315686#m
241,OmzRi,"BĘDZIE ŚLEDZTWO W SPRAWIE KAROLA NAWROCKIEGO I PISOWSKIEJ RADNEJ AGNIESZKI KURZAWY❗ Sąd Rejonowy w Szczecinie uwzględnił nasze zażalenie i nakazał prowadzenie śledztwa. Karol Nawrocki i szczecińska radna Agnieszka Kurzawa rozpowszechniali rasistowskie treści, będące skrajną manipulacją. Kurzawa zamieściła zdjęcie, na którym widać czarnoskóre osoby i podpisała je informując, że są to nielegalni migranci. TO KŁAMSTWO❗ Okazało się, że wszystkie osoby widoczne na zdjęciu to legalnie zatrudnieni pracownicy, posiadający zezwolenia na pobyt i pracę w Polsce i płacący w naszym kraju podatki. KAROL NAWROCKI SZCZUJE JAK RASISTA❗ Chwilę później do radnej dołączył prezes IPN Karol Nawrocki nagrał spot wyborczy o rasistowskim przesłaniu. Nawrocki również kłamał, że na przystanku stoją nielegalni migranci. Robił to by wywoływać nienawiść Polaków do osób o innym kolorze skóry. Nawrockiemu pomagał szef jego sztabu wyborczego, Paweł Szefernaker. W innym postępowaniu jest już oskarżony o rozpowszechnianie treści rasistowskich w jednej z poprzednich kampanii wyborczych. ZAWIADOMILIŚMY PROKURATURĘ W SZCZECINIE❗ Nasz Ośrodek złożył zawiadomienie o popełnieniu przestępstwa przez całą trójkę, czyli Karola Nawrockiego, Agnieszkę Kurzawę i Pawła Szefernakera. Naszym zdaniem wskazane osoby mogły dopuścić się propagowania rasizmu wobec osób o odmiennym pochodzeniu etnicznym. Chodzi o art. 256 kk, za naruszenie którego grozi kara do trzech lat bezwzględnego pozbawienia wolności. _____ Wspieraj nas. Ścigamy rasistów, homofobów, faszystów, ksenofobów. Bez żadnego wsparcia państwa, bez unijnych dotacji. Jedynym źródłem finansowania działań Ośrodka są dobrowolne darowizny naszych zwolenników. Wspieraj nas: PayPal i karta płatnicza: omzrik.pl/wesprzyj-nas zbiórka: zrzutka.pl/omzrik Dane do przelewu: nr konta 19 2490 0005 0000 4520 8435 8540 Ośrodek Monitorowania Zachowań Rasistowskich i Ksenofobicznych Plac Dąbrowskiego 5 00-057 Warszawa tytuł : ""darowizna na działalność statutową"" IBAN : PL19249000050000452084358540 SWIFT: ALBPPLPW Uruchomiliśmy nasz profil na portalu Patronite, będziemy zobowiązani jeśli zdecydujecie się Państwo zostać naszymi patronami: patronite.pl/omzrik",0,3,0,3,15-10-25,2181,282,,https://nitter.net/OmzRi/status/1978389763607404998#m
242,moto_texu7527,"Wierzyć, że Nawrocki wygrał i to wzmocniło PiS to naprawdę trzeba miec IQ 40. Typie piS idzie na dno. W 2027 będzie poniżej konfederacji, zaklad?",0,0,1,1,15-10-25,145,25,,https://nitter.net/moto_texu7527/status/1978390993431879919#m
243,gfkot,"Niezwykle mocne słowa skierowane do lokatora pałacu prezydenckiego: zapłaciliśmy 3 miliardy złotych kar. To równowartość wielkiej góry snusów. Na stole leży naprawdę kompromisowy projekt ustawy, mimo to Nawrocki już teraz zapowiadanie, że jej nie podpisze.",7,207,60,274,14-10-25,256,35,,https://nitter.net/gfkot/status/1978196805662740744#m
244,Ewa0909Ewa,"Uuuuu mocne 🫣🫢😂 Nawrocki; lokatorze pałacu prezydenckiego pytanie jest: Ile snusów można kupić za 3 miliardy zloty? Potrafisz sobie panie Batyr, kibolu @NawrockiKn wyobrazić taką górę snusów lub innych snusopodobnych substancji? 🫢😂 @DorotaWSch",5,147,42,194,14-10-25,243,33,,https://nitter.net/Ewa0909Ewa/status/1978171567944184114#m
245,Wiesci24pl,Karol Nawrocki i bajońskie zarobki jego doradców. Nawet 40 tysięcy zł miesięcznie wiesci24.pl/2025/10/15/karol…,2,7,1,10,15-10-25,111,13,,https://nitter.net/Wiesci24pl/status/1978368993657315686#m
246,HubnerrMax,"Nawrocki rozniósł bezprawne działania rządu nawet ich nie wymieniając. ""Słońce wschodzi, Słońce zachodzi. A ministrowie PRZYCHODZĄ i ministrowie ODCHODZĄ. SZYBCIEJ NIŻ PREZYDENCI. A Rzeczpospolita oparta o Konstytucję będzie trwać dzięki Wam - NOWYM sędziom i asesorom"". Jprdl",4,497,29,530,14-10-25,276,37,,https://nitter.net/HubnerrMax/status/1978060986650136792#m
247,forestinababina,"Osiem lat Duda niszczył praworządność w Polsce,teraz to samo robi prezydent,który być może jest wybrany bo wybory byly sfalszowane.Gdyby piwtornie przeliczono głosy to by sie okazało co jest prawdą,a Nawrocki mógłby mówić o przestrzeganiu prawa",0,0,0,0,15-10-25,244,35,,https://nitter.net/forestinababina/status/1978393131901952100#m
248,kania1929,"No i to ten sondaż jest najbliższy prawdy. PiS ma tyle samo Karol Nawrocki w pierwszej turze, Konfederacja utrzymuje popracie, lewica i razem będą zmuszone prawdopodobnie iść razem do wyborów, w innym wypadku grozi im znalezienie się pod progiem. Chociaż osobiście uważam, że większe szansę ma partia @partiarazem dostać się do sejmu samodzielnie, niż lewica. Czekają nas bardzo ciekawe dwa lata i prawdopodobnie znów będzie na żyletki.",0,0,0,0,15-10-25,436,67,,https://nitter.net/kania1929/status/1978393110431322269#m
249,LeskiPiotr,"Nie dowiemy się, ile Nawrocki płaci Cenckiewiczowi, Boguckiemu, Szefernakerowi, Przydaczowi. Pomimo tego, że sądy administracyjne dawno temu przesądziły, iż wysokość pensji urzędników państwowych stanowi informację publiczną. A miało być ""po pierwsze Polacy"". Szybko poszło...",16,305,48,369,14-10-25,276,34,,https://nitter.net/LeskiPiotr/status/1978163008216924256#m
250,CowboyJerry777,Ten sam nawrocki,0,0,0,0,15-10-25,16,3,,https://nitter.net/CowboyJerry777/status/1978393087136198997#m
251,Wojciec25983798,Panie Nawrocki. Czy ten kolega Ziobry też będzie wydawał wyroki w imieniu Rzeczypospolitej.,0,0,0,0,14-10-25,91,13,,https://nitter.net/Wojciec25983798/status/1978202148513911195#m
252,chrzanikx,Kolejna funkcjonariuszka TVP w formie „Czy Karol Nawrocki jest groźniejszy dla państwa i demokracji niż Andrzej Duda?” Demokratycznie wybrany prezydent zagrożeniem dla demokracji XDDDDD,0,3,3,6,15-10-25,185,24,,https://nitter.net/chrzanikx/status/1978390985051668960#m
253,Kryhor,Trzeba przyznać że Karol Nawrocki zawsze wie kiedy nie jechać. 😜,7,85,35,127,14-10-25,64,11,,https://nitter.net/Kryhor/status/1978057069245706633#m
254,Legaartis,"⚖️ Prezydent Nawrocki powołał kolejnych neosędziów. To naruszenie prawa UE! TSUE i ETPCz uznają neo-KRS za nielegalną. Orzeczenia takich ""sędziów"" mogą być podważane. 📞 579 636 527 legaartis.com/nawrocki-powol… #NeoSędziowie #Konstytucja #TSUE",0,9,0,9,14-10-25,243,31,,https://nitter.net/Legaartis/status/1978074029639561524#m
255,TrybunaSejmowa,"Przy wyborach prezydenckich jak OGB pisało, że Nawrocki ma przewagę nad Trzaskowskim",0,0,0,0,15-10-25,84,12,,https://nitter.net/TrybunaSejmowa/status/1978392589398089836#m
256,BarbaraTrabins1,"1/2 Polska również dołączyła swój sprzeciw w sprawie nielegalnej imigracji . Prezydent 🇵🇱 RP Karol Nawrocki wystosował pismo do przewodniczącej KE odrzucając Pakt Migracyjny. Ptaszki ćwierkają ,, że ów ,,pakiet,,wstrzymany na 2 lata Co nie znaczy, że Niemcy nie będą cichaczem",0,1,1,2,15-10-25,276,41,,https://nitter.net/BarbaraTrabins1/status/1978386200269336791#m
257,PR24_pl,"Aleksander Łukaszenka skrytykował Karola Nawrockiego za wypowiedź o duchu Józefa Piłsudskiego. W swojej wypowiedzi przypuszczał, że Nawrocki został opętany. polskieradio24.pl/artykul/35…",0,0,0,0,15-10-25,186,20,,https://nitter.net/PR24_pl/status/1978392478697812127#m
258,OmzRi,"BĘDZIE ŚLEDZTWO W SPRAWIE KAROLA NAWROCKIEGO I PISOWSKIEJ RADNEJ AGNIESZKI KURZAWY❗ Sąd Rejonowy w Szczecinie uwzględnił nasze zażalenie i nakazał prowadzenie śledztwa. Karol Nawrocki i szczecińska radna Agnieszka Kurzawa rozpowszechniali rasistowskie treści, będące skrajną manipulacją. Kurzawa zamieściła zdjęcie, na którym widać czarnoskóre osoby i podpisała je informując, że są to nielegalni migranci. TO KŁAMSTWO❗ Okazało się, że wszystkie osoby widoczne na zdjęciu to legalnie zatrudnieni pracownicy, posiadający zezwolenia na pobyt i pracę w Polsce i płacący w naszym kraju podatki. KAROL NAWROCKI SZCZUJE JAK RASISTA❗ Chwilę później do radnej dołączył prezes IPN Karol Nawrocki nagrał spot wyborczy o rasistowskim przesłaniu. Nawrocki również kłamał, że na przystanku stoją nielegalni migranci. Robił to by wywoływać nienawiść Polaków do osób o innym kolorze skóry. Nawrockiemu pomagał szef jego sztabu wyborczego, Paweł Szefernaker. W innym postępowaniu jest już oskarżony o rozpowszechnianie treści rasistowskich w jednej z poprzednich kampanii wyborczych. ZAWIADOMILIŚMY PROKURATURĘ W SZCZECINIE❗ Nasz Ośrodek złożył zawiadomienie o popełnieniu przestępstwa przez całą trójkę, czyli Karola Nawrockiego, Agnieszkę Kurzawę i Pawła Szefernakera. Naszym zdaniem wskazane osoby mogły dopuścić się propagowania rasizmu wobec osób o odmiennym pochodzeniu etnicznym. Chodzi o art. 256 kk, za naruszenie którego grozi kara do trzech lat bezwzględnego pozbawienia wolności. _____ Wspieraj nas. Ścigamy rasistów, homofobów, faszystów, ksenofobów. Bez żadnego wsparcia państwa, bez unijnych dotacji. Jedynym źródłem finansowania działań Ośrodka są dobrowolne darowizny naszych zwolenników. Wspieraj nas: PayPal i karta płatnicza: omzrik.pl/wesprzyj-nas zbiórka: zrzutka.pl/omzrik Dane do przelewu: nr konta 19 2490 0005 0000 4520 8435 8540 Ośrodek Monitorowania Zachowań Rasistowskich i Ksenofobicznych Plac Dąbrowskiego 5 00-057 Warszawa tytuł : ""darowizna na działalność statutową"" IBAN : PL19249000050000452084358540 SWIFT: ALBPPLPW Uruchomiliśmy nasz profil na portalu Patronite, będziemy zobowiązani jeśli zdecydujecie się Państwo zostać naszymi patronami: patronite.pl/omzrik",0,3,0,3,15-10-25,2181,282,,https://nitter.net/OmzRi/status/1978389763607404998#m
259,okiemtomkaw,"Gdzie likwidacja CBA? Tylko proszę nie odpowiadać ""bo Duda', a teraz ""bo Nawrocki"". Wystarczyło cofnąć funkom poświadczenia bezpieczeństwa. Gdzie audyty w służbach? Bo te, które rzekomo zostały przeprowadzone, to jakiś żart. Nie rozliczycie bezpieki PiS, nie wygracie wyborów. Zakład?",1,49,5,55,15-10-25,284,39,,https://nitter.net/okiemtomkaw/status/1978348860922544373#m
260,TypowyKrzysiek2,"W sumie to nie, Nawrocki jeszcze nie okłamał. Jak na razie realizuje wszystko to o czym mówił w kampanii, w mniejszym lub większym stopniu ale realizuje.",0,0,0,0,15-10-25,153,26,,https://nitter.net/TypowyKrzysiek2/status/1978392182596796684#m
261,gfkot,"Niezwykle mocne słowa skierowane do lokatora pałacu prezydenckiego: zapłaciliśmy 3 miliardy złotych kar. To równowartość wielkiej góry snusów. Na stole leży naprawdę kompromisowy projekt ustawy, mimo to Nawrocki już teraz zapowiadanie, że jej nie podpisze.",7,207,60,274,14-10-25,256,35,,https://nitter.net/gfkot/status/1978196805662740744#m
262,LeskiPiotr,"Nie dowiemy się, ile Nawrocki płaci Cenckiewiczowi, Boguckiemu, Szefernakerowi, Przydaczowi. Pomimo tego, że sądy administracyjne dawno temu przesądziły, iż wysokość pensji urzędników państwowych stanowi informację publiczną. A miało być ""po pierwsze Polacy"". Szybko poszło...",16,305,48,369,14-10-25,276,34,,https://nitter.net/LeskiPiotr/status/1978163008216924256#m
263,Mariusz1576383,"Ponieważ prezydent Nawrocki nie powołuje miernot i łapowników, tak jak to robiła Platforma gówniana.",0,0,0,0,15-10-25,100,14,,https://nitter.net/Mariusz1576383/status/1978392054364340400#m
264,WojPawelczyk,"Obama is meddling in Polish affairs, again. We exposed him in May this year, right before the last Polish presidential election, securing Karol Nawrocki's win:",4,507,52,563,12-10-25,159,25,,https://nitter.net/WojPawelczyk/status/1977310710263607762#m
265,amazgula,Nawrocki niczym się nie różni od zamachowca na konstytucyjny system prawny w Polsce Andrzeja Dudy. Czym gorzej dla Polski tym Nawrocki szczęśliwszy. Niech płaci za wyroki neosędziów. Przecież władza to odpowiedzialność. Dlaczego niby jego to nie dotyczy?,0,27,3,30,14-10-25,254,37,,https://nitter.net/amazgula/status/1978198847777124679#m
266,Jacek_Czerwinsk,"Argument, który spotkałem tu na X: obniżają rankingi bo widzą, że Nawrocki blokuje reformy wszystko wetując. Serio.",0,0,1,1,15-10-25,115,17,,https://nitter.net/Jacek_Czerwinsk/status/1978391953076072790#m
267,Przemilosz,A tylnym siedzeniu Wielki Bu i jego kumpel Karol Nawrocki (który in cognito wyrwał się poimprezować - jako Tadeusz Batyr).,0,0,0,0,15-10-25,122,20,,https://nitter.net/Przemilosz/status/1978391911783100761#m
268,AXChristoforou,"Poland demands Germany stop its Nord Stream investigation. The topic of Nord Stream causes panic within Poland's political class. Why? FT: Sławomir Cenckiewicz, who leads Poland’s national security bureau and is a key adviser to President Karol Nawrocki, told the Financial Times in an interview that Germany should not continue the prosecutions if it wanted to align Russia policy with Poland and other Nato allies. “From our point of view, this investigation doesn’t make sense, not only in terms of the interests of Poland but also the whole [Nato] alliance,” Cenckiewicz said, adding that prosecuting Nord Stream saboteurs might serve German justice, but also “Russian injustice”.",175,1190,301,1666,14-10-25,684,106,,https://nitter.net/AXChristoforou/status/1977991241989017814#m
269,okiemtomkaw,"Gdzie likwidacja CBA? Tylko proszę nie odpowiadać ""bo Duda', a teraz ""bo Nawrocki"". Wystarczyło cofnąć funkom poświadczenia bezpieczeństwa. Gdzie audyty w służbach? Bo te, które rzekomo zostały przeprowadzone, to jakiś żart. Nie rozliczycie bezpieki PiS, nie wygracie wyborów. Zakład?",1,49,5,55,15-10-25,284,39,,https://nitter.net/okiemtomkaw/status/1978348860922544373#m
270,chrzanikx,Kolejna funkcjonariuszka TVP w formie „Czy Karol Nawrocki jest groźniejszy dla państwa i demokracji niż Andrzej Duda?” Demokratycznie wybrany prezydent zagrożeniem dla demokracji XDDDDD,0,3,3,6,15-10-25,185,24,,https://nitter.net/chrzanikx/status/1978390985051668960#m
271,Marian2059443,"Niemcy są 3. największą gospodarką świata. Po wyjściu RFN z UE następnego dnia UE pogrąży się w chaosie i rozpadnie się. Wt Odżyje wojskowy sojusz niemiecko - rosyjski, a to oznacza unicestwienie Polski. Dlaczego PiS,Konfederacja i Nawrocki wspierają neohitlerowską prosyjską AfD?",0,0,0,0,15-10-25,280,41,,https://nitter.net/Marian2059443/status/1978391532785856775#m
272,GoniaS1174991,"@GiertychRoman rzekomy pan Nawrocki to podróba prezydenta, falsyfikat, nielegalny i długo by wymieniać jego przydomki-niezbyt chwalebne🤮🤮🤮",0,11,12,23,14-10-25,138,16,,https://nitter.net/GoniaS1174991/status/1978117973098348862#m
273,HubnerrMax,"W Pałacu Prezydenckim zwyciężyła PRAWORZĄDNOŚĆ. Prezydent Karol Nawrocki wręczył nominacje NOWYM sędziom i asesorom. Później wygłosił cudowne przemówienie o Konstytucji, prawie i WIERNOŚCI wobec Rzeczpospolitej. Pomyślałem - a co, gdyby to połączyć? Zapraszam na prawy montaż.",1,79,9,89,14-10-25,276,36,,https://nitter.net/HubnerrMax/status/1978159188707615049#m
274,Ewa92642,"Nie pan Nawrocki palancie, tylko pan prezydent Nawrocki i nie rzekomo, tylko faktycznie decyduje o byciu sędzią, jest to wyłączna prerogatywa prezydenta. Jakim cudem taki debil został prawnikiem, bo że członkiem koalicji 13 grudnia to nie dziwi.",0,0,0,0,15-10-25,245,37,,https://nitter.net/Ewa92642/status/1978391050000441625#m
275,Wiesci24pl,Karol Nawrocki i bajońskie zarobki jego doradców. Nawet 40 tysięcy zł miesięcznie wiesci24.pl/2025/10/15/karol…,2,7,1,10,15-10-25,111,13,,https://nitter.net/Wiesci24pl/status/1978368993657315686#m
