id,username,text,likes,retweets,replies,total_interactions,post_date_iso,text_length,word_count,sentiment_label,link
235,HubnerrMax,"Niektórym się wydaje, że Prezydent Nawrocki walczy w uczciwej grze. Tylko czekali, by zacząć narzekać. A to był jego dzień: ▪️ OSTATNIE pół roku wsparcia dla Ukraińców i wymuszenie ich PRACY W PL by odbierali świadczenia. ▪️ wywalenie wiatraków z ustawy o obniżeniu cen energii, którą zawetował. ▪️ wywalenie przechowywania gazu POZA granicami Polski z ustawy którą zawetował ▪️ zwyciestwo jego projektu Tak dla CPK w Sejmie i przegrana większości sejmowej Tuska. Otóż nie, Prezydent Nawrocki nie walczy w uczciwej grze. Walczy w ringu w którym nie jest okładany przez jednego przeciwnika, ale przez kilkuset naraz i to z widowni - nie dołączajcie do nich. Mimo tego, że jest na niego taki nierówny atak, ciosów unika, wyprowadza swoje i wychodzi w rundach zwycięsko. Z okazjonalnym nokautem, jak chociażby dzisiaj w Sejmie. Tak skutecznego Prezydenta w NAJSTRASZLIWSZYCH warunkach jakie można sobie wyobrazić, ze świecą szukać. Wywalczył praktycznie same sukcesy, jednoczesnie dzisiaj szachując rząd z pomocą dla Ukraińców od 4 marca. Jasno dał do zrozumienia, że następnych ustaw pomocowych dla UA nie podpisze, a to oznacza, że rząd musi wypracować nowy plan - to był jeden z resztą jeden z głównych powodów dla których Nawrocki MUSIAŁ podpisać tę zmienioną ustawę - burdel byłby niewiarygodny, a wszystko spadłoby nie na rząd, który za to odpowiada, tylko na Prezydenta, a wtedy bylibyśmy w dupie. Nikt by tyle nie osiągnął w takich warunkach to PKN. A mam wrażenie, ze robi to z palcem w nosie. Wystarczyło dzisiaj spojrzeć na Tuska w Sejmie. Nie zapominajcie o tym, żeby nie czytać polityki powierzchownie i zero-jedynkowo, bo na tym się zawsze człowiek przejedzie. Dziękuję za uwagę.",1,20,18,39,26-09-25,1690,268,,https://nitter.net/HubnerrMax/status/1971638568402460807#m
236,jazdar4,Banderowcy mają drugiego prezydenta w Polsce! II kadencję niech Nawrocki zabiega o głosy kumpli banderowców!!!! Dno !!!!,1,5,0,6,26-09-25,120,17,,https://nitter.net/jazdar4/status/1971616304303165682#m
237,KoronaWarszawa,❌Nawrocki podpisał anty - Polską ustawę o socjalu dla Ukraińców. Hańba❗️ wydarzenia.interia.pl/kraj/n…,3,87,59,149,26-09-25,102,12,,https://nitter.net/KoronaWarszawa/status/1971620695039005016#m
238,JacekWilkPL,Koniec złudzeń... ...Karol Nawrocki wchodzi w system Republiki Okrągłego Stołu.,1,95,78,174,26-09-25,79,10,,https://nitter.net/JacekWilkPL/status/1971533442040152325#m
239,HubnerrMax,"Bzdury. Byłby armageddon w związku z deportacjami i chaosem z Ukraińcami - Tusk rozgrywałby to 24/7. Wszystko spadałoby na Prezydenta i jego weto, a Tusk miałby pół roku spokoju. Teraz jest odwrotnie- Tusk musi się przygotować na armageddon, a Nawrocki umywa ręce do marca.",0,2,2,4,26-09-25,273,44,,https://nitter.net/HubnerrMax/status/1971642864422838380#m
240,Nawrocki25,"Nowe przepisy, które wymusił na rządzie Prezydent Nawrocki, to ograniczenie przywilejów Ukraińców. Nikt nie może mieć większych praw w Polsce od Polaków!🇵🇱",26,77,120,223,26-09-25,155,22,,https://nitter.net/Nawrocki25/status/1971629644349952136#m
241,KRESYPL,"Prezydent podpisał znowelizowaną ustawę o obywatelach Ukrainy, która przedłuża legalność ich pobytu w Polsce, ale ograniczającą część świadczeń zdrowotnych i socjalnych do osób pracujących. kresy.pl/wydarzenia/regiony/…",0,0,0,0,26-09-25,219,25,,https://nitter.net/KRESYPL/status/1971643809848250473#m
242,AecioEscalante,"¿A estos los escogen, o llegan solos?... 😱😱 Un video del presidente de Polonia, Karol Nawrocki, sosteniendo una “bolsita blanca” en la ONU, desató un fuerte debate en redes sociales",18,655,48,721,26-09-25,181,30,,https://nitter.net/AecioEscalante/status/1971366519348351444#m
243,Jarek00070,Czyli zrobiliście to co chciał Prezydent Nawrocki. Grzeczne chłopaki 😂,0,0,0,0,26-09-25,70,10,,https://nitter.net/Jarek00070/status/1971643771738902788#m
244,HubnerrMax,"Niektórym się wydaje, że Prezydent Nawrocki walczy w uczciwej grze. Tylko czekali, by zacząć narzekać. A to był jego dzień: ▪️ OSTATNIE pół roku wsparcia dla Ukraińców i wymuszenie ich PRACY W PL by odbierali świadczenia. ▪️ wywalenie wiatraków z ustawy o obniżeniu cen energii, którą zawetował. ▪️ wywalenie przechowywania gazu POZA granicami Polski z ustawy którą zawetował ▪️ zwyciestwo jego projektu Tak dla CPK w Sejmie i przegrana większości sejmowej Tuska. Otóż nie, Prezydent Nawrocki nie walczy w uczciwej grze. Walczy w ringu w którym nie jest okładany przez jednego przeciwnika, ale przez kilkuset naraz i to z widowni - nie dołączajcie do nich. Mimo tego, że jest na niego taki nierówny atak, ciosów unika, wyprowadza swoje i wychodzi w rundach zwycięsko. Z okazjonalnym nokautem, jak chociażby dzisiaj w Sejmie. Tak skutecznego Prezydenta w NAJSTRASZLIWSZYCH warunkach jakie można sobie wyobrazić, ze świecą szukać. Wywalczył praktycznie same sukcesy, jednoczesnie dzisiaj szachując rząd z pomocą dla Ukraińców od 4 marca. Jasno dał do zrozumienia, że następnych ustaw pomocowych dla UA nie podpisze, a to oznacza, że rząd musi wypracować nowy plan - to był jeden z resztą jeden z głównych powodów dla których Nawrocki MUSIAŁ podpisać tę zmienioną ustawę - burdel byłby niewiarygodny, a wszystko spadłoby nie na rząd, który za to odpowiada, tylko na Prezydenta, a wtedy bylibyśmy w dupie. Nikt by tyle nie osiągnął w takich warunkach to PKN. A mam wrażenie, ze robi to z palcem w nosie. Wystarczyło dzisiaj spojrzeć na Tuska w Sejmie. Nie zapominajcie o tym, żeby nie czytać polityki powierzchownie i zero-jedynkowo, bo na tym się zawsze człowiek przejedzie. Dziękuję za uwagę.",1,20,18,39,26-09-25,1690,268,,https://nitter.net/HubnerrMax/status/1971638568402460807#m
245,Edgar_Korona,"Prezydent Karol Nawrocki zdecydował o podpisaniu ustawy dotyczącej obywateli Ukrainy. Ustawę gloryfilkującą i faworyzującą Ukraińców w Polsce!! Ukraińcy będą dalej kolonizować Polskę. Ukrainizacja Polski postępuje... Tylko @GrzegorzBraun_ Co ustawa daje obywatelom Ukrainy (w punktach): Przedłuża legalny pobyt obywateli Ukrainy w Polsce do 4 marca 2026 r. Zapewnia dostęp do świadczenia „800 plus”, pod warunkiem aktywności zawodowej (praca lub działalność gospodarcza) Umożliwia legalną pracę bez konieczności uzyskania zezwolenia na pracę Gwarantuje dostęp do opieki zdrowotnej, edukacji i usług publicznych Daje prawo do zasiłków rodzinnych, opiekuńczych i socjalnych, pod warunkami Ułatwia procedury meldunkowe, nadanie PESEL i inne formalności administracyjne Umożliwia korzystanie z publicznych przedszkoli i szkół na równych zasadach z Polakami Daje dostęp do rynku wynajmu mieszkań komunalnych i socjalnych (w niektórych samorządach) Ułatwia nostryfikację dyplomów oraz uznanie kwalifikacji zawodowych Gwarantuje świadczenia pieniężne i pomoc rzeczową w sytuacjach szczególnych (np. zakwaterowanie, żywność) Chroni przed deportacją i zapewnia ochronę czasową zgodną z decyzją UE Ustawa przewiduje dotacje celowe z budżetu państwa dla jednostek samorządu terytorialnego na zadania związane z pomocą obywatelom Ukrainy. W uzasadnieniach do wcześniejszych wersji ustawy mówiono, że osoby, które udzieliły zakwaterowania i wyżywienia Ukraińcom w lokalach prywatnych, mogły otrzymać świadczenie pieniężne — np. 40 zł dziennie maksymalnie przez 60 dni. Ustawa także ustanawia Fundusz Pomocy, z którego środki będą przeznaczone m.in. na dofinansowanie zadań pomocowych dla Ukraińców. Ustawa legislacyjnie wyraźnie adresuje Ukraińców (i ich małżonków, dzieci) — to nie dotyczy automatycznie wszystkich cudzoziemców czy mniejszości. To powoduje, że inne grupy znajdują się poza specjalnym zakresem ustawowym. To może być odbierane jako różnicowanie statusu prawnego. Z drugiej strony, istnieją mechanizmy ochrony czasowej w prawie UE, które mogą dotyczyć innych obywateli uciekających przed wojną, ale niekoniecznie dają identyczne uprawnienia, jakie specustawa przewiduje dla Ukraińców.",2,54,16,72,26-09-25,2187,282,,https://nitter.net/Edgar_Korona/status/1971617197052366999#m
246,HubnerrMax,"BARDZO WAŻNY KOMUNIKAT KANCELARII PREZYDENTA WS. POMOCY DLA UKRAIŃCÓW! ""To OSTATNIA USTAWA, którą Prezydent Nawrocki podpisuje ws. pomocy dla Ukrainy. ŻADNEJ INNEJ USTAWY już nie podpisze. Musimy wrócić do ich NORMALNEGO traktowania"". Ta ustawa obowiązuje tylko do marca.",13,133,181,327,26-09-25,271,38,,https://nitter.net/HubnerrMax/status/1971620676684730726#m
247,mute_observer1,Nawrocki napluł Polakom w twarz.,2,65,28,95,26-09-25,32,5,,https://nitter.net/mute_observer1/status/1971613966674821563#m
248,styszka,"Prezydent Nawrocki podpisał rządową ustawę utrzymującą 800 plus i świadczenia zdrowotne dla Ukraińców. Nawet nie potrafił wymusić rozpatrzenia projektu, który sam złożył. Żadna zmiana. Dobrze, że na niego nie głosowałem.",0,1,1,2,26-09-25,220,30,,https://nitter.net/styszka/status/1971641759676719262#m
249,mankowski_kamil,"I na co wam były te wiatraki w ustawie ? Nie dość, ze Nawrocki zyskał na tym, to jeszcze-5pkt % w aknowszych sondażach macie w gratisie 🙃🤭😃",0,0,0,0,26-09-25,139,27,,https://nitter.net/mankowski_kamil/status/1971643727950369244#m
250,HubnerrMax,"Nie. Wszyscy już wiedzą, że Prezydent powiedział - do 4 marca i basta. Tutaj tak nie było - ludzie np nadal nie wiedza, że to nie jest ta sama ustawa, którą Nawrocki zawetował kilka tygodni temu.",0,0,0,0,26-09-25,195,36,,https://nitter.net/HubnerrMax/status/1971643726956319151#m
251,MartaXPo_Prostu,"O nieeee. Nawrocki podpisał ustawę o pomocy Ukraińcom. Czyli to wszystko to był teatr dla gojów. Wyborcy Nawrockiego którzy świadomie w 1 turze na Niego głosowaliście, nie czujecie się, jakbyście dostali cegłą w głowę i dalej zamierzacie się cieszyć, że jest propolski? xDDDDDDD",0,2,0,2,26-09-25,278,43,,https://nitter.net/MartaXPo_Prostu/status/1971611435789951164#m
252,chrzanikx,"Szef Kancelarii Prezydenta: „To jest ostatnia ustawa, którą prezydent Nawrocki podpisuje dotycząca takiej formy pomocy obywatelom Ukrainy”",7,42,134,183,26-09-25,138,17,,https://nitter.net/chrzanikx/status/1971622953508131114#m
253,KoronaWarszawa,❌Nawrocki podpisał anty - Polską ustawę o socjalu dla Ukraińców. Hańba❗️ wydarzenia.interia.pl/kraj/n…,3,87,59,149,26-09-25,102,12,,https://nitter.net/KoronaWarszawa/status/1971620695039005016#m
254,prezydentkarol,"‼️PODAJ DALEJ‼️ Nowe przepisy, które wymusił na rządzie Prezydent Nawrocki, to ograniczenie przywilejów Ukraińców. Nikt nie może mieć większych praw w Polsce od Polaków! 🇵🇱 #PoPierwszePolskaPoPierwszePolacy",1,21,9,31,26-09-25,206,26,,https://nitter.net/prezydentkarol/status/1971637437261898091#m
255,tuin_vander,"#EdukacjaZdrowotna Prezydent USA 🤡 zarabia prywatnie i się tego nie wstydzi czy wypiera, to czemu jego kolega po fachy #sutener Nawrocki nie mógłby zarabiać na reklamie saszetek nikotynowych. Razem z synem, bo ten też używa, mogą zostać ambasodarami albo chociaż szarż(ami) przemysłu tytoniowego. ""Palenie dla zdrowia"" by Nawrocki&dzieci! #zaNasze",1,1,1,3,23-09-25,347,49,,https://nitter.net/tuin_vander/status/1970441948893790546#m
256,WirowskiJacek,Tusk ograł p.o.prezydenta.Nawrocki musiał podpisać ustawę bo w przeciwnym wypadku cały chaos wynikający z niepodpisania musiałby wziąć na siebie.A to oznaczałoby porażkę polityczną Boguckiego i Przydacza.,0,0,0,0,26-09-25,204,26,,https://nitter.net/WirowskiJacek/status/1971643677807357966#m
257,LeskiPiotr,"Prezydent Karol Nawrocki (25.08.2025): ""Nigdy nie zgodzę się na żadne przepisy, które gorzej traktują polskich obywateli, niż obywateli innego państwa"" Po czym dziś podpisuje ustawę, która gorzej traktuje Polaków, niż Ukraińców. Ależ słowny jest ten nasz Prezydent 😄🙈🙈🤦🤦",2,8,2,12,26-09-25,270,38,,https://nitter.net/LeskiPiotr/status/1971618550772387987#m
258,MarcinPalade,"Prezydent podpisał ustawę o pomocy obywatelom Ukrainy. Szef KPRP @BoguckiZbigniew: ""To jest ostatnia ustawa, którą pan prezydent Nawrocki podpisuje, dotycząca takiej formy pomocy obywatelom Ukrainy. Żadnej innej takiej ustawy pan prezydent już nie podpisze. Musimy przejść na normalne warunki, czyli traktowanie obywateli Ukrainy przebywających na terytorium Polski, w taki sam sposób, jak innych obcokrajowców""",15,48,189,252,26-09-25,411,54,,https://nitter.net/MarcinPalade/status/1971611724433265150#m
259,wPolityce_pl,Prezydent @NawrockiKn liderem rankingu zaufania! Jego notowania mocno wzrosły. Na kolejnych miejscach @sikorskiradek i @krzysztofbosak wpolityce.pl/polityka/741649…,0,4,3,7,26-09-25,164,16,,https://nitter.net/wPolityce_pl/status/1971635082940338281#m
260,Tysolpl,Prezydent Nawrocki liderem najnowszego sondażu zaufania tysol.pl/a147027-prezydent-n…,0,1,0,1,26-09-25,85,7,,https://nitter.net/Tysolpl/status/1971642594242523165#m
261,Fifloczek,"Spokojnie, spokojnie. Nawrocki raz zawetuje a drugi raz podpisze",0,0,0,0,26-09-25,64,9,,https://nitter.net/Fifloczek/status/1971643652767379671#m
262,KrzysztofAtor,"Godzinę temu Nawrocki podjął decyzję! Niestety wybrał zdradę! Nowy vlog w sobotę o 6:30, a do tego czasu warto przypomnieć sobie powodu dlaczego decyzja Dudy 2.0 (czyli Nawrockiego) to zdrada na Polsce i Polakach! piped.video/X0j4h9henZ0",0,5,1,6,26-09-25,237,35,,https://nitter.net/KrzysztofAtor/status/1971625177877516624#m
263,HubnerrMax,"BARDZO WAŻNY KOMUNIKAT KANCELARII PREZYDENTA WS. POMOCY DLA UKRAIŃCÓW! ""To OSTATNIA USTAWA, którą Prezydent Nawrocki podpisuje ws. pomocy dla Ukrainy. ŻADNEJ INNEJ USTAWY już nie podpisze. Musimy wrócić do ich NORMALNEGO traktowania"". Ta ustawa obowiązuje tylko do marca.",13,133,181,327,26-09-25,271,38,,https://nitter.net/HubnerrMax/status/1971620676684730726#m
264,JSmigowski,Szybko poszło. Nawrocki podpisał ustawę o pomocy Ukraińcom.,7,89,95,191,26-09-25,59,8,,https://nitter.net/JSmigowski/status/1971610962462703764#m
265,HubnerrMax,"Prezydent Karol Nawrocki podpisał ustawę ""obniżającą ceny energii"". I, moi drodzy, SZOK. Nie ma w niej niemieckiej wrzutki lobbystycznej o wiatrakach. Jak to możliwe?",1,123,23,147,26-09-25,166,24,,https://nitter.net/HubnerrMax/status/1971613041293971704#m
266,Ryszard81908363,A Szarża pan Nawrocki też wypisał? Przecież Szarż jest poniekąd jego dzieckiem.,0,0,0,0,26-09-25,79,12,,https://nitter.net/Ryszard81908363/status/1971643539496095909#m
267,Edgar_Korona,"Prezydent Karol Nawrocki zdecydował o podpisaniu ustawy dotyczącej obywateli Ukrainy. Ustawę gloryfilkującą i faworyzującą Ukraińców w Polsce!! Ukraińcy będą dalej kolonizować Polskę. Ukrainizacja Polski postępuje... Tylko @GrzegorzBraun_ Co ustawa daje obywatelom Ukrainy (w punktach): Przedłuża legalny pobyt obywateli Ukrainy w Polsce do 4 marca 2026 r. Zapewnia dostęp do świadczenia „800 plus”, pod warunkiem aktywności zawodowej (praca lub działalność gospodarcza) Umożliwia legalną pracę bez konieczności uzyskania zezwolenia na pracę Gwarantuje dostęp do opieki zdrowotnej, edukacji i usług publicznych Daje prawo do zasiłków rodzinnych, opiekuńczych i socjalnych, pod warunkami Ułatwia procedury meldunkowe, nadanie PESEL i inne formalności administracyjne Umożliwia korzystanie z publicznych przedszkoli i szkół na równych zasadach z Polakami Daje dostęp do rynku wynajmu mieszkań komunalnych i socjalnych (w niektórych samorządach) Ułatwia nostryfikację dyplomów oraz uznanie kwalifikacji zawodowych Gwarantuje świadczenia pieniężne i pomoc rzeczową w sytuacjach szczególnych (np. zakwaterowanie, żywność) Chroni przed deportacją i zapewnia ochronę czasową zgodną z decyzją UE Ustawa przewiduje dotacje celowe z budżetu państwa dla jednostek samorządu terytorialnego na zadania związane z pomocą obywatelom Ukrainy. W uzasadnieniach do wcześniejszych wersji ustawy mówiono, że osoby, które udzieliły zakwaterowania i wyżywienia Ukraińcom w lokalach prywatnych, mogły otrzymać świadczenie pieniężne — np. 40 zł dziennie maksymalnie przez 60 dni. Ustawa także ustanawia Fundusz Pomocy, z którego środki będą przeznaczone m.in. na dofinansowanie zadań pomocowych dla Ukraińców. Ustawa legislacyjnie wyraźnie adresuje Ukraińców (i ich małżonków, dzieci) — to nie dotyczy automatycznie wszystkich cudzoziemców czy mniejszości. To powoduje, że inne grupy znajdują się poza specjalnym zakresem ustawowym. To może być odbierane jako różnicowanie statusu prawnego. Z drugiej strony, istnieją mechanizmy ochrony czasowej w prawie UE, które mogą dotyczyć innych obywateli uciekających przed wojną, ale niekoniecznie dają identyczne uprawnienia, jakie specustawa przewiduje dla Ukraińców.",2,54,16,72,26-09-25,2187,282,,https://nitter.net/Edgar_Korona/status/1971617197052366999#m
268,BalliMarzec,Prezydent #Nawrocki podpisał ustawę o pomocy Ukraińcom. Znów nas oszukali. @NawrockiKn,1,10,13,24,26-09-25,86,11,,https://nitter.net/BalliMarzec/status/1971621152335581335#m
269,Polonus17,"Podpisał ustawę ukraińką,teraz zażąda krwi naszych dzieci! Nawrocki,masz u nas przejebane!",0,1,0,1,26-09-25,90,11,,https://nitter.net/Polonus17/status/1971634545868132600#m
270,WolnoscTV,Stało się‼️ Nawrocki podpisał ustawę o pomocy Ukraińcom!,19,31,166,216,26-09-25,56,8,,https://nitter.net/WolnoscTV/status/1971618592669233623#m
271,szef_dywizji,"PILNE ‼️ Do sieci wyciekło kompromitujące nagranie, z którego widać, że Karol Nawrocki kompletnie sobie nie radzi z angielskim 😜",35,653,95,783,25-09-25,128,20,,https://nitter.net/szef_dywizji/status/1971158675797705104#m
272,JanuszPorto,ale przewidzialem te arugmentacje :D Nawrocki to mowi od kwietnia/maja :) i co TUsk mu to wrzucil - to samo zrobi w marcu..,0,0,0,0,26-09-25,123,23,,https://nitter.net/JanuszPorto/status/1971643858028318856#m
273,1972tomek,Karol Nawrocki jednak za ukrainizacją. Podpisał dalsze finansowanie Ukraińców z kieszeni podatnika.,8,118,130,256,26-09-25,99,12,,https://nitter.net/1972tomek/status/1971615719906517347#m
274,Soraya885879959,Jak się czujecie po tym co dziś zrobił Nawrocki?,0,0,0,0,26-09-25,48,9,,https://nitter.net/Soraya885879959/status/1971643846389125284#m
275,Wlodek_Skalik,"Niestety, prezydent Karol Nawrocki podpisał ustawę pomocową dla Ukraińców i tym samym uległ naciskom ze strony rządu i ukraińskiego lobby w Polsce. Wcześniej wizyta w Nowym Yorku z przewodniczącym Światowego Kongresu Żydów, teraz zgoda na dalsze finansowanie Ukraińców. Szkoda…",6,83,51,140,26-09-25,277,39,,https://nitter.net/Wlodek_Skalik/status/1971631362273849398#m
276,chrzanikx,Karol Nawrocki podpisał ustawę o pomocy Ukraińcom Informację przekazała Kancelaria Prezydenta,13,50,252,315,26-09-25,93,11,,https://nitter.net/chrzanikx/status/1971606284177936692#m
277,HubnerrMax,"Bzdury. Byłby armageddon w związku z deportacjami i chaosem z Ukraińcami - Tusk rozgrywałby to 24/7. Wszystko spadałoby na Prezydenta i jego weto, a Tusk miałby pół roku spokoju. Teraz jest odwrotnie- Tusk musi się przygotować na armageddon, a Nawrocki umywa ręce do marca.",0,3,2,5,26-09-25,273,44,,https://nitter.net/HubnerrMax/status/1971642864422838380#m
278,Nawrocki25,"Nowe przepisy, które wymusił na rządzie Prezydent Nawrocki, to ograniczenie przywilejów Ukraińców. Nikt nie może mieć większych praw w Polsce od Polaków!🇵🇱",27,77,120,224,26-09-25,155,22,,https://nitter.net/Nawrocki25/status/1971629644349952136#m
279,KRESYPL,"Prezydent podpisał znowelizowaną ustawę o obywatelach Ukrainy, która przedłuża legalność ich pobytu w Polsce, ale ograniczającą część świadczeń zdrowotnych i socjalnych do osób pracujących. kresy.pl/wydarzenia/regiony/…",0,0,0,0,26-09-25,219,25,,https://nitter.net/KRESYPL/status/1971643809848250473#m
280,AecioEscalante,"¿A estos los escogen, o llegan solos?... 😱😱 Un video del presidente de Polonia, Karol Nawrocki, sosteniendo una “bolsita blanca” en la ONU, desató un fuerte debate en redes sociales",18,655,48,721,26-09-25,181,30,,https://nitter.net/AecioEscalante/status/1971366519348351444#m
281,Jarek00070,Czyli zrobiliście to co chciał Prezydent Nawrocki. Grzeczne chłopaki 😂,0,0,0,0,26-09-25,70,10,,https://nitter.net/Jarek00070/status/1971643771738902788#m
282,HubnerrMax,"Niektórym się wydaje, że Prezydent Nawrocki walczy w uczciwej grze. Tylko czekali, by zacząć narzekać. A to był jego dzień: ▪️ OSTATNIE pół roku wsparcia dla Ukraińców i wymuszenie ich PRACY W PL by odbierali świadczenia. ▪️ wywalenie wiatraków z ustawy o obniżeniu cen energii, którą zawetował. ▪️ wywalenie przechowywania gazu POZA granicami Polski z ustawy którą zawetował ▪️ zwyciestwo jego projektu Tak dla CPK w Sejmie i przegrana większości sejmowej Tuska. Otóż nie, Prezydent Nawrocki nie walczy w uczciwej grze. Walczy w ringu w którym nie jest okładany przez jednego przeciwnika, ale przez kilkuset naraz i to z widowni - nie dołączajcie do nich. Mimo tego, że jest na niego taki nierówny atak, ciosów unika, wyprowadza swoje i wychodzi w rundach zwycięsko. Z okazjonalnym nokautem, jak chociażby dzisiaj w Sejmie. Tak skutecznego Prezydenta w NAJSTRASZLIWSZYCH warunkach jakie można sobie wyobrazić, ze świecą szukać. Wywalczył praktycznie same sukcesy, jednoczesnie dzisiaj szachując rząd z pomocą dla Ukraińców od 4 marca. Jasno dał do zrozumienia, że następnych ustaw pomocowych dla UA nie podpisze, a to oznacza, że rząd musi wypracować nowy plan - to był jeden z resztą jeden z głównych powodów dla których Nawrocki MUSIAŁ podpisać tę zmienioną ustawę - burdel byłby niewiarygodny, a wszystko spadłoby nie na rząd, który za to odpowiada, tylko na Prezydenta, a wtedy bylibyśmy w dupie. Nikt by tyle nie osiągnął w takich warunkach to PKN. A mam wrażenie, ze robi to z palcem w nosie. Wystarczyło dzisiaj spojrzeć na Tuska w Sejmie. Nie zapominajcie o tym, żeby nie czytać polityki powierzchownie i zero-jedynkowo, bo na tym się zawsze człowiek przejedzie. Dziękuję za uwagę.",1,20,18,39,26-09-25,1690,268,,https://nitter.net/HubnerrMax/status/1971638568402460807#m
283,Edgar_Korona,"Prezydent Karol Nawrocki zdecydował o podpisaniu ustawy dotyczącej obywateli Ukrainy. Ustawę gloryfilkującą i faworyzującą Ukraińców w Polsce!! Ukraińcy będą dalej kolonizować Polskę. Ukrainizacja Polski postępuje... Tylko @GrzegorzBraun_ Co ustawa daje obywatelom Ukrainy (w punktach): Przedłuża legalny pobyt obywateli Ukrainy w Polsce do 4 marca 2026 r. Zapewnia dostęp do świadczenia „800 plus”, pod warunkiem aktywności zawodowej (praca lub działalność gospodarcza) Umożliwia legalną pracę bez konieczności uzyskania zezwolenia na pracę Gwarantuje dostęp do opieki zdrowotnej, edukacji i usług publicznych Daje prawo do zasiłków rodzinnych, opiekuńczych i socjalnych, pod warunkami Ułatwia procedury meldunkowe, nadanie PESEL i inne formalności administracyjne Umożliwia korzystanie z publicznych przedszkoli i szkół na równych zasadach z Polakami Daje dostęp do rynku wynajmu mieszkań komunalnych i socjalnych (w niektórych samorządach) Ułatwia nostryfikację dyplomów oraz uznanie kwalifikacji zawodowych Gwarantuje świadczenia pieniężne i pomoc rzeczową w sytuacjach szczególnych (np. zakwaterowanie, żywność) Chroni przed deportacją i zapewnia ochronę czasową zgodną z decyzją UE Ustawa przewiduje dotacje celowe z budżetu państwa dla jednostek samorządu terytorialnego na zadania związane z pomocą obywatelom Ukrainy. W uzasadnieniach do wcześniejszych wersji ustawy mówiono, że osoby, które udzieliły zakwaterowania i wyżywienia Ukraińcom w lokalach prywatnych, mogły otrzymać świadczenie pieniężne — np. 40 zł dziennie maksymalnie przez 60 dni. Ustawa także ustanawia Fundusz Pomocy, z którego środki będą przeznaczone m.in. na dofinansowanie zadań pomocowych dla Ukraińców. Ustawa legislacyjnie wyraźnie adresuje Ukraińców (i ich małżonków, dzieci) — to nie dotyczy automatycznie wszystkich cudzoziemców czy mniejszości. To powoduje, że inne grupy znajdują się poza specjalnym zakresem ustawowym. To może być odbierane jako różnicowanie statusu prawnego. Z drugiej strony, istnieją mechanizmy ochrony czasowej w prawie UE, które mogą dotyczyć innych obywateli uciekających przed wojną, ale niekoniecznie dają identyczne uprawnienia, jakie specustawa przewiduje dla Ukraińców.",2,54,16,72,26-09-25,2187,282,,https://nitter.net/Edgar_Korona/status/1971617197052366999#m
284,HubnerrMax,"BARDZO WAŻNY KOMUNIKAT KANCELARII PREZYDENTA WS. POMOCY DLA UKRAIŃCÓW! ""To OSTATNIA USTAWA, którą Prezydent Nawrocki podpisuje ws. pomocy dla Ukrainy. ŻADNEJ INNEJ USTAWY już nie podpisze. Musimy wrócić do ich NORMALNEGO traktowania"". Ta ustawa obowiązuje tylko do marca.",13,133,182,328,26-09-25,271,38,,https://nitter.net/HubnerrMax/status/1971620676684730726#m
285,mute_observer1,Nawrocki napluł Polakom w twarz.,2,65,28,95,26-09-25,32,5,,https://nitter.net/mute_observer1/status/1971613966674821563#m
286,styszka,"Prezydent Nawrocki podpisał rządową ustawę utrzymującą 800 plus i świadczenia zdrowotne dla Ukraińców. Nawet nie potrafił wymusić rozpatrzenia projektu, który sam złożył. Żadna zmiana. Dobrze, że na niego nie głosowałem.",0,1,1,2,26-09-25,220,30,,https://nitter.net/styszka/status/1971641759676719262#m
