id,username,text,likes,retweets,replies,total_interactions,post_date_iso,text_length,word_count,sentiment_label,link
117,HubnerrMax,"Niektórym się wydaje, że Prezydent Nawrocki walczy w uczciwej grze. Tylko czekali, by zacząć narzekać. A to był jego dzień: ▪️ OSTATNIE pół roku wsparcia dla Ukraińców i wymuszenie ich PRACY W PL by odbierali świadczenia. ▪️ wywalenie wiatraków z ustawy o obniżeniu cen energii, którą zawetował. ▪️ wywalenie przechowywania gazu POZA granicami Polski z ustawy którą zawetował ▪️ zwyciestwo jego projektu Tak dla CPK w Sejmie i przegrana większości sejmowej Tuska. Otóż nie, Prezydent Nawrocki nie walczy w uczciwej grze. Walczy w ringu w którym nie jest okładany przez jednego przeciwnika, ale przez kilkuset naraz i to z widowni - nie dołączajcie do nich. Mimo tego, że jest na niego taki nierówny atak, ciosów unika, wyprowadza swoje i wychodzi w rundach zwycięsko. Z okazjonalnym nokautem, jak chociażby dzisiaj w Sejmie. Tak skutecznego Prezydenta w NAJSTRASZLIWSZYCH warunkach jakie można sobie wyobrazić, ze świecą szukać. Wywalczył praktycznie same sukcesy, jednoczesnie dzisiaj szachując rząd z pomocą dla Ukraińców od 4 marca. Jasno dał do zrozumienia, że następnych ustaw pomocowych dla UA nie podpisze, a to oznacza, że rząd musi wypracować nowy plan - to był jeden z resztą jeden z głównych powodów dla których Nawrocki MUSIAŁ podpisać tę zmienioną ustawę - burdel byłby niewiarygodny, a wszystko spadłoby nie na rząd, który za to odpowiada, tylko na Prezydenta, a wtedy bylibyśmy w dupie. Nikt by tyle nie osiągnął w takich warunkach to PKN. A mam wrażenie, ze robi to z palcem w nosie. Wystarczyło dzisiaj spojrzeć na Tuska w Sejmie. Nie zapominajcie o tym, żeby nie czytać polityki powierzchownie i zero-jedynkowo, bo na tym się zawsze człowiek przejedzie. Dziękuję za uwagę.",1,20,17,38,26-09-25,1690,268,,https://nitter.net/HubnerrMax/status/1971638568402460807#m
118,jazdar4,Banderowcy mają drugiego prezydenta w Polsce! II kadencję niech Nawrocki zabiega o głosy kumpli banderowców!!!! Dno !!!!,1,5,0,6,26-09-25,120,17,,https://nitter.net/jazdar4/status/1971616304303165682#m
119,KoronaWarszawa,❌Nawrocki podpisał anty - Polską ustawę o socjalu dla Ukraińców. Hańba❗️ wydarzenia.interia.pl/kraj/n…,3,86,59,148,26-09-25,102,12,,https://nitter.net/KoronaWarszawa/status/1971620695039005016#m
120,JacekWilkPL,Koniec złudzeń... ...Karol Nawrocki wchodzi w system Republiki Okrągłego Stołu.,1,95,78,174,26-09-25,79,10,,https://nitter.net/JacekWilkPL/status/1971533442040152325#m
121,AecioEscalante,"¿A estos los escogen, o llegan solos?... 😱😱 Un video del presidente de Polonia, Karol Nawrocki, sosteniendo una “bolsita blanca” en la ONU, desató un fuerte debate en redes sociales",18,652,48,718,26-09-25,181,30,,https://nitter.net/AecioEscalante/status/1971366519348351444#m
122,mute_observer1,"Karol Nawrocki, wiceprezydent Ukrainy.",0,21,9,30,26-09-25,38,4,,https://nitter.net/mute_observer1/status/1971620449621881169#m
123,mute_observer1,"Po co jest Nawrocki? Po to, żeby wszystko zostało po staremu. To tyle, można się rozejść.",0,6,0,6,26-09-25,89,16,,https://nitter.net/mute_observer1/status/1971498616545231257#m
124,gryfnyhanys,Dziś prezydent Nawrocki stał się dla mnie Batyrem,1,7,7,15,26-09-25,49,8,,https://nitter.net/gryfnyhanys/status/1971624078835700050#m
125,HubnerrMax,"BARDZO WAŻNY KOMUNIKAT KANCELARII PREZYDENTA WS. POMOCY DLA UKRAIŃCÓW! ""To OSTATNIA USTAWA, którą Prezydent Nawrocki podpisuje ws. pomocy dla Ukrainy. ŻADNEJ INNEJ USTAWY już nie podpisze. Musimy wrócić do ich NORMALNEGO traktowania"". Ta ustawa obowiązuje tylko do marca.",13,131,181,325,26-09-25,271,38,,https://nitter.net/HubnerrMax/status/1971620676684730726#m
126,PiotrSzumlewicz,"Na szczęście Karol Nawrocki nie uległ ksenofobicznemu szaleństwu i podpisał ustawę o pomocy Ukraińcom. Co prawda dał do zrozumienia, że lada dzień zgłosi rozwiązania antyukraińskie, ale na szczęście póki co zachował resztki odpowiedzialności i przyzwoitości.",0,1,0,1,26-09-25,258,35,,https://nitter.net/PiotrSzumlewicz/status/1971642146265702625#m
127,Nawrocki25,"Nowe przepisy, które wymusił na rządzie Prezydent Nawrocki, to ograniczenie przywilejów Ukraińców. Nikt nie może mieć większych praw w Polsce od Polaków!🇵🇱",25,76,116,217,26-09-25,155,22,,https://nitter.net/Nawrocki25/status/1971629644349952136#m
128,JusgloC33054,"Nie zdziwiłbym się gdyby te ukraińce nas szantażowały. Dzień po dronach było głosowanie o pomoc Ukrainie i nagle PiS wstrzymał się od głosu, do tego ciągle jakieś podpalenia, a teraz Nawrocki zmienia zdanie i podpisuje ustawę.",0,2,1,3,26-09-25,226,36,,https://nitter.net/JusgloC33054/status/1971622138198229139#m
129,pobozy,"🗯️ Polacy mają dość premiera Tuska i permanentnej walki zamiast pracy dla państwa. Gdyby Donald Tusk w jednej trzeciej był aktywny tak jak prezydent Karol Nawrocki, polskie sprawy byłyby dziś w zupełnie innym miejscu. 🇵🇱",0,28,12,40,26-09-25,220,35,,https://nitter.net/pobozy/status/1971630767915913510#m
130,AecioEscalante,"¿A estos los escogen, o llegan solos?... 😱😱 Un video del presidente de Polonia, Karol Nawrocki, sosteniendo una “bolsita blanca” en la ONU, desató un fuerte debate en redes sociales",18,652,48,718,26-09-25,181,30,,https://nitter.net/AecioEscalante/status/1971366519348351444#m
131,2025_EwaPolka,"🔴Tusk kolejny raz manipuluje i wprowadza w błąd opinię publiczną. Podczas mini konferencji w Sejmie mówi, iż Pan Prezydent dr Karol Nawrocki @NawrockiKn @Nawrocki25 @prezydentpl, chce większej władzy wbrew konstytucji. Nie mogę uwierzyć... Za daleko poszedłeś p. @donaldtusk, to ty łamiesz konstytucję i chcesz większej władzy. Nie widzisz tego, że za to co robisz jest wysoka odpowiedzialność karna? Bezczelność, kłamstwa i manipulacja to broń i działanie antypolskiego trollem. 👇 ‼️",4,143,20,167,26-09-25,484,70,,https://nitter.net/2025_EwaPolka/status/1971555366812213670#m
132,HubnerrMax,"Niektórym się wydaje, że Prezydent Nawrocki walczy w uczciwej grze. Tylko czekali, by zacząć narzekać. A to był jego dzień: ▪️ OSTATNIE pół roku wsparcia dla Ukraińców i wymuszenie ich PRACY W PL by odbierali świadczenia. ▪️ wywalenie wiatraków z ustawy o obniżeniu cen energii, którą zawetował. ▪️ wywalenie przechowywania gazu POZA granicami Polski z ustawy którą zawetował ▪️ zwyciestwo jego projektu Tak dla CPK w Sejmie i przegrana większości sejmowej Tuska. Otóż nie, Prezydent Nawrocki nie walczy w uczciwej grze. Walczy w ringu w którym nie jest okładany przez jednego przeciwnika, ale przez kilkuset naraz i to z widowni - nie dołączajcie do nich. Mimo tego, że jest na niego taki nierówny atak, ciosów unika, wyprowadza swoje i wychodzi w rundach zwycięsko. Z okazjonalnym nokautem, jak chociażby dzisiaj w Sejmie. Tak skutecznego Prezydenta w NAJSTRASZLIWSZYCH warunkach jakie można sobie wyobrazić, ze świecą szukać. Wywalczył praktycznie same sukcesy, jednoczesnie dzisiaj szachując rząd z pomocą dla Ukraińców od 4 marca. Jasno dał do zrozumienia, że następnych ustaw pomocowych dla UA nie podpisze, a to oznacza, że rząd musi wypracować nowy plan - to był jeden z resztą jeden z głównych powodów dla których Nawrocki MUSIAŁ podpisać tę zmienioną ustawę - burdel byłby niewiarygodny, a wszystko spadłoby nie na rząd, który za to odpowiada, tylko na Prezydenta, a wtedy bylibyśmy w dupie. Nikt by tyle nie osiągnął w takich warunkach to PKN. A mam wrażenie, ze robi to z palcem w nosie. Wystarczyło dzisiaj spojrzeć na Tuska w Sejmie. Nie zapominajcie o tym, żeby nie czytać polityki powierzchownie i zero-jedynkowo, bo na tym się zawsze człowiek przejedzie. Dziękuję za uwagę.",1,20,17,38,26-09-25,1690,268,,https://nitter.net/HubnerrMax/status/1971638568402460807#m
133,WolnoscTV,Stało się‼️ Nawrocki podpisał ustawę o pomocy Ukraińcom!,19,31,165,215,26-09-25,56,8,,https://nitter.net/WolnoscTV/status/1971618592669233623#m
134,MarcinPalade,"Prezydent podpisał ustawę o pomocy obywatelom Ukrainy. Szef KPRP @BoguckiZbigniew: ""To jest ostatnia ustawa, którą pan prezydent Nawrocki podpisuje, dotycząca takiej formy pomocy obywatelom Ukrainy. Żadnej innej takiej ustawy pan prezydent już nie podpisze. Musimy przejść na normalne warunki, czyli traktowanie obywateli Ukrainy przebywających na terytorium Polski, w taki sam sposób, jak innych obcokrajowców""",15,47,188,250,26-09-25,411,54,,https://nitter.net/MarcinPalade/status/1971611724433265150#m
135,EdwardChmielin3,Nawrocki pisze w tej chwili przekaz list do Prezydenta Trumpa z informacja co do twojej osoby żeby miał wiedzę z kim ma doczynienia żeby był ostrozny co do twojej osoby i wiarygodności,0,0,0,0,26-09-25,184,32,,https://nitter.net/EdwardChmielin3/status/1971643183986815192#m
136,KaziSmolinski,"Możemy kolejny raz powtórzyć ""dobrze, że prezydentem jest Nawrocki"". Rząd kolanem dopycha projekt ustawy, który se facto przenosi na polski grunt zamordyzm np. z Wielkiej Brytanii. Proponują cenzurę internetu, naloty policji na domy i kontrolę komunikatorów. Trzeba to zawetować!",1,52,10,63,26-09-25,279,39,,https://nitter.net/KaziSmolinski/status/1971474421375434883#m
137,Skoollman,"@NawrockiKn wprost powiedział Polakom: ""Macie zapierdalać, płacić podatki i oddawać wszystko Ukraińcom"". Nawrocki to drugi @AndrzejDuda – długopis Kaczyńskiego.",1,7,0,8,26-09-25,160,19,,https://nitter.net/Skoollman/status/1971616281653862839#m
138,1972tomek,Karol Nawrocki jednak za ukrainizacją. Podpisał dalsze finansowanie Ukraińców z kieszeni podatnika.,8,116,128,252,26-09-25,99,12,,https://nitter.net/1972tomek/status/1971615719906517347#m
139,Radio_Bialorus,‼️Prezydent 🇵🇱 Karol Nawrocki jednak zdecydował o podpisaniu ustawy dotyczącej pomocy dla obywateli 🇺🇦 Ukrainy — przekazał na konferencji prezydencki minister Zbigniew Bogucki. Banderyzacja Polski trwa w najlepsze.,0,27,14,41,26-09-25,214,28,,https://nitter.net/Radio_Bialorus/status/1971614850687324588#m
140,BoniaPolska,"Zdrajca! Mam nadzieję, że jeszcze więcej Polaków przejrzy na oczy i zobaczy komu naprawdę służy Nawrocki i PiS.",0,0,0,0,26-09-25,111,18,,https://nitter.net/BoniaPolska/status/1971643119939866676#m
141,BoguckiZbigniew,"Prezydent Karol Nawrocki z tysiącami Polakami po stronie CPK‼️ To jest projekt, którego chcą polscy obywatele. Wszyscy ci, którzy powiedzieli TAK dla CPK – niezależnie od wrażliwości społecznej, politycznej czy światopoglądu – łączy ich jedno: pragnienie realizacji wielkich polskich ambicji i budowy państwa bezpiecznego, z własnym centralnym portem komunikacyjnym. Prezydent Rzeczypospolitej Karol Nawrocki, składając ten projekt, stanął na czele setek tysięcy Polaków, którzy chcą CPK w pełnym kształcie. Nie ograniczonym tylko do kilku miast. Nie sprowadzonym wyłącznie do „Ygreka”. Polska to nie tylko Warszawa, Łódź, Wrocław czy Poznań. Polska to także Kalisz, Szczecin i setki innych miast, w których żyją Polacy. Tam też jest Polska – i tam też sięga potrzeba budowy CPK. #Polska #CPK #Bezpieczeństwo #TAKdlaCPK @prezydentpl",4,217,64,285,26-09-25,832,118,,https://nitter.net/BoguckiZbigniew/status/1971531322448384214#m
142,HubnerrMax,"BARDZO WAŻNY KOMUNIKAT KANCELARII PREZYDENTA WS. POMOCY DLA UKRAIŃCÓW! ""To OSTATNIA USTAWA, którą Prezydent Nawrocki podpisuje ws. pomocy dla Ukrainy. ŻADNEJ INNEJ USTAWY już nie podpisze. Musimy wrócić do ich NORMALNEGO traktowania"". Ta ustawa obowiązuje tylko do marca.",13,132,181,326,26-09-25,271,38,,https://nitter.net/HubnerrMax/status/1971620676684730726#m
143,JSmigowski,Szybko poszło. Nawrocki podpisał ustawę o pomocy Ukraińcom.,7,89,95,191,26-09-25,59,8,,https://nitter.net/JSmigowski/status/1971610962462703764#m
144,HubnerrMax,"Prezydent Karol Nawrocki podpisał ustawę ""obniżającą ceny energii"". I, moi drodzy, SZOK. Nie ma w niej niemieckiej wrzutki lobbystycznej o wiatrakach. Jak to możliwe?",1,123,23,147,26-09-25,166,24,,https://nitter.net/HubnerrMax/status/1971613041293971704#m
145,Ryszard81908363,A Szarża pan Nawrocki też wypisał? Przecież Szarż jest poniekąd jego dzieckiem.,0,0,0,0,26-09-25,79,12,,https://nitter.net/Ryszard81908363/status/1971643539496095909#m
146,Edgar_Korona,"Prezydent Karol Nawrocki zdecydował o podpisaniu ustawy dotyczącej obywateli Ukrainy. Ustawę gloryfilkującą i faworyzującą Ukraińców w Polsce!! Ukraińcy będą dalej kolonizować Polskę. Ukrainizacja Polski postępuje... Tylko @GrzegorzBraun_ Co ustawa daje obywatelom Ukrainy (w punktach): Przedłuża legalny pobyt obywateli Ukrainy w Polsce do 4 marca 2026 r. Zapewnia dostęp do świadczenia „800 plus”, pod warunkiem aktywności zawodowej (praca lub działalność gospodarcza) Umożliwia legalną pracę bez konieczności uzyskania zezwolenia na pracę Gwarantuje dostęp do opieki zdrowotnej, edukacji i usług publicznych Daje prawo do zasiłków rodzinnych, opiekuńczych i socjalnych, pod warunkami Ułatwia procedury meldunkowe, nadanie PESEL i inne formalności administracyjne Umożliwia korzystanie z publicznych przedszkoli i szkół na równych zasadach z Polakami Daje dostęp do rynku wynajmu mieszkań komunalnych i socjalnych (w niektórych samorządach) Ułatwia nostryfikację dyplomów oraz uznanie kwalifikacji zawodowych Gwarantuje świadczenia pieniężne i pomoc rzeczową w sytuacjach szczególnych (np. zakwaterowanie, żywność) Chroni przed deportacją i zapewnia ochronę czasową zgodną z decyzją UE Ustawa przewiduje dotacje celowe z budżetu państwa dla jednostek samorządu terytorialnego na zadania związane z pomocą obywatelom Ukrainy. W uzasadnieniach do wcześniejszych wersji ustawy mówiono, że osoby, które udzieliły zakwaterowania i wyżywienia Ukraińcom w lokalach prywatnych, mogły otrzymać świadczenie pieniężne — np. 40 zł dziennie maksymalnie przez 60 dni. Ustawa także ustanawia Fundusz Pomocy, z którego środki będą przeznaczone m.in. na dofinansowanie zadań pomocowych dla Ukraińców. Ustawa legislacyjnie wyraźnie adresuje Ukraińców (i ich małżonków, dzieci) — to nie dotyczy automatycznie wszystkich cudzoziemców czy mniejszości. To powoduje, że inne grupy znajdują się poza specjalnym zakresem ustawowym. To może być odbierane jako różnicowanie statusu prawnego. Z drugiej strony, istnieją mechanizmy ochrony czasowej w prawie UE, które mogą dotyczyć innych obywateli uciekających przed wojną, ale niekoniecznie dają identyczne uprawnienia, jakie specustawa przewiduje dla Ukraińców.",2,53,16,71,26-09-25,2187,282,,https://nitter.net/Edgar_Korona/status/1971617197052366999#m
147,BalliMarzec,Prezydent #Nawrocki podpisał ustawę o pomocy Ukraińcom. Znów nas oszukali. @NawrockiKn,1,10,13,24,26-09-25,86,11,,https://nitter.net/BalliMarzec/status/1971621152335581335#m
148,Polonus17,"Podpisał ustawę ukraińką,teraz zażąda krwi naszych dzieci! Nawrocki,masz u nas przejebane!",0,1,0,1,26-09-25,90,11,,https://nitter.net/Polonus17/status/1971634545868132600#m
149,WolnoscTV,Stało się‼️ Nawrocki podpisał ustawę o pomocy Ukraińcom!,19,31,165,215,26-09-25,56,8,,https://nitter.net/WolnoscTV/status/1971618592669233623#m
150,szef_dywizji,"PILNE ‼️ Do sieci wyciekło kompromitujące nagranie, z którego widać, że Karol Nawrocki kompletnie sobie nie radzi z angielskim 😜",35,653,95,783,25-09-25,128,20,,https://nitter.net/szef_dywizji/status/1971158675797705104#m
151,POPIS_Jedno_Zlo,"Szybko poszło. Nawrocki podpisal ustawę o pomocy dla Ukrów, w tym leczenie za darmo na ukraiński dowód. A Ty Polaku zdychaj pod płotem szpitala w kolejce na zabieg.",0,1,0,1,26-09-25,164,28,,https://nitter.net/POPIS_Jedno_Zlo/status/1971642877894971411#m
152,HubnerrMax,"Niektórym się wydaje, że Prezydent Nawrocki walczy w uczciwej grze. Tylko czekali, by zacząć narzekać. A to był jego dzień: ▪️ OSTATNIE pół roku wsparcia dla Ukraińców i wymuszenie ich PRACY W PL by odbierali świadczenia. ▪️ wywalenie wiatraków z ustawy o obniżeniu cen energii, którą zawetował. ▪️ wywalenie przechowywania gazu POZA granicami Polski z ustawy którą zawetował ▪️ zwyciestwo jego projektu Tak dla CPK w Sejmie i przegrana większości sejmowej Tuska. Otóż nie, Prezydent Nawrocki nie walczy w uczciwej grze. Walczy w ringu w którym nie jest okładany przez jednego przeciwnika, ale przez kilkuset naraz i to z widowni - nie dołączajcie do nich. Mimo tego, że jest na niego taki nierówny atak, ciosów unika, wyprowadza swoje i wychodzi w rundach zwycięsko. Z okazjonalnym nokautem, jak chociażby dzisiaj w Sejmie. Tak skutecznego Prezydenta w NAJSTRASZLIWSZYCH warunkach jakie można sobie wyobrazić, ze świecą szukać. Wywalczył praktycznie same sukcesy, jednoczesnie dzisiaj szachując rząd z pomocą dla Ukraińców od 4 marca. Jasno dał do zrozumienia, że następnych ustaw pomocowych dla UA nie podpisze, a to oznacza, że rząd musi wypracować nowy plan - to był jeden z resztą jeden z głównych powodów dla których Nawrocki MUSIAŁ podpisać tę zmienioną ustawę - burdel byłby niewiarygodny, a wszystko spadłoby nie na rząd, który za to odpowiada, tylko na Prezydenta, a wtedy bylibyśmy w dupie. Nikt by tyle nie osiągnął w takich warunkach to PKN. A mam wrażenie, ze robi to z palcem w nosie. Wystarczyło dzisiaj spojrzeć na Tuska w Sejmie. Nie zapominajcie o tym, żeby nie czytać polityki powierzchownie i zero-jedynkowo, bo na tym się zawsze człowiek przejedzie. Dziękuję za uwagę.",1,19,17,37,26-09-25,1690,268,,https://nitter.net/HubnerrMax/status/1971638568402460807#m
153,jazdar4,Banderowcy mają drugiego prezydenta w Polsce! II kadencję niech Nawrocki zabiega o głosy kumpli banderowców!!!! Dno !!!!,1,5,0,6,26-09-25,120,17,,https://nitter.net/jazdar4/status/1971616304303165682#m
154,KoronaWarszawa,❌Nawrocki podpisał anty - Polską ustawę o socjalu dla Ukraińców. Hańba❗️ wydarzenia.interia.pl/kraj/n…,3,86,59,148,26-09-25,102,12,,https://nitter.net/KoronaWarszawa/status/1971620695039005016#m
155,JacekWilkPL,Koniec złudzeń... ...Karol Nawrocki wchodzi w system Republiki Okrągłego Stołu.,1,95,78,174,26-09-25,79,10,,https://nitter.net/JacekWilkPL/status/1971533442040152325#m
156,AecioEscalante,"¿A estos los escogen, o llegan solos?... 😱😱 Un video del presidente de Polonia, Karol Nawrocki, sosteniendo una “bolsita blanca” en la ONU, desató un fuerte debate en redes sociales",18,652,48,718,26-09-25,181,30,,https://nitter.net/AecioEscalante/status/1971366519348351444#m
157,mute_observer1,"Karol Nawrocki, wiceprezydent Ukrainy.",0,21,9,30,26-09-25,38,4,,https://nitter.net/mute_observer1/status/1971620449621881169#m
158,HubnerrMax,"BARDZO WAŻNY KOMUNIKAT KANCELARII PREZYDENTA WS. POMOCY DLA UKRAIŃCÓW! ""To OSTATNIA USTAWA, którą Prezydent Nawrocki podpisuje ws. pomocy dla Ukrainy. ŻADNEJ INNEJ USTAWY już nie podpisze. Musimy wrócić do ich NORMALNEGO traktowania"". Ta ustawa obowiązuje tylko do marca.",13,132,181,326,26-09-25,271,38,,https://nitter.net/HubnerrMax/status/1971620676684730726#m
159,mute_observer1,"Po co jest Nawrocki? Po to, żeby wszystko zostało po staremu. To tyle, można się rozejść.",0,6,0,6,26-09-25,89,16,,https://nitter.net/mute_observer1/status/1971498616545231257#m
160,gryfnyhanys,Dziś prezydent Nawrocki stał się dla mnie Batyrem,1,7,7,15,26-09-25,49,8,,https://nitter.net/gryfnyhanys/status/1971624078835700050#m
161,PiotrSzumlewicz,"Na szczęście Karol Nawrocki nie uległ ksenofobicznemu szaleństwu i podpisał ustawę o pomocy Ukraińcom. Co prawda dał do zrozumienia, że lada dzień zgłosi rozwiązania antyukraińskie, ale na szczęście póki co zachował resztki odpowiedzialności i przyzwoitości.",0,1,0,1,26-09-25,258,35,,https://nitter.net/PiotrSzumlewicz/status/1971642146265702625#m
162,Nawrocki25,"Nowe przepisy, które wymusił na rządzie Prezydent Nawrocki, to ograniczenie przywilejów Ukraińców. Nikt nie może mieć większych praw w Polsce od Polaków!🇵🇱",25,76,117,218,26-09-25,155,22,,https://nitter.net/Nawrocki25/status/1971629644349952136#m
163,JusgloC33054,"Nie zdziwiłbym się gdyby te ukraińce nas szantażowały. Dzień po dronach było głosowanie o pomoc Ukrainie i nagle PiS wstrzymał się od głosu, do tego ciągle jakieś podpalenia, a teraz Nawrocki zmienia zdanie i podpisuje ustawę.",0,2,1,3,26-09-25,226,36,,https://nitter.net/JusgloC33054/status/1971622138198229139#m
164,pobozy,"🗯️ Polacy mają dość premiera Tuska i permanentnej walki zamiast pracy dla państwa. Gdyby Donald Tusk w jednej trzeciej był aktywny tak jak prezydent Karol Nawrocki, polskie sprawy byłyby dziś w zupełnie innym miejscu. 🇵🇱",0,28,12,40,26-09-25,220,35,,https://nitter.net/pobozy/status/1971630767915913510#m
165,AecioEscalante,"¿A estos los escogen, o llegan solos?... 😱😱 Un video del presidente de Polonia, Karol Nawrocki, sosteniendo una “bolsita blanca” en la ONU, desató un fuerte debate en redes sociales",18,652,48,718,26-09-25,181,30,,https://nitter.net/AecioEscalante/status/1971366519348351444#m
166,2025_EwaPolka,"🔴Tusk kolejny raz manipuluje i wprowadza w błąd opinię publiczną. Podczas mini konferencji w Sejmie mówi, iż Pan Prezydent dr Karol Nawrocki @NawrockiKn @Nawrocki25 @prezydentpl, chce większej władzy wbrew konstytucji. Nie mogę uwierzyć... Za daleko poszedłeś p. @donaldtusk, to ty łamiesz konstytucję i chcesz większej władzy. Nie widzisz tego, że za to co robisz jest wysoka odpowiedzialność karna? Bezczelność, kłamstwa i manipulacja to broń i działanie antypolskiego trollem. 👇 ‼️",4,143,21,168,26-09-25,484,70,,https://nitter.net/2025_EwaPolka/status/1971555366812213670#m
167,WolnoscTV,Stało się‼️ Nawrocki podpisał ustawę o pomocy Ukraińcom!,19,31,165,215,26-09-25,56,8,,https://nitter.net/WolnoscTV/status/1971618592669233623#m
168,MarcinPalade,"Prezydent podpisał ustawę o pomocy obywatelom Ukrainy. Szef KPRP @BoguckiZbigniew: ""To jest ostatnia ustawa, którą pan prezydent Nawrocki podpisuje, dotycząca takiej formy pomocy obywatelom Ukrainy. Żadnej innej takiej ustawy pan prezydent już nie podpisze. Musimy przejść na normalne warunki, czyli traktowanie obywateli Ukrainy przebywających na terytorium Polski, w taki sam sposób, jak innych obcokrajowców""",15,47,188,250,26-09-25,411,54,,https://nitter.net/MarcinPalade/status/1971611724433265150#m
169,EdwardChmielin3,Nawrocki pisze w tej chwili przekaz list do Prezydenta Trumpa z informacja co do twojej osoby żeby miał wiedzę z kim ma doczynienia żeby był ostrozny co do twojej osoby i wiarygodności,0,0,0,0,26-09-25,184,32,,https://nitter.net/EdwardChmielin3/status/1971643183986815192#m
170,KaziSmolinski,"Możemy kolejny raz powtórzyć ""dobrze, że prezydentem jest Nawrocki"". Rząd kolanem dopycha projekt ustawy, który se facto przenosi na polski grunt zamordyzm np. z Wielkiej Brytanii. Proponują cenzurę internetu, naloty policji na domy i kontrolę komunikatorów. Trzeba to zawetować!",1,52,10,63,26-09-25,279,39,,https://nitter.net/KaziSmolinski/status/1971474421375434883#m
171,Skoollman,"@NawrockiKn wprost powiedział Polakom: ""Macie zapierdalać, płacić podatki i oddawać wszystko Ukraińcom"". Nawrocki to drugi @AndrzejDuda – długopis Kaczyńskiego.",1,7,0,8,26-09-25,160,19,,https://nitter.net/Skoollman/status/1971616281653862839#m
172,1972tomek,Karol Nawrocki jednak za ukrainizacją. Podpisał dalsze finansowanie Ukraińców z kieszeni podatnika.,8,116,128,252,26-09-25,99,12,,https://nitter.net/1972tomek/status/1971615719906517347#m
173,Radio_Bialorus,‼️Prezydent 🇵🇱 Karol Nawrocki jednak zdecydował o podpisaniu ustawy dotyczącej pomocy dla obywateli 🇺🇦 Ukrainy — przekazał na konferencji prezydencki minister Zbigniew Bogucki. Banderyzacja Polski trwa w najlepsze.,0,27,14,41,26-09-25,214,28,,https://nitter.net/Radio_Bialorus/status/1971614850687324588#m
174,prezydentkarol,"‼️PODAJ DALEJ‼️ Nowe przepisy, które wymusił na rządzie Prezydent Nawrocki, to ograniczenie przywilejów Ukraińców. Nikt nie może mieć większych praw w Polsce od Polaków! 🇵🇱 #PoPierwszePolskaPoPierwszePolacy",1,20,9,30,26-09-25,206,26,,https://nitter.net/prezydentkarol/status/1971637437261898091#m
175,WirowskiJacek,Tusk ograł p.o.prezydenta.Nawrocki musiał podpisać ustawę bo w przeciwnym wypadku cały chaos wynikający z niepodpisania musiałby wziąć na siebie.A to oznaczałoby porażkę polityczną Boguckiego i Przydacza.,0,0,0,0,26-09-25,204,26,,https://nitter.net/WirowskiJacek/status/1971643677807357966#m
176,LeskiPiotr,"Prezydent Karol Nawrocki (25.08.2025): ""Nigdy nie zgodzę się na żadne przepisy, które gorzej traktują polskich obywateli, niż obywateli innego państwa"" Po czym dziś podpisuje ustawę, która gorzej traktuje Polaków, niż Ukraińców. Ależ słowny jest ten nasz Prezydent 😄🙈🙈🤦🤦",2,8,2,12,26-09-25,270,38,,https://nitter.net/LeskiPiotr/status/1971618550772387987#m
177,MarcinPalade,"Prezydent podpisał ustawę o pomocy obywatelom Ukrainy. Szef KPRP @BoguckiZbigniew: ""To jest ostatnia ustawa, którą pan prezydent Nawrocki podpisuje, dotycząca takiej formy pomocy obywatelom Ukrainy. Żadnej innej takiej ustawy pan prezydent już nie podpisze. Musimy przejść na normalne warunki, czyli traktowanie obywateli Ukrainy przebywających na terytorium Polski, w taki sam sposób, jak innych obcokrajowców""",15,48,188,251,26-09-25,411,54,,https://nitter.net/MarcinPalade/status/1971611724433265150#m
