id,username,text,likes,retweets,replies,total_interactions,post_date_iso,text_length,word_count,sentiment_label,link
1,Woloszanski2023,"Były MSZ w rządzie PiS, prof. Czaputowicz: Nawrocki nie pojechał wczoraj do Waszngtonu, bo nikt go tam nie chciał. W czasie ostatniej telekonferencji Nawrocki miał pouczać Trumpa, jak rozmawiać z Putinem i opowiadać o Bitwie Warszawskiej bez większego związku z tematem.",4,146,47,197,19-08-25,270,41,,https://nitter.net/Woloszanski2023/status/1957711892815761587#m
2,Dariusz_Jonski,Nawrocki będzie się uczył dyplomacji jak Duda angielskiego. Musimy być bardzo cierpliwi.,15,195,766,976,18-08-25,88,12,,https://nitter.net/Dariusz_Jonski/status/1957476885358686260#m
3,MSzurstor,"PiS obrzuca błotem Premiera Tuska, że nie pojechał do Białego Domu. Fakty? Premierów od 2008 r. tam nie zapraszają. Pominięto więc rezydenta Nawrockiego. Znowu odwracają kota ogonem.Nawrocki taki byl piękny Amerykanki, i co? i nic , i od premiera wara bo to nie jest wina jego i taka jest prawda",0,7,1,8,19-08-25,295,50,,https://nitter.net/MSzurstor/status/1957717770340016545#m
4,LilkaK664303,"Panie psycholog, Pan Prezydent Nawrocki nie należy do Koalicji Chętnych, to Donek w niej jest, ale go tam nie chcieli. Jeśli tak wyglądają twoje procesy kojarzeniowe, to ja bym twojej porady psychologicznej nie chciała. Nawet, gdybyś mi dopłacił.",0,1,0,1,19-08-25,246,38,,https://nitter.net/LilkaK664303/status/1957718319827390505#m
5,IIAnnaMagdalena,"To nie Nawrocki nie dotarł wczoraj do Białego Domu. To europejscy liderzy zepsuli mu plan lansu na ""nowego lidera Europy"" (to nie żart) planowany ""inauguracyjnym przytupem"" na 3 września i za wcześnie tam dotarli.. 😉Dlaczego przedstawiciele Kancelarii Prezydenta tak nerwowo reagują na informację, że do ostatnich chwil ""nie wykluczali jego uczestnictwa"", co byłoby logicznie spójne z zaplanowaną strategią i równie logicznym następstwem wykluczenia z rozmów Premiera Tuska? Bo równie logicznym następstwem są pytania, dlaczego finalnie wykluczyli? A odpowiedź jest przyziemnie prosta. Czym innym jest aranżowanie ustawek z telefonem w ręku, wykute na pamięć przemówienia, sztywny plan wizyt na najwyższym szczeblu z przyklejonym uśmiechem i uściskiem rąk, czym innym spontaniczne spotkania w gronie europejskich przywódców, nad którymi PR- owo zapanować się nie da. I tu dochodzimy do sedna. Nie mamy prezydenta międzynarodowego kalibru, sprawnie operującego językiem angielskim, wytrawnego gracza, wytrenowanego w rozmowach. Mamy kukłę z marnymi kompetencjami bez doświadczenia i obserwujemy usilne próby lepienia jej na podobiznę lidera. Niestety, kosztem niszczenia wiarygodności Polski.",16,405,124,545,19-08-25,1191,162,,https://nitter.net/IIAnnaMagdalena/status/1957677666884112424#m
6,ABNPoland,"Wczoraj debilu pisałeś, że to Prezydent Karol Nawrocki powinien brać udział w spotkaniu tej grupy! Ty pierdolnięty w mózg łomem debilu zapomniałeś co pisałeś wczoraj?! Masz kurwa i sam czytaj!",0,14,1,15,19-08-25,192,30,,https://nitter.net/ABNPoland/status/1957725000208662687#m
7,DariuszSmo,Fakty. To Żełeński zapraszał przywódców europejskich którzy towarzyszą mu w rozmowach z Trumpem. Żełenski nie zaprosił Nawrockiego bo go nie lubi za prawdę którą mówi o Ukrainie. Tuska nie zaprosił bo nic nie znaczy. Nawrocki jedzie do Trumpa na jego zaproszenie 3 września.,0,33,4,37,18-08-25,274,43,,https://nitter.net/DariuszSmo/status/1957562510531334431#m
8,wirtualnemedia,Karol @NawrockiKn nie odpuścił Onetowi ws. Grand Hotelu. Jest pozew cywilny i oskarżenie z art. 212 [NASZ NEWS] wirtualnemedia.pl/artykul/ka…,17,156,113,286,19-08-25,141,19,,https://nitter.net/wirtualnemedia/status/1957672587749720331#m
9,KoneserUnii,❗️PILNE❗️ Prezydent Karol Nawrocki mówi o dzisiejszym spotkaniu w Waszyngtonie. To wiele wyjaśnia,10,234,60,304,18-08-25,97,13,,https://nitter.net/KoneserUnii/status/1957376638410248496#m
10,RioGrande2025,Nawrocki zanim zaczął już się skończył!,0,0,0,0,19-08-25,39,6,,https://nitter.net/RioGrande2025/status/1957730298839376382#m
11,ok_graba,"A teraz wyobraźcie sobie to szczucie: 😱 „Nawrocki jak uczniak u Trumpa!” 😱 „Polska straciła suwerenność na rzecz USA” 😱 „Nowy Prezydent RP siedział na rogu jak stara panna” 😱 „Trump pokazał Nawrockiemu gdzie jego miejsce… [ZDJĘCIA]” Takie byłyby nagłówki, gdyby Karol Nawrocki zasiadł po drugiej stronie biurka. A tak muszą się szykować na eleganckie zdjęcia z wrześniowego bilateralnego spotkania Trump-Nawrocki. 😎",0,8,1,9,19-08-25,415,62,,https://nitter.net/ok_graba/status/1957718608563372068#m
12,to_be_honest9,"Nawrocki miał reprezentować Polskę i odmówił. Może to lepiej, niż kolejna kompromitacja po Dudzie, który również miał trudności w kontaktach z europejskimi liderami. PiS ma swojego człowieka, ale szkoda Polski. A moglibyśmy mieć prezydenta, który by nas godnie reprezentował.😔",0,0,0,0,19-08-25,276,39,,https://nitter.net/to_be_honest9/status/1957730287992922438#m
13,AnnaUrsz,"Prez. Nawrocki miał na dziś inne plany, ważniejsze niż tracenie czasu na wymianę pustych frazesów na temat: jak bardzo ważne jest to tracenie czasu na wymianie pustych frazesów. Pojedzie za 2 tyg i porozmawia na konkretne tematy bez plątających się mu pod nogami postpolityków",0,1,5,6,18-08-25,276,44,,https://nitter.net/AnnaUrsz/status/1957579724923777304#m
14,Jankowska_D,"Francuska telewizja TF1 wyjaśniła, dlaczego Nawrocki nie załapał się do pierwszego wagonu z delegacją do Trumpa i został odstawiony na boczny tor : „ponieważ polskim prezydentem został ultrakonserwatywny osobnik” i „nie chcieli, żeby im się plątał między nogami” Źródło poniżej.",26,341,83,450,18-08-25,278,40,,https://nitter.net/Jankowska_D/status/1957521764977897958#m
15,okiemtomkaw,Skład delegacji był uzgadniamy z Zeleńskim. Nawrocki po prostu nie został poproszony o uczestnictwo w niej.,0,2,0,2,19-08-25,107,16,,https://nitter.net/okiemtomkaw/status/1957703178620682437#m
16,OgladamW,"1) powiedziała ""dla obozu prezydenckiego, czy TEŻ DLA SAMEGO pana prezydenta Nawrockiego"", a nie ""tzw. pana prezydenta Nawrockiego"" 2) wielokrotnie w samej rozmowie posługiwała się różnymi formami ""pan prezydent"" ""prezydent Nawrocki"", więc żadnego dyshonoru nie zrobiła. 2/2",0,1,0,1,19-08-25,274,37,,https://nitter.net/OgladamW/status/1957718529031000071#m
17,KrzysztofK99597,"Poza tym o czym wy piep... Nawrocki zły, bo tępi nazizm banderowski w polityce państwowej i historycznej Ukrainy. Właśnie wspaniałe i szkoda, że został teraz prezydentem, a nie wcześniej, bo jakąkolwiek pomoc ze strony Polski powinna być powiązana z porzuceniem nazizmu przez UKR.",0,0,0,0,19-08-25,280,43,,https://nitter.net/KrzysztofK99597/status/1957730217717318112#m
18,WojPawelczyk,This one is real and even better than the fake picture that went viral yesterday 😂 Now imagine our new Poland First president Karol Nawrocki sitting in there with these globalist losers. I'm so glad he was absent.,0,2,1,3,19-08-25,213,38,,https://nitter.net/WojPawelczyk/status/1957720620030103626#m
19,p_figurski,"""Gdy będę prezydentem Rzeczypospolitej Polskiej, będę siedział przy wszelkich stołach negocjacyjnych dotyczących przyszłości Polski i naszego regionu"" - mówił Karol Nawrocki, gdy w lutym z @PatrykSlowik pytaliśmy o czasy, które właśnie nadeszły.",27,247,82,356,18-08-25,245,32,,https://nitter.net/p_figurski/status/1957445264676896928#m
20,gfkot,"Jeśli prezydent Polski jest jedynym liderem w Europie, to Nawrocki nie jest prezydentem 🤡",1,3,4,8,19-08-25,89,14,,https://nitter.net/gfkot/status/1957725356540019006#m
21,MarekJan772423,Nawrocki jest prezydentem tylko części Polski.,0,0,0,0,19-08-25,46,6,,https://nitter.net/MarekJan772423/status/1957730170569166978#m
22,Oltom154,Nie łżyj gamoniu. Pan prezydent Karol Nawrocki 3 września spotka się z prezydentem Trumpem w cztery oczy. Tymczasem Tusk i Zdradek mają całkowity szlaban na wstęp do Białego Domu. 😂🤣😂,0,1,0,1,19-08-25,183,30,,https://nitter.net/Oltom154/status/1957728609059090787#m
23,poselTTrela,"Trump przy stole z liderami Europy. Nawrocki przy stole w kuchni. Wystarczyło 13 dni, to będzie jeszcze większa błazenada niż za Dudy. #NiewidzialneKontakty",6,84,253,343,19-08-25,156,23,,https://nitter.net/poselTTrela/status/1957675429537489367#m
24,BatugWojciech,"-GW: Trump pokazał, jak niewiele dla niego znaczy Nawrocki, -Newsweek: Cyniczna kalkulacja Nawrockiego, sunął się w cień w kluczowym momencie, -Onet: Nawrocki bał się pojechać do Waszyngtonu. Dlaczego nie piszą o kompromitacji swoich liderów? Zero realizmu. Propaganda Matriksu.",4,89,11,104,19-08-25,278,38,,https://nitter.net/BatugWojciech/status/1957698202066399461#m
25,BoguslawGierak,"Pierdzielisz głupoty, Nawrocki miał gówno do gadania. Gdyby go zaprosili to popłynął by nawet na materacu dmuchanym do USA.",0,0,0,0,19-08-25,123,19,,https://nitter.net/BoguslawGierak/status/1957730143335501923#m
26,ABNPoland,"Wczoraj debilu pisałeś, że to Prezydent Karol Nawrocki powinien brać udział w spotkaniu tej grupy! Ty pierdolnięty w mózg łomem debilu zapomniałeś co pisałeś wczoraj?! Masz kurwa i sam czytaj!",0,14,1,15,19-08-25,192,30,,https://nitter.net/ABNPoland/status/1957725000208662687#m
27,adaskropka,"Gdyby lewica w Polsce była sprawna to od 2 dni słyszelibyśmy od nich tylko taki przekaz odnośnie rozmów z Trumpem - agresywny, prosty, napierdalający w rząd, PiS i Konfę. No ale niestety, debata została zmarginalizowana do napierdalanki Tusk vs Nawrocki. Tak się przegrywa.",0,3,7,10,18-08-25,273,43,,https://nitter.net/adaskropka/status/1957584290205605945#m
28,Piotr22188912,Ale ty masz świadomość że okazało się że tam gdzie policzyli jeszcze raz głosy to prokuratura się pomyliła i nawrocki miał więcej? Wiesz o tym prawda? Prawda?,0,0,0,0,19-08-25,158,27,,https://nitter.net/Piotr22188912/status/1957730127292359104#m
29,OgladamW,"Kochani, fakt-czeking, kolejny raz!! Ostatnio Kanał Zero i jachcy nie mają dobrego czasu. Jak nie wątek z ""KA-EN"" to teraz problemy ze słuchem i przypisywanie pani poseł Anicie Kucharskiej-Dziedzic, że powiedziała o Nawrockim per ""tzw. pan prezydent Nawrocki"", podczas gdy 1/2 nitter.net/jachcy/status/19577123…",1,7,1,9,19-08-25,311,42,,https://nitter.net/OgladamW/status/1957718517953761643#m
30,MalgosiaCal,"Prof. Czaputowicz w Poranku @Radio_TOK_FM: Nawrocki nie pojechał wczoraj do Waszngtonu, bo nikt go tam nie chciał. W czasie ostatniej telekonferencji Nawrocki miał pouczać Trumpa, jak rozmawiać z Putinem i opowiadać o Bitwie Warszawskiej bez większego związku z tematem. Dramat!",12,287,22,321,19-08-25,278,40,,https://nitter.net/MalgosiaCal/status/1957679074081427850#m
31,waldydzikowski,"Panie prezydencie Nawrocki. Polki i Polacy wciąż czekają na pana podpis pod ustawą, która obniży ceny energii dla milionów gospodarstw domowych. Tu nie ma co robić polityki, jeden podpis i ogromna ulga dla portfeli obywateli!",0,22,9,31,19-08-25,225,35,,https://nitter.net/waldydzikowski/status/1957713863102611921#m
32,GiertychRoman,W pierwszym tygodniu po wadliwym zaprzysiężeniu Nawrocki dopuścił się zdrady dyplomatycznej. Wyrzucił Polskę z najważniejszego formatu światowych przywódców. #ZdradaDyplomatyczna,21,886,464,1371,18-08-25,178,19,,https://nitter.net/GiertychRoman/status/1957396045073183111#m
33,CzcigodnaPolka,"Premier Tusk wyraźnie podkreślił, że będzie współpracował, poprosił o spotkanie, nie prowadził agresywnej narracji walki o krzesło przy stole, a Nawrocki oświadczył, że ma świetne stosunki z Trumpem - a nie ma go w USA. Dzisiaj trzeba zadać pytanie: jakie rodzaju są to stosunki?",1,7,3,11,19-08-25,279,44,,https://nitter.net/CzcigodnaPolka/status/1957722625150710251#m
34,Woloszanski2023,"Były MSZ w rządzie PiS, prof. Czaputowicz: Nawrocki nie pojechał wczoraj do Waszngtonu, bo nikt go tam nie chciał. W czasie ostatniej telekonferencji Nawrocki miał pouczać Trumpa, jak rozmawiać z Putinem i opowiadać o Bitwie Warszawskiej bez większego związku z tematem.",4,146,47,197,19-08-25,270,41,,https://nitter.net/Woloszanski2023/status/1957711892815761587#m
35,antek_emigrant_,Łysy Kłamco i Manipulancie!! Jeszcze raz..Prezydent Karol Nawrocki 2 razy przedstawił teraz stanowisko Polski..3 Września spotka się z Trumpem.. To spotkanie ma wymiar rządowy. Gdzie jest zatem tusk i sikorski? czemu nie zgłosili się? Niemcy nawet tuska nie chciały! Łgarnico!,0,6,0,6,19-08-25,276,40,,https://nitter.net/antek_emigrant_/status/1957689636039364762#m
36,jachcy,"Wielki człowiek, wielki krzyk, wielki wrzask i Rosja w sercu…🔥 ➡️„Panie Karolu Nawrocki co pan powiedział temu Trumpowi, że on tak nagle przyjaźnie do tego Putina podchodzi…”🤡",4,48,101,153,19-08-25,175,27,,https://nitter.net/jachcy/status/1957661463029649690#m
37,KONFEDERACJA_,"🇵🇱 @EwaZajaczkowska: Daliście Ukrainie wszystko, nie oczekując niczego w zamian! Andrzej Duda był bardziej prezydentem Ukrainy niż Polski. Mam nadzieję, że prezydent Nawrocki będzie rzecznikiem polskich interesów!",8,179,125,312,17-08-25,213,27,,https://nitter.net/KONFEDERACJA_/status/1956993345827618958#m
38,Woloszanski2023,"Były MSZ w rządzie PiS, prof. Czaputowicz: Nawrocki nie pojechał wczoraj do Waszngtonu, bo nikt go tam nie chciał. W czasie ostatniej telekonferencji Nawrocki miał pouczać Trumpa, jak rozmawiać z Putinem i opowiadać o Bitwie Warszawskiej bez większego związku z tematem.",4,146,47,197,19-08-25,270,41,,https://nitter.net/Woloszanski2023/status/1957711892815761587#m
39,Dariusz_Jonski,Nawrocki będzie się uczył dyplomacji jak Duda angielskiego. Musimy być bardzo cierpliwi.,15,195,766,976,18-08-25,88,12,,https://nitter.net/Dariusz_Jonski/status/1957476885358686260#m
40,MSzurstor,"PiS obrzuca błotem Premiera Tuska, że nie pojechał do Białego Domu. Fakty? Premierów od 2008 r. tam nie zapraszają. Pominięto więc rezydenta Nawrockiego. Znowu odwracają kota ogonem.Nawrocki taki byl piękny Amerykanki, i co? i nic , i od premiera wara bo to nie jest wina jego i taka jest prawda",0,7,1,8,19-08-25,295,50,,https://nitter.net/MSzurstor/status/1957717770340016545#m
41,LilkaK664303,"Panie psycholog, Pan Prezydent Nawrocki nie należy do Koalicji Chętnych, to Donek w niej jest, ale go tam nie chcieli. Jeśli tak wyglądają twoje procesy kojarzeniowe, to ja bym twojej porady psychologicznej nie chciała. Nawet, gdybyś mi dopłacił.",0,1,0,1,19-08-25,246,38,,https://nitter.net/LilkaK664303/status/1957718319827390505#m
42,IIAnnaMagdalena,"To nie Nawrocki nie dotarł wczoraj do Białego Domu. To europejscy liderzy zepsuli mu plan lansu na ""nowego lidera Europy"" (to nie żart) planowany ""inauguracyjnym przytupem"" na 3 września i za wcześnie tam dotarli.. 😉Dlaczego przedstawiciele Kancelarii Prezydenta tak nerwowo reagują na informację, że do ostatnich chwil ""nie wykluczali jego uczestnictwa"", co byłoby logicznie spójne z zaplanowaną strategią i równie logicznym następstwem wykluczenia z rozmów Premiera Tuska? Bo równie logicznym następstwem są pytania, dlaczego finalnie wykluczyli? A odpowiedź jest przyziemnie prosta. Czym innym jest aranżowanie ustawek z telefonem w ręku, wykute na pamięć przemówienia, sztywny plan wizyt na najwyższym szczeblu z przyklejonym uśmiechem i uściskiem rąk, czym innym spontaniczne spotkania w gronie europejskich przywódców, nad którymi PR- owo zapanować się nie da. I tu dochodzimy do sedna. Nie mamy prezydenta międzynarodowego kalibru, sprawnie operującego językiem angielskim, wytrawnego gracza, wytrenowanego w rozmowach. Mamy kukłę z marnymi kompetencjami bez doświadczenia i obserwujemy usilne próby lepienia jej na podobiznę lidera. Niestety, kosztem niszczenia wiarygodności Polski.",16,405,124,545,19-08-25,1191,162,,https://nitter.net/IIAnnaMagdalena/status/1957677666884112424#m
43,ABNPoland,"Wczoraj debilu pisałeś, że to Prezydent Karol Nawrocki powinien brać udział w spotkaniu tej grupy! Ty pierdolnięty w mózg łomem debilu zapomniałeś co pisałeś wczoraj?! Masz kurwa i sam czytaj!",0,14,1,15,19-08-25,192,30,,https://nitter.net/ABNPoland/status/1957725000208662687#m
44,DariuszSmo,Fakty. To Żełeński zapraszał przywódców europejskich którzy towarzyszą mu w rozmowach z Trumpem. Żełenski nie zaprosił Nawrockiego bo go nie lubi za prawdę którą mówi o Ukrainie. Tuska nie zaprosił bo nic nie znaczy. Nawrocki jedzie do Trumpa na jego zaproszenie 3 września.,0,33,4,37,18-08-25,274,43,,https://nitter.net/DariuszSmo/status/1957562510531334431#m
45,wirtualnemedia,Karol @NawrockiKn nie odpuścił Onetowi ws. Grand Hotelu. Jest pozew cywilny i oskarżenie z art. 212 [NASZ NEWS] wirtualnemedia.pl/artykul/ka…,17,156,113,286,19-08-25,141,19,,https://nitter.net/wirtualnemedia/status/1957672587749720331#m
46,KoneserUnii,❗️PILNE❗️ Prezydent Karol Nawrocki mówi o dzisiejszym spotkaniu w Waszyngtonie. To wiele wyjaśnia,10,234,60,304,18-08-25,97,13,,https://nitter.net/KoneserUnii/status/1957376638410248496#m
47,RioGrande2025,Nawrocki zanim zaczął już się skończył!,0,0,0,0,19-08-25,39,6,,https://nitter.net/RioGrande2025/status/1957730298839376382#m
48,ok_graba,"A teraz wyobraźcie sobie to szczucie: 😱 „Nawrocki jak uczniak u Trumpa!” 😱 „Polska straciła suwerenność na rzecz USA” 😱 „Nowy Prezydent RP siedział na rogu jak stara panna” 😱 „Trump pokazał Nawrockiemu gdzie jego miejsce… [ZDJĘCIA]” Takie byłyby nagłówki, gdyby Karol Nawrocki zasiadł po drugiej stronie biurka. A tak muszą się szykować na eleganckie zdjęcia z wrześniowego bilateralnego spotkania Trump-Nawrocki. 😎",0,8,1,9,19-08-25,415,62,,https://nitter.net/ok_graba/status/1957718608563372068#m
49,to_be_honest9,"Nawrocki miał reprezentować Polskę i odmówił. Może to lepiej, niż kolejna kompromitacja po Dudzie, który również miał trudności w kontaktach z europejskimi liderami. PiS ma swojego człowieka, ale szkoda Polski. A moglibyśmy mieć prezydenta, który by nas godnie reprezentował.😔",0,0,0,0,19-08-25,276,39,,https://nitter.net/to_be_honest9/status/1957730287992922438#m
50,AnnaUrsz,"Prez. Nawrocki miał na dziś inne plany, ważniejsze niż tracenie czasu na wymianę pustych frazesów na temat: jak bardzo ważne jest to tracenie czasu na wymianie pustych frazesów. Pojedzie za 2 tyg i porozmawia na konkretne tematy bez plątających się mu pod nogami postpolityków",0,1,5,6,18-08-25,276,44,,https://nitter.net/AnnaUrsz/status/1957579724923777304#m
51,Jankowska_D,"Francuska telewizja TF1 wyjaśniła, dlaczego Nawrocki nie załapał się do pierwszego wagonu z delegacją do Trumpa i został odstawiony na boczny tor : „ponieważ polskim prezydentem został ultrakonserwatywny osobnik” i „nie chcieli, żeby im się plątał między nogami” Źródło poniżej.",26,341,83,450,18-08-25,278,40,,https://nitter.net/Jankowska_D/status/1957521764977897958#m
52,okiemtomkaw,Skład delegacji był uzgadniamy z Zeleńskim. Nawrocki po prostu nie został poproszony o uczestnictwo w niej.,0,2,0,2,19-08-25,107,16,,https://nitter.net/okiemtomkaw/status/1957703178620682437#m
53,OgladamW,"1) powiedziała ""dla obozu prezydenckiego, czy TEŻ DLA SAMEGO pana prezydenta Nawrockiego"", a nie ""tzw. pana prezydenta Nawrockiego"" 2) wielokrotnie w samej rozmowie posługiwała się różnymi formami ""pan prezydent"" ""prezydent Nawrocki"", więc żadnego dyshonoru nie zrobiła. 2/2",0,1,0,1,19-08-25,274,37,,https://nitter.net/OgladamW/status/1957718529031000071#m
54,KrzysztofK99597,"Poza tym o czym wy piep... Nawrocki zły, bo tępi nazizm banderowski w polityce państwowej i historycznej Ukrainy. Właśnie wspaniałe i szkoda, że został teraz prezydentem, a nie wcześniej, bo jakąkolwiek pomoc ze strony Polski powinna być powiązana z porzuceniem nazizmu przez UKR.",0,0,0,0,19-08-25,280,43,,https://nitter.net/KrzysztofK99597/status/1957730217717318112#m
55,WojPawelczyk,This one is real and even better than the fake picture that went viral yesterday 😂 Now imagine our new Poland First president Karol Nawrocki sitting in there with these globalist losers. I'm so glad he was absent.,0,2,1,3,19-08-25,213,38,,https://nitter.net/WojPawelczyk/status/1957720620030103626#m
56,p_figurski,"""Gdy będę prezydentem Rzeczypospolitej Polskiej, będę siedział przy wszelkich stołach negocjacyjnych dotyczących przyszłości Polski i naszego regionu"" - mówił Karol Nawrocki, gdy w lutym z @PatrykSlowik pytaliśmy o czasy, które właśnie nadeszły.",27,247,82,356,18-08-25,245,32,,https://nitter.net/p_figurski/status/1957445264676896928#m
57,gfkot,"Jeśli prezydent Polski jest jedynym liderem w Europie, to Nawrocki nie jest prezydentem 🤡",1,3,4,8,19-08-25,89,14,,https://nitter.net/gfkot/status/1957725356540019006#m
58,MarekJan772423,Nawrocki jest prezydentem tylko części Polski.,0,0,0,0,19-08-25,46,6,,https://nitter.net/MarekJan772423/status/1957730170569166978#m
59,Oltom154,Nie łżyj gamoniu. Pan prezydent Karol Nawrocki 3 września spotka się z prezydentem Trumpem w cztery oczy. Tymczasem Tusk i Zdradek mają całkowity szlaban na wstęp do Białego Domu. 😂🤣😂,0,1,0,1,19-08-25,183,30,,https://nitter.net/Oltom154/status/1957728609059090787#m
60,poselTTrela,"Trump przy stole z liderami Europy. Nawrocki przy stole w kuchni. Wystarczyło 13 dni, to będzie jeszcze większa błazenada niż za Dudy. #NiewidzialneKontakty",6,84,254,344,19-08-25,156,23,,https://nitter.net/poselTTrela/status/1957675429537489367#m
61,BatugWojciech,"-GW: Trump pokazał, jak niewiele dla niego znaczy Nawrocki, -Newsweek: Cyniczna kalkulacja Nawrockiego, sunął się w cień w kluczowym momencie, -Onet: Nawrocki bał się pojechać do Waszyngtonu. Dlaczego nie piszą o kompromitacji swoich liderów? Zero realizmu. Propaganda Matriksu.",4,89,11,104,19-08-25,278,38,,https://nitter.net/BatugWojciech/status/1957698202066399461#m
62,BoguslawGierak,"Pierdzielisz głupoty, Nawrocki miał gówno do gadania. Gdyby go zaprosili to popłynął by nawet na materacu dmuchanym do USA.",0,0,0,0,19-08-25,123,19,,https://nitter.net/BoguslawGierak/status/1957730143335501923#m
63,ABNPoland,"Wczoraj debilu pisałeś, że to Prezydent Karol Nawrocki powinien brać udział w spotkaniu tej grupy! Ty pierdolnięty w mózg łomem debilu zapomniałeś co pisałeś wczoraj?! Masz kurwa i sam czytaj!",0,14,1,15,19-08-25,192,30,,https://nitter.net/ABNPoland/status/1957725000208662687#m
64,adaskropka,"Gdyby lewica w Polsce była sprawna to od 2 dni słyszelibyśmy od nich tylko taki przekaz odnośnie rozmów z Trumpem - agresywny, prosty, napierdalający w rząd, PiS i Konfę. No ale niestety, debata została zmarginalizowana do napierdalanki Tusk vs Nawrocki. Tak się przegrywa.",0,3,7,10,18-08-25,273,43,,https://nitter.net/adaskropka/status/1957584290205605945#m
65,Piotr22188912,Ale ty masz świadomość że okazało się że tam gdzie policzyli jeszcze raz głosy to prokuratura się pomyliła i nawrocki miał więcej? Wiesz o tym prawda? Prawda?,0,0,0,0,19-08-25,158,27,,https://nitter.net/Piotr22188912/status/1957730127292359104#m
66,OgladamW,"Kochani, fakt-czeking, kolejny raz!! Ostatnio Kanał Zero i jachcy nie mają dobrego czasu. Jak nie wątek z ""KA-EN"" to teraz problemy ze słuchem i przypisywanie pani poseł Anicie Kucharskiej-Dziedzic, że powiedziała o Nawrockim per ""tzw. pan prezydent Nawrocki"", podczas gdy 1/2 nitter.net/jachcy/status/19577123…",1,7,1,9,19-08-25,311,42,,https://nitter.net/OgladamW/status/1957718517953761643#m
67,MalgosiaCal,"Prof. Czaputowicz w Poranku @Radio_TOK_FM: Nawrocki nie pojechał wczoraj do Waszngtonu, bo nikt go tam nie chciał. W czasie ostatniej telekonferencji Nawrocki miał pouczać Trumpa, jak rozmawiać z Putinem i opowiadać o Bitwie Warszawskiej bez większego związku z tematem. Dramat!",12,287,22,321,19-08-25,278,40,,https://nitter.net/MalgosiaCal/status/1957679074081427850#m
68,waldydzikowski,"Panie prezydencie Nawrocki. Polki i Polacy wciąż czekają na pana podpis pod ustawą, która obniży ceny energii dla milionów gospodarstw domowych. Tu nie ma co robić polityki, jeden podpis i ogromna ulga dla portfeli obywateli!",0,22,9,31,19-08-25,225,35,,https://nitter.net/waldydzikowski/status/1957713863102611921#m
69,GiertychRoman,W pierwszym tygodniu po wadliwym zaprzysiężeniu Nawrocki dopuścił się zdrady dyplomatycznej. Wyrzucił Polskę z najważniejszego formatu światowych przywódców. #ZdradaDyplomatyczna,21,886,464,1371,18-08-25,178,19,,https://nitter.net/GiertychRoman/status/1957396045073183111#m
70,CzcigodnaPolka,"Premier Tusk wyraźnie podkreślił, że będzie współpracował, poprosił o spotkanie, nie prowadził agresywnej narracji walki o krzesło przy stole, a Nawrocki oświadczył, że ma świetne stosunki z Trumpem - a nie ma go w USA. Dzisiaj trzeba zadać pytanie: jakie rodzaju są to stosunki?",1,7,3,11,19-08-25,279,44,,https://nitter.net/CzcigodnaPolka/status/1957722625150710251#m
71,Kasia__SZ,"Najwyższa pora, żeby Nawrocki zrozumiał na jaki urząd się rzucił…. To już nie ustawki kibolskie i statki miłości…",0,0,0,0,19-08-25,113,18,,https://nitter.net/Kasia__SZ/status/1957730557137178772#m
72,irenagos,"Bajka o zapatrzonym w siebie gangsterze-bokserze i dyplomatycznym zerze... A morał z tej bajki niech będzie przestrogą, za pychę w polityce płaci się bardzo drogo... #ZdradaDyplomatyczna #KomuSłużyNawrocki wyborcza.pl/7,75399,32184360…",0,32,0,32,18-08-25,235,28,,https://nitter.net/irenagos/status/1957409847336435790#m
