id,username,text,likes,retweets,replies,total_interactions,post_date_iso,text_length,word_count,sentiment_label,link
161,HebdaJerzy,"Nawrocki wydalił z siebie: dziękuje Centkiewiczowi że znamy i mamy obowiązek mówić prawdę o Wałęsie. Panie Nawrocki też mamy obowiązek mówić że byłeś Pan Alfonsem,Kibolem, jesteś Oszustem i Ćpunem.,który skutek cudów nad urnami został prezydentem .",0,61,4,65,01-09-25,248,36,,https://nitter.net/HebdaJerzy/status/1962433607441514711#m
162,MyLordBebo,"🇩🇪🇵🇱 “Where is my money, Merz?” The President of Poland, Karol Nawrocki, stated that he demands reparations from Germany.",47,658,245,950,01-09-25,121,19,,https://nitter.net/MyLordBebo/status/1962425266640159037#m
163,ZlyDiabel,"Na pytanie dziennikarzy o ""statek miłości"", czyli o zajmowany apartament de Lux w Muzeum II Wojny Światowej, domniemany prezydent Nawrocki podawał 3 różne wersje: kwarantanna, praca i spotkania służbowe, prowadzenie dynamicznej polityki międzynarodowej. Nigdy, mimo próśb władz muzemu, nie zapłacił za rezerwację dwustu dni w apartamencie, w którym doba kosztuje ponad 700 zł. Mam zatem pytanie do domniemanej pierwszej damy Marty Nawrockiej z domu Smoleń. Pytanie 24. Podatników nie obchodzi czy za ""rejs statkiem miłości"", pani mąż podzieli się kosztami z Magdaleną Hajduk czy rachunki ureguluje sam, ale kiedy zapłaci ponad 140 tys zł. Muzemu II Wojny Światowej?",4,441,37,482,01-09-25,665,98,,https://nitter.net/ZlyDiabel/status/1962401913174901245#m
164,Tysolpl,Wobec łez młodej damy prezydent Karol Nawrocki nie przeszedł obojętnie ❤️ 45. rocznica powstania NSZZ „Solidarność” #45latNSZZSolidarność,52,653,216,921,31-08-25,137,17,,https://nitter.net/Tysolpl/status/1962160307972813022#m
165,AdamMoczar,"🚨🇵🇱 Polish President Karol Nawrocki: ""My Poland is a Poland without illegal migrants. It is a Poland where instead of integration centers, there are deportation centers for those who want to destroy our safety."" MEGA 🇪🇺🇪🇺",2,113,11,126,01-09-25,221,36,,https://nitter.net/AdamMoczar/status/1962602346417979578#m
166,HubnerrMax,"Prezydent RP Karol Nawrocki i szef BBN, Sławomir Cenckiewicz, na 86 rocznicy wybuchu II Wojny Światowej na Westerplatte. Niemcy płaczą, jak widzą.",6,345,103,454,01-09-25,146,22,,https://nitter.net/HubnerrMax/status/1962431108072583351#m
167,Wojtek_Hagen,"A jednak to prawda, że Bolek poleciał do USA szczuć na naszego Prezydenta, przed spotkaniem Trump-Nawrocki. Ależ to jest świnia, że zaraz się porzygam 🤮🤮🤮",14,466,416,896,31-08-25,154,25,,https://nitter.net/Wojtek_Hagen/status/1962076810914431421#m
168,krulbijedame,Sigma Nawrocki 😎🗿,32,534,229,795,01-09-25,17,3,,https://nitter.net/krulbijedame/status/1962466383414837361#m
169,DariuszMatecki,"Jeśli dla Kohuta Karol Nawrocki jest „gorszy” niż ludzie, którzy palili dzieci w piecach, to tracimy wszelkie granice przyzwoitości. ⛔️ Dość tego lewackie dranie!",3,352,33,388,01-09-25,162,24,,https://nitter.net/DariuszMatecki/status/1962542633865114096#m
170,Elisabe57236969,Zreperować to sobie możesz Nawrocki toaletę,0,0,0,0,02-09-25,43,6,,https://nitter.net/Elisabe57236969/status/1962702586156363909#m
171,OficjalneZero,"""Musimy w końcu załatwić kwestię reparacji od państwa niemieckiego, których jako prezydent Polski, dla dobra wspólnego się jednoznacznie domagam!"" - grzmiał na Westerplatte prezydent Nawrocki. 🎙️ Tak mocno nie mówił chyba jeszcze nikt. Czy w takim razie Karol Nawrocki będzie tym, któremu uda się wreszcie załatwić powracający jak bumerang temat? O tym @wina_Mazurka w najnowszym odcinku commentary.",0,97,57,154,01-09-25,399,57,,https://nitter.net/OficjalneZero/status/1962547258466894159#m
172,M_K_Ciepierski,"Jeden z najlepszych polskich dziennikarzy, Andrzej Stankiewicz ujawnia kim jest Karol Nawrocki. Z tego, kochani, powinien być taki dym, żeby tę patologię, zwaną PiS, zmiotło z powierzchni Ziemi.",7,413,162,582,01-12-24,194,28,,https://nitter.net/M_K_Ciepierski/status/1863120427976978859#m
173,GiertychRoman,"Niemcy wygnali mojego ojca i babcię z domu w którym mieszkali na Sadybie i cały dom razem z biblioteką dziadka spalili. Niektórzy po wojnie dostali domy od komunistów, ale mój dziadek z rodziną musiał uciekać z kraju, bo Cenckiewicz z UB chciał go zabić. Super, że Nawrocki obiecuje reparacje. Panie Karolu kiedy mogę się spodziewać przelewu?",20,736,620,1376,01-09-25,342,56,,https://nitter.net/GiertychRoman/status/1962546106044121234#m
174,ulchurska,Brawo Karol Nawrocki.Piekne zaoranie Trzaskowskiego👌👌👌👌,1,75,6,82,01-09-25,55,5,,https://nitter.net/ulchurska/status/1962444328434802904#m
175,Yarunia,"W Gdańsku - z którego pochodzi Nawrocki - II turę wyborów prezydenckich wygrał Rafał Trzaskowski z wynikiem 70,03% (206 127 głosów), a Karol Nikodemowicz Nawrocki uzyskał 29,97% (88 205 głosów). Tutaj najlepiej wiedzą, że to kumpel Wielkiego Bu, Śledzia i innych gangusów...",0,1,0,1,02-09-25,274,42,,https://nitter.net/Yarunia/status/1962695260099731676#m
176,Ewa0909Ewa,"WAŻNE‼️ Na czyje zlecenie działa Nawrocki, atakując ukraińskie dzieci i kobiety? Na kim wzoruje się sutener od Kaczyńskiego serwując exodus bezbronnym ofiarom wojny? Dlaczego w putinowskiej TV, Nawrocki jest wychwalany?",1,33,2,36,01-09-25,219,30,,https://nitter.net/Ewa0909Ewa/status/1962621211881378143#m
177,Kafir_PL,"Prezydent @NawrockiKn : ""Polski żołnierz musi wiedzieć, że gdy przyjdzie mu za Rzeczpospolitą umierać, to prezydent Polski i państwo polskie zawsze po niego wrócą, i nie po 80. latach, tylko szybko"" Panie Nawrocki, Polski Żołnierz przede wszystkim, powinien być dobrze dowodzony, wyposażony i wyszkolony, a umierać powinni wrogowie. On nie potrzebuje byś się Pan o jego trupach upominał tylko zrobił wszystko by wygrywał i przeżył.",3,45,16,64,01-09-25,431,65,,https://nitter.net/Kafir_PL/status/1962617407601619379#m
178,Jowita_W_,Niemcy i ruscy nie dowiedzą się o czym Nawrocki rozmawiał z Trumpem. To są bardzo dobre wieści dla Polski.,0,22,6,28,01-09-25,106,19,,https://nitter.net/Jowita_W_/status/1962612606759215491#m
179,DariuszMatecki,"Jeśli dla Kohuta Karol Nawrocki jest „gorszy” niż ludzie, którzy palili dzieci w piecach, to tracimy wszelkie granice przyzwoitości. ⛔️ Dość tego lewackie dranie!",3,352,33,388,01-09-25,162,24,,https://nitter.net/DariuszMatecki/status/1962542633865114096#m
180,KarolKotec81979,"Ujawnienie notatki MSZ dla prezydenta przed wyjazdem do USA , jest kolejnym dowodem jakim infantylnym , szkodliwym dla państwa stadem otoczýł się Nawrocki.",1,70,4,75,01-09-25,155,23,,https://nitter.net/KarolKotec81979/status/1962449666307498190#m
181,Hurriyet,"Polonya Cumhurbaşkanı Nawrocki, Almanya'dan İkinci Dünya Savaşı için tazminat istedi hurriyet.com.tr/dunya/polony…",0,0,0,0,02-09-25,114,11,,https://nitter.net/Hurriyet/status/1962704532158210313#m
182,julia3302,"Nikt nam nie zabroni mówić prawdy- darł się Nawrocki. Nam nikt nie zabroni się pytać, Nawrocki oddałeś już mieszkanie p.Jerzego?",0,179,21,200,31-08-25,128,20,,https://nitter.net/julia3302/status/1962210045417881806#m
183,MyLordBebo,"🇩🇪🇵🇱 “Where is my money, Merz?” The President of Poland, Karol Nawrocki, stated that he demands reparations from Germany.",47,658,245,950,01-09-25,121,19,,https://nitter.net/MyLordBebo/status/1962425266640159037#m
184,Bart_Wielinski,"Nikt nie zabroni nam opisywać rzetelnie i mówić prawdę o tym, kim był Karol Nawrocki",25,923,65,1013,31-08-25,84,15,,https://nitter.net/Bart_Wielinski/status/1962243822601019811#m
185,CzcigodnaPolka,"Nawrocki wprowadza nowe standardy, zaprosił kiboli, którzy gwizdali na Westerplatte i zakłócali uroczystości.",1,120,6,127,01-09-25,109,13,,https://nitter.net/CzcigodnaPolka/status/1962475484408676386#m
186,Dekondycja,"Sorry, głosowałam na niego, ale moim zdaniem przemówienie było słabe. Nawrocki kompletnie nie wyczuł klimatu naszych czasów - czasów, w których wolność słowa staje się pierwszą ofiarą składaną na ołtarzu tyranii. Przykład? Choćby Wielka Brytania. Hitleryzm nie był winą Nietzschego (bo do niego tutaj pije @NawrockiKn). Obwinianie XIX-wiecznych pozytywistów i racjonalistów za hitleryzm jest krótkowzroczne i w praktyce wybiela samych hitlerowców. Pozytywizm i racjonalizm stawiały na wartość jednostki, jej wolność i samodzielne poznanie - czyli wartości całkowicie sprzeczne z hitleryzmem, który postulował kult państwa i pogardę wobec jednostki. Hitler pokazał to dobitnie w ostatnich dniach wojny, gdy chciał poświęcić życie berlińskich cywili tylko po to, by ""zajęli"" Armię Czerwoną, podczas gdy jego armia już realnie nie istniała, choć on sam długo nie mógł w to uwierzyć. Nietzsche, mówiąc „Bóg umarł”, nie twierdził, że jakiś konkretny bóg istniał i faktycznie umarł (albo został zabity). To była metafora - obserwacja upadku tradycyjnej wiary w Boga i religii chrześcijańskiej w XIX-wiecznej Europie. To, czy religia jest wrogiem rozumu, to dyskusja stara jak świat. Dziś mamy dodatkowo badania pokazujące, że ludzie religijni są średnio szczęśliwsi, mniej zestresowani i że istnieją nawet „religijne obszary” w mózgu. Religia towarzyszyła cywilizacji od samych początków - mamy więc więcej danych, by odpowiedzieć na to pytanie. Nietzsche nie pisał też, że człowiek ma stać się bogiem w sensie dosłownym. W tym przemówieniu Nawrocki brzmi tak, jakby powielał błędy dawnych eugeników i faszystów, którzy wykorzystali filozofię Nietzschego (i nie tylko jego, bo też np. Darwina) do własnych celów. Nadczłowiekiem stawał się każdy człowiek, który wypełniał moralną pustkę po śmierci Boga. Można było stać się nadczłowiekiem samym dla siebie - i nie ma to nic wspólnego z władzą ani kultem jednostki. Każdy ateista w praktyce musi być takim nadczłowiekiem, bo musi sam skonstruować swoją moralność. Największy zarzut Nietzschego wobec religii był taki, że utrzymuje ona zależność norm moralnych od zewnętrznego autorytetu. I o to w tym chodziło - nie o to, żeby każdy został ateistą i odrzucił religię. Na marginesie: gimboateiści różnią się od ateistów tym, że nie traktują religii per se jako wroga. Podobnie zresztą gimbochrześcijanie różnią się od katolików. Jestem ateistką i - jak żartują znajomi - ostatnią żyjącą pozytywistką (nawet dostałam nagrodę organicznika XXI wieku). Więc mam focha. CC: @ABNPoland @Janusz1967 @HubnerrMax @katharoi_PL",0,0,0,0,02-09-25,2557,375,,https://nitter.net/Dekondycja/status/1962704031178011039#m
187,GiertychRoman,"Skoro pan Nawrocki wypomina Wałęsie przeszłość (rzekomą) sprzed 50 lat, to może odpowie na proste pytanie z przeszłości sprzed 10 lat: zapłacił panu Jerzemu za mieszkanie czy nie? Może któryś z dziennikarzy go zapyta?",16,1118,863,1997,01-09-25,217,34,,https://nitter.net/GiertychRoman/status/1962378748755366366#m
188,amazgula,"Nawrocki szczuje jak ruski agent. Zawetował wszystkie ustawy, aby upokorzyć walczących Ukraińców. Te dotyczące energii odnawialnej i uniezależnia Polski od ruskich dostaw węgla, gazu i ropy naftowej. Zgromadził wokół siebie ruskich zdrajców, nieodpowiedzialnych PiS-łajdaków kłamstwa, złodziejstwa i ruskiej propagandy. Podle okłamuje i szczuje na Polaków w imię Solidarności. Nie ukrywa, że walczy z polskim rządem i UE. Odmówił spotkania z przebywającą w Polsce panią Przewodniczącą Komisji Europejskiej Ursula von der Leyen. Kogo ty draniu Nawrocki reprezentujesz? Wszystkich Polaków z pewnością nie, więc tylko bandytów polskich i agenturę współczesnej rusko–kościelnej Targowicy. Nawrocki jest kolejnym dzieciakiem z piaskownicy albo groźnym wrogiem Polski. Zdrajcą na urzędzie. Dziś znowu szczuł na Niemców i żądał od nich odszkodowań, chociaż jego PiS w 2006 roku zrzekł się ich publicznie. Jasne, że powinny one być, za napaść na Polskę, za miliony zagazowany i zamordowanych, za zrównane z ziemią miasta i krzywdy narodu. Jednak od kogo? Polska od Niemców otrzymała Warmię, Mazury, Pomorze, Ziemię Lubuską, Dolny i Górny Śląsk, które okradli i spustoszyli Sowieci, zanim nam oddali. Ruscy siłą zabrali nam pół Polski, wymordowali elity, w tym oficerów, wywieźli miliony Polaków na nieludzką ziemię, ukradli na pół wieku niepodległość, a Putin jeszcze teraz przetrzymuje wrak i grozi wojną o jego prawa do Polski, bo tak zdecydowała kiedyś Jałta. To nie od Rosji Nawrocki chce reparacji? Dlaczego od Niemców, bo tak wygodniej atakować Unie Europejską w interesie Rosji? Niemcy w ramach UE dają nam potężne fundusze, w zamian za praworządności i demokrację. Głupi rodacy myślą, że te pieniądze, to dla nich, a to tylko nęcisko polityczne dla frajerów. Przecież żadnych reparacji nie będzie, a tylko PiS-łajdaki i Konfederacja skłócają nas z całym światem, bo takie kłamstwo łykają z zachwytem parafialne pelikany. Podziwiają odwagę ubliżania Niemcom, Unii Europejskiej w imię Putina. Batyr wykorzystuje pazerność prostackich parafian i skłóca nas ze wszystkimi. Liczy na niezrównoważonego Trumpa, który spowodował chaos w świecie i zawiązanie się wielkiej antyamerykańskiej i antyeuropejskiej koalicji Chin, Rosji, Korei Płn., Iranu i wielu innych znaczących państw świata. Karol Nawrocki nie rozumie, że to przyjaźń, solidarność, współdziałanie buduje wielkość narodów, a nie wojna, zdrada i wrogość historyczna wokół naszych granic. Nawrocki się puszy, jest szczęśliwy, jak panuje, komuś dokopie, kogoś poniży. Jego urzędnicy zioną ogniem agresji i niekompetencji. Przecież to nieodpowiedzialne pieniactwo, które nie ma racjonalnego uzasadnienia u lidera narodu. Panie Nawrocki, szkodzi Pan Polsce i Polakom, jest Pan zdrajcą narodu niszczącym jedność narodową i solidarność Polaków. Jesteś najgorszą odmianą bandyty nie tylko politycznego na urzędzie w Polsce. Mam nadzieję, że uda się w końcu przeliczyć głosy wyborcze, rozliczyć PiS-zamach na wybory i zamiast na urzędzie, po prostu drania tam nie będzie. Adam Mazguła",0,83,9,92,01-09-25,3030,435,,https://nitter.net/amazgula/status/1962613251113656516#m
189,Osadpolityczny,"Zaczekamy, zobaczymy. Póki co Pan Nawrocki rozjeżdża byłego prezydenta merytorycznie nawet nie wychodząc z pałacu więc na jego miejscu siedziałbym póki co - dość cicho.",0,0,0,0,02-09-25,168,25,,https://nitter.net/Osadpolityczny/status/1962703885769855262#m
190,Wiesci24pl,Dlaczego uzurpator Karol Nawrocki nie domaga się reparacji od Rosji? wiesci24.pl/2025/09/01/dlacz…,0,35,17,52,01-09-25,98,11,,https://nitter.net/Wiesci24pl/status/1962440326120890686#m
191,sierpowy_prawy,"Miłosz zauważyłeś jak Prezydent zasiewa ziarno w dzieciakach którzy za 4-5 lat nabędą prawa wyborcze? Akcja z kebsem wWolanowie, złożenie kwiatów z 14 latkiem, poczytałem komentarze,Nawrocki staje się ich idolem, wzorem.Nawrocki bedzie odbierał elektorat Konfie która zachowuje...",0,1,1,2,02-09-25,280,37,,https://nitter.net/sierpowy_prawy/status/1962672041900789811#m
192,Yarunia,"Dlaczego Nawrocki nie domaga się reparacji wojennych od Rosji, która okupowała Polskę od 1939 do 1989r, odebrała 48% terytorium II RP i nasze reparacje od Niemiec (które straciły na rzecz Polski 20% swojego terytorium, z zasobami, miastami, przemysłem itp)? Bo #PiStoRosja...",0,0,0,0,02-09-25,275,41,,https://nitter.net/Yarunia/status/1962703670438486270#m
193,GiertychRoman,"Niemcy wygnali mojego ojca i babcię z domu w którym mieszkali na Sadybie i cały dom razem z biblioteką dziadka spalili. Niektórzy po wojnie dostali domy od komunistów, ale mój dziadek z rodziną musiał uciekać z kraju, bo Cenckiewicz z UB chciał go zabić. Super, że Nawrocki obiecuje reparacje. Panie Karolu kiedy mogę się spodziewać przelewu?",20,736,620,1376,01-09-25,342,56,,https://nitter.net/GiertychRoman/status/1962546106044121234#m
194,Magdale24976570,Pan Prezydent Karol Nawrocki ♥️🇵🇱♥️🇵🇱♥️🇵🇱♥️🇵🇱♥️🇵🇱♥️ ❗️❗️❗️❗️❗️❗️❗️❗️❗️❗️❗️,1,139,51,191,01-07-25,74,6,,https://nitter.net/Magdale24976570/status/1940098671263269191#m
195,magdazwarmii,Nawrocki obraził Lecha Wałęsę na obchodach 45. rocznicy Sierpnia. Bardziej sponiewierać urzędu prezydenta już nie można.,16,533,475,1024,31-08-25,120,16,,https://nitter.net/magdazwarmii/status/1962125816323547274#m
196,szefernaker,"Prezydent Karol Nawrocki nie zmarnuje ani jednego dnia tej prezydentury. Dziękujemy, że jesteście z nami! 🇵🇱👍",18,564,170,752,01-09-25,109,16,,https://nitter.net/szefernaker/status/1962585097305031017#m
197,HebdaJerzy,"Nawrocki wydalił z siebie: dziękuje Centkiewiczowi że znamy i mamy obowiązek mówić prawdę o Wałęsie. Panie Nawrocki też mamy obowiązek mówić że byłeś Pan Alfonsem,Kibolem, jesteś Oszustem i Ćpunem.,który skutek cudów nad urnami został prezydentem .",0,61,4,65,01-09-25,248,36,,https://nitter.net/HebdaJerzy/status/1962433607441514711#m
198,MyLordBebo,"🇩🇪🇵🇱 “Where is my money, Merz?” The President of Poland, Karol Nawrocki, stated that he demands reparations from Germany.",47,658,245,950,01-09-25,121,19,,https://nitter.net/MyLordBebo/status/1962425266640159037#m
199,ZlyDiabel,"Na pytanie dziennikarzy o ""statek miłości"", czyli o zajmowany apartament de Lux w Muzeum II Wojny Światowej, domniemany prezydent Nawrocki podawał 3 różne wersje: kwarantanna, praca i spotkania służbowe, prowadzenie dynamicznej polityki międzynarodowej. Nigdy, mimo próśb władz muzemu, nie zapłacił za rezerwację dwustu dni w apartamencie, w którym doba kosztuje ponad 700 zł. Mam zatem pytanie do domniemanej pierwszej damy Marty Nawrockiej z domu Smoleń. Pytanie 24. Podatników nie obchodzi czy za ""rejs statkiem miłości"", pani mąż podzieli się kosztami z Magdaleną Hajduk czy rachunki ureguluje sam, ale kiedy zapłaci ponad 140 tys zł. Muzemu II Wojny Światowej?",4,441,37,482,01-09-25,665,98,,https://nitter.net/ZlyDiabel/status/1962401913174901245#m
200,Tysolpl,Wobec łez młodej damy prezydent Karol Nawrocki nie przeszedł obojętnie ❤️ 45. rocznica powstania NSZZ „Solidarność” #45latNSZZSolidarność,52,653,216,921,31-08-25,137,17,,https://nitter.net/Tysolpl/status/1962160307972813022#m
